title,url,date
"Cumhurbaşkanı Erdoğan, Finlandiya Cumhurbaşkanı Niinistö ile bir araya geldi",https://www.tccb.gov.tr/assets/video/2021B/2021-09-22-abd-05-finlandiya.mp4,22.09.2021
"Cumhurbaşkanı Erdoğan, BM Genel Sekreteri Guterres ile görüştü",https://www.tccb.gov.tr/assets/video/2021B/2021-09-19-abd-05-bmgensek.mp4,19.09.2021
"Emine Erdoğan, ""Osmanlı’nın Amerika’sı” isimli belgesel filmin ABD’de düzenlenen tanıtımına katıldı",https://www.tccb.gov.tr/assets/video/2021B/2021-09-19-abd-07-ee-belgesel.mp4,19.09.2021
TÜRKEN Heyetini Kabul,https://www.tccb.gov.tr/assets/video/2021B/2021-09-19-abd-06-turken.mp4,19.09.2021
"Emine Erdoğan, “Afrika Seyahatlerim” adlı ilk kitabının tanıtımını New York’ta yaptı",https://www.tccb.gov.tr/assets/video/2021B/2021-09-21-abd-08-ee-kitap.mp4,21.09.2021
"Cumhurbaşkanı Erdoğan, BM 76. Genel Kurulu'na katılmak üzere ABD'ye gitti",https://www.tccb.gov.tr/assets/video/2021B/2021-09-19-havalimani-bt.mp4,19.09.2021
"Cumhurbaşkanı Erdoğan'ın, Türk-Amerikan Ulusal Yönlendirme Komitesi tarafından düzenlenen “Daha Adil Bir Dünya Mümkün” başlıklı konferansta yaptığı konuşma",https://www.tccb.gov.tr/assets/video/2021B/2021-09-19-abd-02-konferans.mp4,19.09.2021
Türkiye İhracatçılar Meclisi 28. Olağan Genel Kurulu ve İhracatın Şampiyonları Ödül Töreni (Wyndham Grand Levent),https://www.tccb.gov.tr/assets/video/2021B/2021-09-18-tim.mp4,18.09.2021
AK Parti Mersin Genişletilmiş İl Danışma Toplantısı (Atatürk Kültür Merkezi),https://www.tccb.gov.tr/assets/video/2021B/2021-09-17-mersin-01-ildanisma.mp4,17.09.2021
Mersin Toplu Açılış Töreni (Cumhuriyet Meydanı),https://www.tccb.gov.tr/assets/video/2021B/2021-09-17-mersin-02-topluacilis.mp4,17.09.2021
"Cumhurbaşkanı Erdoğan, Mersin’de gençlerle bir araya geldi",https://www.tccb.gov.tr/assets/video/2021B/2021-09-17-gencler.mp4,17.09.2021
2021 Unesco Ahi Evran Anma Yılı – Ahi Evran İzinde Esnaf Buluşması (Cacabey Meydanı),https://www.tccb.gov.tr/assets/video/2021B/2021-09-16-kirsehir-ahi.mp4,16.09.2021
6. Anadolu Medya Ödülleri (Cumhurbaşkanlığı Külliyesi),https://www.tccb.gov.tr/assets/video/2021B/2021-09-15-medya.mp4,15.09.2021
"Cumhurbaşkanı Recep Tayyip Erdoğan, Türkiye İşçi Sendikaları Konfederasyonu’na (TÜRK-İŞ) bağlı farklı sektörlerde çalışan işçilerle, Cumhurbaşkanlığı Külliyesinde bir araya geldi.",https://www.tccb.gov.tr/assets/video/2021B/2021-09-14-isciler.mp4,14.09.2021
Sırbistan Ulusal Meclis Başkanı Ivıca Daçiç’i Kabul (Cumhurbaşkanlığı Külliyesi),https://www.tccb.gov.tr/assets/video/2021B/2021-09-14-sirbistan.mp4,14.09.2021
Sakarya Zaferi’nin 100.Yılı Kutlama Programı (Duatepe Program Alanı / Polatlı),https://www.tccb.gov.tr/assets/video/2021B/2021-09-13-sakarya.mp4,13.09.2021
Şişecam Polatlı Fabrikası Yeni Üretim Hattı Açılış Töreni (Şişecam Polatlı Fabrikası),https://www.tccb.gov.tr/assets/video/2021B/2021-09-13-sisecam.mp4,13.09.2021
MÜSİAD 26. Olağan Genel Kurulu (İstanbul Kongre Merkezi),https://www.tccb.gov.tr/assets/video/2021B/2021-09-11-musiad.mp4,11.09.2021
AK Parti Kahramanmaraş Genişletilmiş İl Danışma Toplantısı (Mehmet Akif Ersoy Kültür Merkezi),https://www.tccb.gov.tr/assets/video/2021B/2021-09-10-maras-01-ildanisma.mp4,10.09.2021
Kahramanmaraş Toplu Açılış Töreni (Milli İrade Meydanı),https://www.tccb.gov.tr/assets/video/2021B/2021-09-10-maras-02-topluacilis.mp4,10.09.2021
Gana Büyüküleçisi Francisca Ashietey-Odunton’un Güven Mektubu Takdim Töreni (Cumhurbaşkanlığı Külliyesi),https://www.tccb.gov.tr/assets/video/2021B/2021-09-09-gana.mp4,09.09.2021
İsviçre Büyükelçisi Jean Daniel Ruch’un Güven Mektubu Takdim Töreni (Cumhurbaşkanlığı Külliyesi),https://www.tccb.gov.tr/assets/video/2021B/2021-09-09-isvicre.mp4,09.09.2021
"Emine Erdoğan, Sıfır Atık Kısa Film Yarışması Ödül Töreni'ne katıldı",https://www.tccb.gov.tr/assets/video/2021B/2021-09-08-ee-sifiratik.mp4,08.09.2021
"Emine Erdoğan, Matbaanın Ön Sözü ""Basmacı İbrahim Efendi"" Müteferrika Sergisi’nin açılışını yaptı",https://www.tccb.gov.tr/assets/video/2021B/2021-09-06-ee-matbaa.mp4,06.09.2021
"Cumhurbaşkanı Erdoğan'ın, Kongo Cumhurbaşkanı Tshilombo ile düzenlediği ortak basın toplantısı",https://www.tccb.gov.tr/assets/video/2021B/2021-09-07-kongo-bt.mp4,07.09.2021
2021-2022 Eğitim Öğretim Yılı Açılış Programı (Sultanahmet Mesleki ve Teknik Anadolu Lisesi ),https://www.tccb.gov.tr/assets/video/2021B/2021-09-06-egitim.mp4,06.09.2021
"Cumhurbaşkanlığı Kabinesi, Cumhurbaşkanı Erdoğan başkanlığında toplandı",https://www.tccb.gov.tr/assets/video/2021B/2021-09-06-kabine.mp4,06.09.2021
"Cumhurbaşkanı Erdoğan'ın, Cumhurbaşkanlığı Kabinesi Toplantısı’nın ardından yaptığı açıklama",https://www.tccb.gov.tr/assets/video/2021B/2021-09-06-bt.mp4,06.09.2021
"Emine Erdoğan, “Asırlık Tariflerle Türk Mutfağı” kitabının tanıtım programına katıldı",https://www.tccb.gov.tr/assets/video/2021B/2021-09-04-ee-kitap.mp4,04.09.2021
"Salarha Tüneli Açılış Töreni (Salarha Tüneli Önü, Dörtyol Mahallesi/ Rize)",https://www.tccb.gov.tr/assets/video/2021B/2021-09-04-rize-tunel.mp4,04.09.2021
"“Bilimin, araştırmanın, geliştirmenin ve yenilikçiliğin kök salmadığı bir şehrin, diğer alanlarda hedeflerine ulaşması mümkün değildir”",https://www.tccb.gov.tr/assets/video/2021B/2021-09-04-rize-fakulte.mp4,04.09.2021
AK Parti Rize Genişletilmiş İl Danışma Toplantısı (İsmail Kahraman Kültür Merkezi),https://www.tccb.gov.tr/assets/video/2021B/2021-09-04-rize-akparti.mp4,04.09.2021
İyidere-İkizdere Yolu ve Tünelleri Açılış Töreni (İyidere-İkizdere Yolu 24. Km Güneyce Köyü/Rize),https://www.tccb.gov.tr/assets/video/2021B/2021-09-03-rize.mp4,03.09.2021
2021 yılı Öğretmen Atama Töreni (Haliç Kongre Merkezi ),https://www.tccb.gov.tr/assets/video/2021B/2021-09-03-atama.mp4,03.09.2021
Filipinler Büyükelçisi Maria Elena Palo Algabre’nin Güven Mektubunu Takdim Töreni (Cumhurbaşkanlığı Külliyesi),https://www.tccb.gov.tr/assets/video/2021B/2021-09-01-filipinler.mp4,01.09.2021
Bolivya Büyükelçisi Edgar Adolfo Sejas Vera’nın Güven Mektubunu Takdim Töreni (Cumhurbaşkanlığı Külliyesi),https://www.tccb.gov.tr/assets/video/2021B/2021-09-01-bolivya.mp4,01.09.2021
Tacikistan Büyükelçisi Ashrafjon Sheralievich Gulov’un Güven Mektubunu Takdim Töreni (Cumhurbaşkanlığı Külliyesi),https://www.tccb.gov.tr/assets/video/2021B/2021-09-01-tacikistan.mp4,01.09.2021
Yargıtay Yeni Hizmet Binası ve 2021-2022 Adli Yıl Açılış Töreni (Yargıtay Başkanlığı Yeni Hizmet Binası),https://www.tccb.gov.tr/assets/video/2021B/2021-09-01-adliyil.mp4,01.09.2021
Jandarma ve Sahil Güvenlik Akademisi Başkanlığı Subay ve Astsubay Öğrencileri Mezuniyet Töreni (Jandarma Ve Sahil Güvenlik Akademisi Başkanlığı/ Beytepe),https://www.tccb.gov.tr/assets/video/2021B/2021-09-01-jandarma.mp4,01.09.2021
"Emine Erdoğan, sel felaketinin yaşandığı Kastamonu’nun Bozkurt ilçesini ziyaret etti",https://www.tccb.gov.tr/assets/video/2021B/2021-08-31-ee-bozkurt.mp4,31.08.2021
Milli Savunma Üniversitesi Deniz ve Hava Harp Okulu Diploma Alma ve Sancak Devir Teslim Töreni (Deniz Harp Okulu / Tuzla),https://www.tccb.gov.tr/assets/video/2021B/2021-08-31-msu.mp4,31.08.2021
"30 Ağustos Zafer Bayramı: Cumhurbaşkanı Erdoğan, Anıtkabir’de düzenlenen törene katıldı",https://www.tccb.gov.tr/assets/video/2021A/2021-08-30-zaferbayrami-01-anitkabir.mp4,30.08.2021
Milli Savunma Bakanlığı Ay Yıldız Projesi Temel Atma Töreni (Bağlıca Şantiyesi),https://www.tccb.gov.tr/assets/video/2021A/2021-08-30-msb.mp4,30.08.2021
30 Ağustos Zafer Bayramı Tebriklerini Kabul (Cumhurbaşkanlığı Külliyesi),https://www.tccb.gov.tr/assets/video/2021A/2021-08-30-zaferbayrami-02-kulliye.mp4,30.08.2021
Milli Savunma Üniversitesi Kara Harp Okulu Diploma Alma ve Sancak Devir Teslim Töreni (Kara Harp Okulu),https://www.tccb.gov.tr/assets/video/2021A/2021-08-30-msu.mp4,30.08.2021
"“Taarruzi İnsansız Hava Aracımız Akıncı ile birlikte Türkiye, bu teknolojide dünyanın en ileri üç ülkesinden biri olmuştur”",https://www.tccb.gov.tr/assets/video/2021A/2021-08-29-akinci1.mp4,29.08.2021
"Cumhurbaşkanı Erdoğan, Karadağ Başbakanı Krivokapiç ile görüştü",https://www.tccb.gov.tr/assets/video/2021A/2021-08-28-karadag-05-basbakan.mp4,28.08.2021
"Cumhurbaşkanı Erdoğan, Karadağ Parlamento Başkanı Beçiç ile bir araya geldi",https://www.tccb.gov.tr/assets/video/2021A/2021-08-28-karadag-06-parlemento.mp4,28.08.2021
"“Türkiye, Karadağ’a en fazla yatırım yapan ilk 10 ülke arasında yer alıyor”",https://www.tccb.gov.tr/assets/video/2021A/2021-08-28-karadag-07-bt.mp4,28.08.2021
"Cumhurbaşkanı Erdoğan'ın, Bosna-Hersek'e hareketinden önce düzenlediği basın toplantısı",https://www.tccb.gov.tr/assets/video/2021A/2021-08-27-bosna-01-aciklama.mp4,27.08.2021
"Emine Erdoğan, Saraybosna’da Aliya İzzetbegoviç Vakfını ziyaret etti",https://www.tccb.gov.tr/assets/video/2021A/2021-08-27-bosna-02-ee-vakif.mp4,27.08.2021
"Cumhurbaşkanı Erdoğan'ın, Malazgirt Zaferi’nin 950. yıl dönümü kutlama programında yaptığı konuşma",https://www.tccb.gov.tr/assets/video/2021A/2021-08-25-bitlis-03-malazgirt.mp4,25.08.2021
"Cumhurbaşkanı Erdoğan'ın, Genç Dostu Şehirler Kongre ve Sergisi’nin açılışında yaptığı konuşma",https://www.tccb.gov.tr/assets/video/2021A/2021-08-24-ato.mp4,24.08.2021
"Cumhurbaşkanı Erdoğan'ın, AK Parti Genişletilmiş İl Başkanları Toplantısı’nda yaptığı konuşma",https://www.tccb.gov.tr/assets/video/2021A/2021-08-24-ilbaskanlari.mp4,24.08.2021
2020 Tokyo Olimpiyat Oyunlarında Madalya Alan Milli Sporcular ile Akşam Yemeği (Cumhurbaşkanlığı Külliyesi),https://www.tccb.gov.tr/assets/video/2021A/2021-08-19-kabine-aciklama.mp4,19.08.2021
Kabine Toplantısı (Cumhurbaşkanlığı Külliyesi),https://www.tccb.gov.tr/assets/video/2021A/2021-08-19-kabine.mp4,19.08.2021
"Cumhurbaşkanı Erdoğan'ın, Cumhurbaşkanlığı Kabinesi Toplantısı’nın ardından yaptığı açıklama",https://www.tccb.gov.tr/assets/video/2021A/2021-08-19-kabine-aciklama.mp4,19.08.2021
"Cumhurbaşkanı Erdoğan'ın, Etiyopya Federal Cumhuriyeti Başbakanı Ali ile düzenlediği ortak basın toplantısı",https://www.tccb.gov.tr/assets/video/2021A/2021-08-18-etiyopya-03-bt.mp4,18.08.2021
İDEF’21 15’inci Uluslararası Savunma Sanayii Fuarı Açılış Töreni (TÜYAP Fuar ve Kongre Merkezi),https://www.tccb.gov.tr/assets/video/2021A/2021-08-17-idef.mp4,17.08.2021
Sierra Leone Cumhurbaşkanı Julius Maada Bio ile Görüşme (Devlet Konukevi),https://www.tccb.gov.tr/assets/video/2021A/2021-08-17-sierra.mp4,17.08.2021
"Cumhurbaşkanı Erdoğan'ın, Ankara’da 26 yeni fabrika ve altyapıların açılış töreninde yaptığı konuşma",https://www.tccb.gov.tr/assets/video/2021A/2021-08-16-fabrika.mp4,16.08.2021
"Cumhurbaşkanı Erdoğan'ın, Pakistan MİLGEM Korvet Projesi’nin birinci gemisinin denize indirilmesi töreninde yaptığı konuşma",https://www.tccb.gov.tr/assets/video/2021A/2021-08-15-milgem.mp4,15.08.2021
"Cumhurbaşkanı Erdoğan'ın, sel felaketinden etkilenen Kastamonu Bozkurt’ta yaptığı konuşma",https://www.tccb.gov.tr/assets/video/2021A/2021-08-15-kastamonu.mp4,15.08.2021
"“Sudan halkının ve devletinin yanında olmaya, dayanışma içinde ilişkileri sürdürmeye kararlıyız""",https://www.tccb.gov.tr/assets/video/2021A/2021-08-12-sudan-bt.mp4,12.08.2021
Libya Başbakanı Abdülhamid Dibeybe ile Başbaşa Görüşme ve Heyetler Halinde Görüşme (Vahdettin Köşkü),https://www.tccb.gov.tr/assets/video/2021A/2021-08-07-libya.mp4,07.08.2021
"Cumhurbaşkanı Recep Tayyip Erdoğan, Cuma namazı kıldığı Çilehane Camisi’nden çıkışında gazetecilerin gündeme ilişkin sorularını cevaplandırdı.",https://www.tccb.gov.tr/assets/video/2021A/2021-08-06-cuma.mp4,06.08.2021
MGK Toplantısı (Cumhurbaşkanlığı Külliyesi),https://www.tccb.gov.tr/assets/video/2021A/2021-08-05-mgk.mp4,05.08.2021
Yüksek Askeri Şura Toplantısı (Cumhurbaşkanlığı Külliyesi),https://www.tccb.gov.tr/assets/video/2021A/2021-08-04-sura.mp4,04.08.2021
Anıtkabir’i Ziyaret,https://www.tccb.gov.tr/assets/video/2021A/2021-08-04-anitkabir.mp4,04.08.2021
"Cumhurbaşkanı Erdoğan, MHP Genel Başkanı Bahçeli ile bir araya geldi",https://www.tccb.gov.tr/assets/video/2021A/2021-08-04-devletbahceli.mp4,04.08.2021
"Cumhurbaşkanı Erdoğan, A Haber-ATV özel yayınına katıldı",https://www.tccb.gov.tr/assets/video/2021A/2021-08-04-ortakyayin.mp4,04.08.2021
"Cumhurbaşkanı Erdoğan, Devlet Bilgi Koordinasyon Merkezi'nde yangınlar hakkında bilgi aldı",https://www.tccb.gov.tr/assets/video/2021A/2021-08-03-krizmerkezi.mp4,03.08.2021
"Cumhurbaşkanı Erdoğan, Manavgat’ta orman yangınlarından etkilenen vatandaşlarla bir araya geldi",https://www.tccb.gov.tr/assets/video/2021A/2021-07-31-antalya-mahalle.mp4,31.07.2021
"Cumhurbaşkanı Erdoğan'ın, Marmaris’te yangından etkilenen bölgelerdeki incelemelerinin ardından yaptığı konuşma",https://www.tccb.gov.tr/assets/video/2021A/2021-07-31-marmaris.mp4,31.07.2021
"Cumhurbaşkanı Erdoğan'ın, Cuma namazı sonrasında basın mensuplarının sorusuna verdiği cevap",https://www.tccb.gov.tr/assets/video/2021A/2021-07-30-cuma.mp4,30.07.2021
"Emine Erdoğan, Enpati Hayvan Dostu Şehirler ödül törenine katıldı",https://www.tccb.gov.tr/assets/video/2021A/2021-07-28-ee-belediye.mp4,28.07.2021
"Cumhurbaşkanı Erdoğan'ın, Sakarya Türkali-2 kuyusu doğal gaz akış testi programına yaptığı konuşma",https://www.tccb.gov.tr/assets/video/2021A/2021-07-28-dogalgaz.mp4,28.07.2021
“Türkiye terörle mücadelede Angola’nın da yanında yer alacaktır”,https://www.tccb.gov.tr/assets/video/2021A/2021-07-27-angola-bt.mp4,27.07.2021
"Cumhurbaşkanı Erdoğan, Kurban Bayramı Namazı’nı Lefkoşa Hala Sultan Camii’nde kıldı",https://www.tccb.gov.tr/assets/video/2021A/2021-07-20-kktc-bayramnamazi.mp4,20.07.2021
"Emine Erdoğan, KKTC’de Girne Belediyesi Sosyal Yaşam Merkezi’ni ziyaret etti",https://www.tccb.gov.tr/assets/video/2021A/2021-07-20-kktc-ee-sergi.mp4,20.07.2021
"Cumhurbaşkanı Erdoğan, KKTC'de gençlerle bir araya geldi",https://www.tccb.gov.tr/assets/video/2021A/2021-07-20-kktc-gencler.mp4,20.07.2021
Kurban Bayramı Mesajı,https://www.tccb.gov.tr/assets/video/2021A/2021-07-19-kurban.mp4,19.07.2021
"“Kıbrıs Türk halkı, eşit ortağı olduğu Ada’da egemen eşitliğe ve eşit uluslararası statüye sahiptir”",https://www.tccb.gov.tr/assets/video/2021A/2021-07-19-havalimani-bt.mp4,19.07.2021
"“Kıbrıs Davası’nın sahibi, yavru vatanı ile ana vatanı ile büyük Türk Milleti’nin tamamıdır”",https://www.tccb.gov.tr/assets/video/2021A/2021-07-19-kktc-meclis.mp4,19.07.2021
"Ak Parti Erzurum Genişletilmiş İl Danışma Toplantısı (15 Temmuz Milli İrade Salonu, Atatürk Üniversitesi)",https://www.tccb.gov.tr/assets/video/2021A/2021-07-16-erzurum-02-ildanisma.mp4,16.07.2021
"Erzurum Şehir Hastanesi, İl Emniyet Müdürlüğü Hizmet Binası, Canlı Hayvan Pazarı ile Yapımı Tamamlanan Diğer Projelerin Açılış Töreni (Cumhuriyet Caddesi)",https://www.tccb.gov.tr/assets/video/2021A/2021-07-16-erzurum-01-topluacilis.mp4,16.07.2021
"Cumhurbaşkanı Erdoğan, Cuma namazını Ayasofya-i Kebir Cami-i Şerifinde kıldı",https://www.tccb.gov.tr/assets/video/2021A/2021-07-15-cuma.mp4,15.07.2021
Milli Savunma Üniversitesi Kuvvet Harp Enstitüleri 8’inci Dönem Karargah Subaylığı ve 3’üncü Dönem Komuta ve Kurmay Eğitimi Mezuniyet Töreni (MSÜ Atatürk Harp Oyunu ve Kültür Merkezi Yenilevent / İstanbul),https://www.tccb.gov.tr/assets/video/2021A/2021-07-15-mezuniyet.mp4,15.07.2021
15 Temmuz Şehitlerini Anma Programı (TBMM),https://www.tccb.gov.tr/assets/video/2021A/2021-07-15-tbmm.mp4,15.07.2021
Galatasaray SK Başkanı Burak Elmas’ı Kabul (Cumhurbaşkanlığı Külliyesi),https://www.tccb.gov.tr/assets/video/2021A/2021-07-15-burakelmas.mp4,15.07.2021
"Cumhurbaşkanı Recep Tayyip Erdoğan, 15 Temmuz Demokrasi ve Millî Birlik Günü anma programları kapsamında, Cumhurbaşkanlığı Külliyesinden millete sesleniş konuşması gerçekleştirdi.",https://www.tccb.gov.tr/assets/video/2021A/2021-07-15-milleteseslenis.mp4,15.07.2021
AK Parti Grup Toplantısı (TBMM),https://www.tccb.gov.tr/assets/video/2021A/2021-07-14-akparti.mp4,14.07.2021
Malezya Uluslararası Ticaret ve Sanayi Bakanı Mohamed Azmin Ali’yi Kabul (Cumhurbaşkanlığı Külliyesi),https://www.tccb.gov.tr/assets/video/2021A/2021-07-14-malezya.mp4,14.07.2021
Bartın – Kurucaşile Yolu Açılış Törenine Canlı Bağlantı (Cumhurbaşkanlığı Külliyesi),https://www.tccb.gov.tr/assets/video/2021A/2021-07-14-acilis.mp4,14.07.2021
Türkiye Gençlik Zirvesi (Beştepe Millet Kongre ve Kültür Merkezi),https://www.tccb.gov.tr/assets/video/2021A/2021-07-12-genclik.mp4,12.07.2021
Kabine Toplantısı (Cumhurbaşkanlığı Külliyesi) Program Arşivi  |   Frekans Bilgileri,https://www.tccb.gov.tr/assets/video/2021A/2021-07-12-kabine.mp4,12.07.2021
"Cumhurbaşkanı Erdoğan'ın, Cumhurbaşkanlığı Kabinesi Toplantısı’nın ardından yaptığı açıklama",https://www.tccb.gov.tr/assets/video/2021A/2021-07-12-kabine-bt.mp4,12.07.2021
Filistin Devlet Başkanı Mahmud Abbas ile Görüşme (Vahdettin Köşkü),https://www.tccb.gov.tr/assets/video/2021A/2021-07-10-filistin.mp4,10.07.2021
"Emine Erdoğan, devlet korumasındaki çocukların hazırladığı tiyatro gösterisini izledi",https://www.tccb.gov.tr/assets/video/2021A/2021-07-10-ee-sanat.mp4,10.07.2021
AK Parti Diyarbakır Genişletilmiş İl Danışma Toplantısı (Sezai Karakoç Kültür Merkezi),https://www.tccb.gov.tr/assets/video/2021/2021-08-09-diyarbakir-01-ildanisma.mp4,09.08.2021
"Cumhurbaşkanı Erdoğan, evlat nöbeti tutan Diyarbakır Anneleri’ni ziyaret etti",https://www.tccb.gov.tr/assets/video/2021/2021-08-09-diyarbakir-02-diyarbakiranneleri.mp4,09.08.2021
Genişletilmiş İl Başkanları Toplantısı (AK Parti Genel Merkezi),https://www.tccb.gov.tr/assets/video/2021A/2021-07-08-ilbaskanlari.mp4,08.07.2021
"“Ülkemizi savunma sanayiinde dışa bağımlılıktan tamamen kurtarıncaya kadar, yatırımlarımızı artırarak devam ettireceğiz”",https://www.tccb.gov.tr/assets/video/2021A/2021-07-08-baglanti.mp4,08.07.2021
"Cumhurbaşkanı Erdoğan'ın, Diyarbakır’da toplu açılış töreninde yaptığı konuşma",https://www.tccb.gov.tr/assets/video/2021A/2021-08-09-diyarbakir-03-topluacilis.mp4,09.08.2021
TOKİ 1.000.000’uncu Konut Anahtar Teslim Töreni (Sincan Saraycık TOKİ Konutları),https://www.tccb.gov.tr/assets/video/2021A/2021-07-07-sincan-toki.mp4,07.07.2021
Suyun Gücü Milletle Buluşuyor Toplu Açılış Töreni (Cumhurbaşkanlığı Külliyesi),https://www.tccb.gov.tr/assets/video/2021A/2021-07-05-suyun-gucu.mp4,05.07.2021
Kabine Toplantısı (Cumhurbaşkanlığı Külliyesi),https://www.tccb.gov.tr/assets/video/2021A/2021-07-05-kabine.mp4,05.07.2021
“Yıl sonunda tarihimizde ilk defa 200 milyar doların üzerinde bir ihracata imza atacağız”,https://www.tccb.gov.tr/assets/video/2021A/2021-07-05-kabine-bt.mp4,05.07.2021
Tank Palet Fabrikasında İnceleme (Arifiye / Sakarya),https://www.tccb.gov.tr/assets/video/2021/2021-07-02-sakarya-03-tankpalet.mp4,02.07.2021
AK Parti Sakarya Genişletilmiş İl Danışma Toplantısı (NG Sapanca Otel),https://www.tccb.gov.tr/assets/video/2021/2021-07-02-sakarya-04-ildanisma.mp4,02.07.2021
Kadına Yönelik Şiddetle Mücadele 4. Ulusal Eylem Planı Tanıtım Toplantısı (Beştepe Millet Kongre ve Kültür Merkezi),https://www.tccb.gov.tr/assets/video/2021/2021-07-01-mucadele.mp4,01.07.2021
AK Parti Grup Toplantısı (TBMM),https://www.tccb.gov.tr/assets/video/2021/2021-06-30-akparti.mp4,30.06.2021
"Emine Erdoğan, “Koruyucu Aile Günü” tanıtım programına katıldı",https://www.tccb.gov.tr/assets/video/2021/2021-06-30-ee-aile.mp4,30.06.2021
Emine Erdoğan “Gıdanı Koru Sofrana Sahip Çık” etkinliğine katıldı,https://www.tccb.gov.tr/assets/video/2021/2021-06-30-ee-gida.mp4,30.06.2021
TÜRKSAT 5A Uydusu Hizmete Alma Töreni (TÜRKSAT Genel Müdürlüğü / Gölbaşı),https://www.tccb.gov.tr/assets/video/2021/2021-06-28-turksat.mp4,28.06.2021
Kanal İstanbul Sazlıdere Köprüsü Temel Atma Töreni (Sazlıdere Barajı Mevkii - Başakşehir),https://www.tccb.gov.tr/assets/video/2021/2021-06-26-kanalistanbul.mp4,26.06.2021
AK Parti Hatay Genişletilmiş İl Danışma Toplantısı (Ottoman Otel),https://www.tccb.gov.tr/assets/video/2021/2021-06-25-hatay-03-ildanisma.mp4,25.06.2021
"Cumhurbaşkanı Erdoğan, Kadına Karşı Şiddetle Mücadele İstişare Toplantısı'na başkanlık etti",https://www.tccb.gov.tr/assets/video/2021A/2021-06-24-toplanti.mp4,24.06.2021
Tataristan Cumhurbaşkanı Rüstem Minnihanov’u Kabul (Cumhurbaşkanlığı Külliyesi),https://www.tccb.gov.tr/assets/video/2021A/2021-06-24-tataristan.mp4,24.06.2021
Ruanda Büyükelçisi Fidelis Ntampaka Mironko’nun Güven Mektubunu Takdim Töreni (Cumhurbaşkanlığı Külliyesi),https://www.tccb.gov.tr/assets/video/2021A/2021-06-23-ruanda.mp4,23.06.2021
Gambiya Büyükelçisi Sering Modou Njie'nin Güven Mektubunu Takdim Töreni (Cumhurbaşkanlığı Külliyesi),https://www.tccb.gov.tr/assets/video/2021A/2021-06-23-gambiya.mp4,23.06.2021
Nijerya Büyükelçisi İsmail Yusuf Abba'nın Güven Mektubunu Takdim Töreni (Cumhurbaşkanlığı Külliyesi),https://www.tccb.gov.tr/assets/video/2021A/2021-06-23-nijerya.mp4,23.06.2021
"Emine Erdoğan, ROKETSAN Sıfır Atık Projesi Lansmanı programına katıldı",https://www.tccb.gov.tr/assets/video/2021A/2021-06-23-ee-roketsan.mp4,23.06.2021
“Milletimizin sağlığını ve refahını güvence altına almak için kendi aşımıza sahip olmamız kritik öneme sahiptir”,https://www.tccb.gov.tr/assets/video/2021A/2021-06-22-yerliasi.mp4,22.06.2021
"Emine Erdoğan, “Dokuma Atlası Sergisi”nin açılış törenine katıldı",https://www.tccb.gov.tr/assets/video/2021A/2021-06-22-ee-sergi.mp4,22.06.2021
“Son 19 yılda hayata geçirdiğimiz reformlarla mahallî idarelerin gücünü ve hizmet kabiliyetini daha da artırdık”,https://www.tccb.gov.tr/assets/video/2021A/2021-06-23-belediye-baskanlari.mp4,23.06.2021
Kabine Toplantısı (Cumhurbaşkanlığı Külliyesi),https://www.tccb.gov.tr/assets/video/2021A/2021-06-21-kabine.mp4,21.06.2021
"“1 Temmuz itibarıyla başlamak üzere, sokağa çıkma kısıtlamalarını tümüyle kaldırıyoruz”",https://www.tccb.gov.tr/assets/video/2021A/2021-06-21-kabine-bt.mp4,21.06.2021
NG Phaselis Bay Oteli Açılışı (Kemer/Antalya),https://www.tccb.gov.tr/assets/video/2021A/2021-06-19-antalya-otel.mp4,19.06.2021
AK Parti Antalya İl Teşkilatı ile Toplantı (Maxx Royal Otel),https://www.tccb.gov.tr/assets/video/2021A/2021-06-19-antalya-akparti.mp4,19.06.2021
"Cumhurbaşkanı Erdoğan'ın, Antalya Diplomasi Forumu’nda yaptığı konuşma",https://www.tccb.gov.tr/assets/video/2021/2021-06-18-antalya-01-forum.mp4,18.06.2021
"Cumhurbaşkanı Erdoğan, Karadağ Cumhurbaşkanı Djukanovic ile bir araya geldi",https://www.tccb.gov.tr/assets/video/2021/2021-06-18-antalya-02-karadag.mp4,18.06.2021
"Cumhurbaşkanı Erdoğan, Kenya Cumhurbaşkanı Kenyatta ile bir araya geldi",https://www.tccb.gov.tr/assets/video/2021/2021-06-18-antalya-03-kenya.mp4,18.06.2021
"Cumhurbaşkanı Erdoğan, Kosova Cumhurbaşkanı Osmani-Sadriu ile görüştü",https://www.tccb.gov.tr/assets/video/2021/2021-06-18-antalya-04-kosova.mp4,18.06.2021
"Cumhurbaşkanı Erdoğan, Haiti Cumhurbaşkanı Moise ile görüştü",https://www.tccb.gov.tr/assets/video/2021/2021-06-18-antalya-05-haiti.mp4,18.06.2021
"Cumhurbaşkanı Erdoğan, Sırbistan Başbakanı Brnabic’i kabul etti",https://www.tccb.gov.tr/assets/video/2021/2021-06-17-antalya-01-sirbistan.mp4,17.06.2021
"Cumhurbaşkanı Erdoğan, Hırvatistan Başbakanı Plenkovic’i kabul etti",https://www.tccb.gov.tr/assets/video/2021/2021-06-17-antalya-02-hirvatistan.mp4,17.06.2021
"“Türkiye, önümüzdeki dönemde de bölgenin barış, istikrar, huzur ve refahı için katkılarını sürdürecektir”",https://www.tccb.gov.tr/assets/video/2021A/2021-06-17-antalya-05-zirve-bt.mp4,17.06.2021
"Cumhurbaşkanı Erdoğan, Kuzey Makedonya Cumhurbaşkanı Pendarovski ile bir araya geldi",https://www.tccb.gov.tr/assets/video/2021A/2021-06-17-antalya-06-makedonya.mp4,17.06.2021
"Cumhurbaşkanı Erdoğan, Bosna-Hersek Devlet Başkanlığı Konseyi üyeleriyle görüştü",https://www.tccb.gov.tr/assets/video/2021A/2021-06-17-antalya-07-bosna.mp4,17.06.2021
"Cumhurbaşkanı Erdoğan'ın, Azerbaycan Millî Meclisi’nde yaptığı konuşma",https://www.tccb.gov.tr/assets/video/2021/2021-06-15-azerbaycan-05-meclis.mp4,15.06.2021
"Cumhurbaşkanı Erdoğan, Azerbaycan Cumhurbaşkanı Aliyev ile Fuzuli'de bir araya geldi",https://www.tccb.gov.tr/assets/video/2021/2021-06-15-azerbaycan-01-susa.mp4,15.06.2021
"Cumhurbaşkanı Erdoğan'ın, Azerbaycan Cumhurbaşkanı İlham Aliyev’le düzenlediği ortak basın toplantısı",https://www.tccb.gov.tr/assets/video/2021/2021-06-15-azerbaycan-04-bt.mp4,15.06.2021
"Cumhurbaşkanı Erdoğan, Birleşik Krallık Başbakanı Johnson’la ile bir araya geldi",https://www.tccb.gov.tr/assets/video/2021/2021-06-13-nato-06-birlesikkrallik.mp4,13.06.2021
"Cumhurbaşkanı Erdoğan, Almanya Başbakanı Merkel ile görüştü",https://www.tccb.gov.tr/assets/video/2021/2021-06-13-nato-08-almanya.mp4,13.06.2021
