date,title,translated_title,file,link
20.02.2016,‘UNESCO Gastronomi Kenti: Gaziantep’ Programında Yaptıkları Konuşma,"Speech at the ""UNESCO City of Gastronomy: Gaziantep"" Program",PresSpeech912.txt,https://www.tccb.gov.tr/konusmalar/353/39884/unesco-gastronomi-kenti-gaziantep-programinda-yaptiklari-konusma
17.02.2016,İkinci Mülki Amirler Toplantısı’nda Yaptıkları Konuşma,Speech Delivered at the Second Civil Chiefs Meeting,PresSpeech913.txt,https://www.tccb.gov.tr/konusmalar/353/39883/ikinci-mulki-amirler-toplantisinda-yaptiklari-konusma
11.02.2016,TÜGİK Genel Kurulu’nda Yaptıkları Konuşma,Speech at the General Assembly of TÜGİK,PresSpeech914.txt,https://www.tccb.gov.tr/konusmalar/353/38794/tugik-genel-kurulunda-yaptiklari-konusma
10.02.2016,20. Muhtarlar Toplantısı’nda Yaptıkları Konuşma,Speech Delivered at the 20th Meeting of Mukhtars,PresSpeech915.txt,https://www.tccb.gov.tr/konusmalar/353/38785/20-muhtarlar-toplantisinda-yaptiklari-konusma
10.02.2016,Milli Eğitim Bakanlığı 30 Bin Öğretmen Atama Töreni’nde Yaptıkları Konuşma,Speech at the Ministry of National Education's 30 Thousand Teachers Appointment Ceremony,PresSpeech916.txt,https://www.tccb.gov.tr/konusmalar/353/39829/milli-egitim-bakanligi-30-bin-ogretmen-atama-toreninde-yaptiklari-konusma
09.02.2016,Sigarayı Bırakma Günü Münasebetiyle Düzenlenen Resepsiyonda Yaptıkları Konuşma,Speech at the Reception on the occasion of the Day to Stop Smoking,PresSpeech917.txt,https://www.tccb.gov.tr/konusmalar/353/38769/sigarayi-birakma-gunu-munasebetiyle-duzenlenen-resepsiyonda-yaptiklari-konusma
28.01.2016,“Yeni Anayasa İçin Hep Birlikte” Temalı Programda Yaptıkları Konuşma,"Speech in the ""Together for the New Constitution"" Themed Program",PresSpeech918.txt,https://www.tccb.gov.tr/konusmalar/353/38673/yeni-anayasa-icin-hep-birlikte-temali-programda-yaptiklari-konusma
26.01.2016,Kaymakamlar Toplantısı’nda Yaptıkları Konuşma,Speech at the District Governors Meeting,PresSpeech919.txt,https://www.tccb.gov.tr/konusmalar/353/38674/kaymakamlar-toplantisinda-yaptiklari-konusma
24.01.2016,Kayseri Ticaret Odası’nın ‘120. Onur Yılı Programı’nda Yaptıkları Konuşma,Kayseri Chamber of Commerce '120. Speech Delivered at the Honors Year Program,PresSpeech920.txt,https://www.tccb.gov.tr/konusmalar/353/39828/kayseri-ticaret-odasinin-120-onur-yili-programinda-yaptiklari-konusma
20.01.2016,19. Muhtarlar Toplantısı’nda Yaptıkları Konuşma,Speech Delivered at the 19th Mukhtars Meeting,PresSpeech921.txt,https://www.tccb.gov.tr/konusmalar/353/38597/19-muhtarlar-toplantisinda-yaptiklari-konusma
14.01.2016,99 Baraj Ve Hidroelektrik Santralinin Toplu Açılış Töreni’nde Yaptıkları Konuşma,Speech Delivered at the Collective Opening Ceremony of 99 Dams and Hydroelectric Power Plants,PresSpeech922.txt,https://www.tccb.gov.tr/konusmalar/353/37571/99-baraj-ve-hidroelektrik-santralinin-toplu-acilis-toreninde-yaptiklari-konusma
12.01.2016,8. Büyükelçiler Konferansı Vesilesiyle Düzenlenen Yemekte Yaptıkları Konuşma,Speech Delivered at the Dinner on the Occasion of the 8th Ambassadors Conference,PresSpeech923.txt,https://www.tccb.gov.tr/konusmalar/353/37541/8-buyukelciler-konferansi-vesilesiyle-duzenlenen-yemekte-yaptiklari-konusma
06.01.2016,18. Muhtarlar Toplantısı’nda Yaptıkları Konuşma,Speech Delivered at the 18th Mukhtars Meeting,PresSpeech924.txt,https://www.tccb.gov.tr/konusmalar/353/37584/18-muhtarlar-toplantisinda-yaptiklari-konusma
26.12.2015,“Asım’ın Nesli’nden Bir Usta: Recep Tayyip Erdoğan” Programında Yaptıkları Konuşma,"Speech in the Program ""A Master from Asım's Generation: Recep Tayyip Erdoğan""",PresSpeech925.txt,https://www.tccb.gov.tr/konusmalar/353/38598/asimin-neslinden-bir-usta-recep-tayyip-erdogan-programinda-yaptiklari-konusma
23.12.2015,17. Muhtarlar Toplantısı’nda Yaptıkları Konuşma,Speech Delivered at the 17th Meeting of Mukhtars,PresSpeech926.txt,https://www.tccb.gov.tr/konusmalar/353/37419/17-muhtarlar-toplantisinda-yaptiklari-konusma
22.12.2015,Dostluk Derneği’nin Kabulünde Yaptıkları Konuşma,Their Speech at the Acceptance of the Friendship Association,PresSpeech927.txt,https://www.tccb.gov.tr/konusmalar/353/37376/dostluk-derneginin-kabulunde-yaptiklari-konusma
14.12.2015,2015 Yılı Türkiye Bilimler Akademisi Ödül Töreni’nde Yaptıkları Konuşma,Speech at the 2015 Turkish Academy of Sciences Award Ceremony,PresSpeech928.txt,https://www.tccb.gov.tr/konusmalar/353/37288/2015-yili-turkiye-bilimler-akademisi-odul-toreninde-yaptiklari-konusma
09.12.2015,2015 Yılı Cumhurbaşkanlığı Kültür ve Sanat Büyük Ödülleri Töreni’nde Yaptıkları Konuşma,Speech at the 2015 Presidential Culture and Art Grand Awards Ceremony,PresSpeech929.txt,https://www.tccb.gov.tr/konusmalar/353/37223/2015-yili-cumhurbaskanligi-kultur-ve-sanat-buyuk-odulleri-toreninde-yaptiklari-konusma
08.12.2015,16. Muhtarlar Toplantısı’nda Yaptıkları Konuşma,Speech Delivered at the 16th Headmen's Meeting,PresSpeech930.txt,https://www.tccb.gov.tr/konusmalar/353/37215/16-muhtarlar-toplantisinda-yaptiklari-konusma
03.12.2015,Dünya Engelliler Günü Resepsiyonunda Yaptıkları Konuşma,Speech at the International Day of Persons with Disabilities Reception,PresSpeech931.txt,https://www.tccb.gov.tr/konusmalar/353/37198/dunya-engelliler-gunu-resepsiyonunda-yaptiklari-konusma
03.12.2015,"2015 Yılı TÜBİTAK Bilim, Özel ve Teşvik Ödülleri Töreni’nde Yaptıkları Konuşma","Speech at the 2015 TÜBİTAK Science, Special and Incentive Awards Ceremony",PresSpeech932.txt,https://www.tccb.gov.tr/konusmalar/353/37188/2015-yili-tubitak-bilim-ozel-ve-tesvik-odulleri-toreninde-yaptiklari-konusma
03.12.2015,TÜRK-İŞ 22. Olağan Genel Kurulu’nda Yaptıkları Konuşma,Speech at the 22nd Ordinary General Assembly of TÜRK-İŞ,PresSpeech933.txt,https://www.tccb.gov.tr/konusmalar/353/37189/turk-is-22-olagan-genel-kurulunda-yaptiklari-konusma
27.11.2015,Bayburt’ta Toplu Açılış Töreni’nde Yaptıkları Konuşma,Speech at the Mass Opening Ceremony in Bayburt,PresSpeech934.txt,https://www.tccb.gov.tr/konusmalar/353/36157/bayburtta-toplu-acilis-toreninde-yaptiklari-konusma
26.11.2015,15. Muhtarlar Toplantısı’nda Yaptıkları Konuşma,Speech Delivered at the 15th Headmen's Meeting,PresSpeech935.txt,https://www.tccb.gov.tr/konusmalar/353/36107/15-muhtarlar-toplantisinda-yaptiklari-konusma
25.11.2015,31. İSEDAK Açılış Toplantısında Yaptıkları Konuşma,Speech Delivered at the 31st COMCEC Opening Meeting,PresSpeech936.txt,https://www.tccb.gov.tr/konusmalar/353/36092/31-isedak-acilis-toplantisinda-yaptiklari-konusma
24.11.2015,Öğretmenler Günü Resepsiyonunda Yaptıkları Konuşma,Speech at the Teacher's Day Reception,PresSpeech937.txt,https://www.tccb.gov.tr/konusmalar/353/36093/ogretmenler-gunu-resepsiyonunda-yaptiklari-konusma
19.11.2015,İslam İşbirliği Teşkilatı 5. Sağlık Bakanları Toplantısı’nda Yaptıkları Konuşma,Speech at the 5th Meeting of Ministers of Health of the Organization of Islamic Cooperation,PresSpeech938.txt,https://www.tccb.gov.tr/konusmalar/353/36065/islam-isbirligi-teskilati-5-saglik-bakanlari-toplantisinda-yaptiklari-konusma
19.11.2015,7. Atlantik Konseyi Enerji ve Ekonomi Zirvesi’nde Yaptıkları Konuşma,Speech at the 7th Atlantic Council Energy and Economy Summit,PresSpeech939.txt,https://www.tccb.gov.tr/konusmalar/353/36063/7-atlantik-konseyi-enerji-ve-ekonomi-zirvesinde-yaptiklari-konusma
16.11.2015,G-20 Antalya Liderler Zirvesi Sonunda Basın Toplantısında Yaptıkları Konuşma,Speech at the Press Conference at the End of the G-20 Antalya Leaders' Summit,PresSpeech940.txt,https://www.tccb.gov.tr/konusmalar/353/36000/g-20-antalya-liderler-zirvesi-sonunda-basin-toplantisinda-yaptiklari-konusma
04.11.2015,14. Muhtarlar Toplantısı’nda Yaptıkları Konuşma,Speech Delivered at the 14th Headmen's Meeting,PresSpeech941.txt,https://www.tccb.gov.tr/konusmalar/353/35912/14-muhtarlar-toplantisinda-yaptiklari-konusma
26.10.2015,13. Muhtarlar Toplantısı’nda Yaptıkları Konuşma,Speech Delivered at the 13th Meeting of Mukhtars,PresSpeech942.txt,https://www.tccb.gov.tr/konusmalar/353/35910/13-muhtarlar-toplantisinda-yaptiklari-konusma
20.10.2015,BM Çölleşme İle Mücadele 12. Taraflar Konferansı’nda Yaptıkları Konuşma,Speech at the 12th Conference of the Parties to Combat Desertification,PresSpeech943.txt,https://www.tccb.gov.tr/konusmalar/353/35718/bm-collesme-ile-mucadele-12-taraflar-konferansinda-yaptiklari-konusma
19.10.2015,12. Muhtarlar Toplantısı’nda Yaptıkları Konuşma,Speech Delivered at the 12th Meeting of Mukhtars,PresSpeech944.txt,https://www.tccb.gov.tr/konusmalar/353/35695/12-muhtarlar-toplantisinda-yaptiklari-konusma
19.10.2015,İstanbul Yeni Havalimanı Proje Finansmanı İmza Töreni’nde Yaptıkları Konuşma,Speech at the Istanbul New Airport Project Financing Signing Ceremony,PresSpeech945.txt,https://www.tccb.gov.tr/konusmalar/353/35719/istanbul-yeni-havalimani-proje-finansmani-imza-toreninde-yaptiklari-konusma
17.10.2015,Türkiye’den KKTC’ye Su Temini Projesi Alaköprü Barajı Açılış Töreni’nde Yaptıkları Konuşma,"Speech at the Opening Ceremony of Alaköprü Dam, Water Supply Project from Turkey to TRNC",PresSpeech946.txt,https://www.tccb.gov.tr/konusmalar/353/35721/turkiyeden-kktcye-su-temini-projesi-alakopru-baraji-acilis-toreninde-yaptiklari-konusma
17.10.2015,Türkiye’den KKTC’ye Su Temini Projesi Geçitköy Barajı Açılış Töreni’nde Yaptıkları Konuşma,"Speech Delivered at the Opening Ceremony of Geçitköy Dam, Water Supply Project from Turkey to TRNC",PresSpeech947.txt,https://www.tccb.gov.tr/konusmalar/353/35720/turkiyeden-kktcye-su-temini-projesi-gecitkoy-baraji-acilis-toreninde-yaptiklari-konusma
05.10.2015,Belçika Egmont Uluslararası İlişkiler Kraliyet Enstitüsü’nde Yaptıkları Konuşma,Speech at the Royal Institute of International Affairs at Belgium's Egmont,PresSpeech948.txt,https://www.tccb.gov.tr/konusmalar/353/35549/belcika-egmont-uluslararasi-iliskiler-kraliyet-enstitusunde-yaptiklari-konusma
03.10.2015,Amfibi Gemi Bayraktar’ın Denize İndirilme Töreni’nde Yaptıkları Konuşma,Speech by Amphibious Ship Bayraktar at the Launching Ceremony,PresSpeech949.txt,https://www.tccb.gov.tr/konusmalar/353/35515/amfibi-gemi-bayraktarin-denize-indirilme-toreninde-yaptiklari-konusma
02.10.2015,G-20 Enerji Bakanları Toplantısı’nda Yaptıkları Konuşma,Speech at the G-20 Energy Ministers Meeting,PresSpeech950.txt,https://www.tccb.gov.tr/konusmalar/353/35537/g-20-enerji-bakanlari-toplantisinda-yaptiklari-konusma
01.10.2015,Türkiye Büyük Millet Meclisi 25. Dönem 2. Yasama Yılı Açış Konuşması,Grand National Assembly of Turkey 25th Term 2nd Legislative Year Opening Speech,PresSpeech951.txt,https://www.tccb.gov.tr/konusmalar/353/35491/turkiye-buyuk-millet-meclisi-25-donem-2-yasama-yili-acis-konusmasi
01.10.2015,Sağlıklı Yaşam Kültürünü Teşvik Projesi Tanıtım Toplantısı’nda Yaptıkları Konuşma,Speech at the Promotion Meeting of the Healthy Living Culture Project,PresSpeech952.txt,https://www.tccb.gov.tr/konusmalar/353/35536/saglikli-yasam-kulturunu-tesvik-projesi-tanitim-toplantisinda-yaptiklari-konusma
29.09.2015,11. Muhtarlar Toplantısı’nda Yaptıkları Konuşma,Speech Delivered at the 11th Headmen's Meeting,PresSpeech953.txt,https://www.tccb.gov.tr/konusmalar/353/35535/11-muhtarlar-toplantisinda-yaptiklari-konusma
16.09.2015,Türkiye Gençlik Kulübü Federasyonu Kongresi’nde Yaptıkları Konuşma,Speech at the Turkish Youth Club Federation Congress,PresSpeech954.txt,https://www.tccb.gov.tr/konusmalar/353/35476/turkiye-genclik-kulubu-federasyonu-kongresinde-yaptiklari-konusma
16.09.2015,3. Uluslararası Ombudsmanlık Sempozyumu’nda Yaptıkları Konuşma,Speech at the 3rd International Ombudsman Symposium,PresSpeech955.txt,https://www.tccb.gov.tr/konusmalar/353/35475/3-uluslararasi-ombudsmanlik-sempozyumunda-yaptiklari-konusma
26.08.2015,10. Muhtarlar Toplantısı’nda Yaptıkları Konuşma,Speech Delivered at the 10th Headmen's Meeting,PresSpeech956.txt,https://www.tccb.gov.tr/konusmalar/353/35911/10-muhtarlar-toplantisinda-yaptiklari-konusma
19.08.2015,9. Muhtarlar Toplantısı’nda Yaptıkları Konuşma,Speech Delivered at the 9th Mukhtars Meeting,PresSpeech957.txt,https://www.tccb.gov.tr/konusmalar/353/35907/9-muhtarlar-toplantisinda-yaptiklari-konusma
12.08.2015,8. Muhtarlar Toplantısı’nda Yaptıkları Konuşma,Speech Delivered at the 8th Headmen's Meeting,PresSpeech958.txt,https://www.tccb.gov.tr/konusmalar/353/35906/8-muhtarlar-toplantisinda-yaptiklari-konusma
03.07.2015,Millet Camii Açılış Töreninde Yaptıkları Konuşma,Speech at the Opening Ceremony of the Millet Mosque,PresSpeech959.txt,https://www.tccb.gov.tr/konusmalar/353/35401/millet-camii-acilis-toreninde-yaptiklari-konusma
30.06.2015,Eski Milletvekilleri ile İftar Programı,Iftar Program with Former Members of Parliament,PresSpeech960.txt,https://www.tccb.gov.tr/konusmalar/353/35400/eski-milletvekilleri-ile-iftar-programi
28.06.2015,Ensar Vakfı İftar Programı,Ensar Foundation Iftar Program,PresSpeech961.txt,https://www.tccb.gov.tr/konusmalar/353/32965/ensar-vakfi-iftar-programi
27.06.2015,Birlik Vakfı İftar Programı,Unity Foundation Iftar Program,PresSpeech962.txt,https://www.tccb.gov.tr/konusmalar/353/32964/birlik-vakfi-iftar-programi
26.06.2015,Türk Kızılayı'nın Madalya Töreni ve İftar Programı,Turkish Red Crescent's Medal Ceremony and Iftar Program,PresSpeech963.txt,https://www.tccb.gov.tr/konusmalar/353/32963/turk-kizilayinin-madalya-toreni-ve-iftar-programi
25.06.2015,ASKON İftar Programı,ASKON Iftar Program,PresSpeech964.txt,https://www.tccb.gov.tr/konusmalar/353/32962/askon-iftar-programi
24.06.2015,Muhtarlarla İftar Programı’nda (Yedinci Muhtarlar Toplantısı) Yaptıkları Konuşma,Speech with Mukhtars at the Iftar Program (Seventh Mukhtars Meeting),PresSpeech965.txt,https://www.tccb.gov.tr/konusmalar/353/32961/muhtarlarla-iftar-programinda-yedinci-muhtarlar-toplantisi-yaptiklari-konusma
21.06.2015,Türkiye İhracatçılar Meclisi 22. Olağan Genel Kurulu'nda Yaptıkları Konuşma,Speech at the 22nd Ordinary General Assembly of the Turkish Exporters Assembly,PresSpeech966.txt,https://www.tccb.gov.tr/konusmalar/353/32786/turkiye-ihracatcilar-meclisi-22-olagan-genel-kurulunda-yaptiklari-konusma
20.06.2015,Midyat Geçici Barınma Merkezi'nde İftar Yemeğinde Yaptıkları Konuşma,Speech at the Iftar Dinner in Midyat Temporary Accommodation Center,PresSpeech967.txt,https://www.tccb.gov.tr/konusmalar/353/32785/midyat-gecici-barinma-merkezinde-iftar-yemeginde-yaptiklari-konusma
18.06.2015,Şehit Yakınları ve Gaziler İftar Program'nda Yaptıkları Konuşma,Relatives of Martyrs and Veterans Speech at the Iftar Program,PresSpeech968.txt,https://www.tccb.gov.tr/konusmalar/353/32760/sehit-yakinlari-ve-gaziler-iftar-programnda-yaptiklari-konusma
11.06.2015,4. Uluslararası Öğrenciler Mezuniyet Töreninde Yaptıkları Konuşma,4. International Students' Speech at the Graduation Ceremony,PresSpeech969.txt,https://www.tccb.gov.tr/konusmalar/353/32673/4-uluslararasi-ogrenciler-mezuniyet-toreninde-yaptiklari-konusma
04.06.2015,Sivas’ta Halka Hitapları,Public Addresses in Sivas,PresSpeech970.txt,https://www.tccb.gov.tr/konusmalar/353/32659/sivasta-halka-hitaplari
30.05.2015,İstanbul'un Fethi'nin 562. Yıl Dönümü Kutlamalarında Yaptıkları Konuşma,Speech at the Celebrations of the 562nd Anniversary of the Conquest of Istanbul,PresSpeech971.txt,https://www.tccb.gov.tr/konusmalar/353/32584/istanbulun-fethinin-562-yil-donumu-kutlamalarinda-yaptiklari-konusma
25.05.2015,Dünya Enerji Düzenleme Forumunda Yaptıkları Konuşma,Speech at the World Forum on Energy Regulation,PresSpeech972.txt,https://www.tccb.gov.tr/konusmalar/353/32657/dunya-enerji-duzenleme-forumunda-yaptiklari-konusma
21.05.2015,TUSAŞ Uzay Sistemleri Entegrasyon ve Test Merkezi Açılış Töreni’nde Yaptıkları Konuşma,Speech at the Opening Ceremony of TAI Space Systems Integration and Test Center,PresSpeech973.txt,https://www.tccb.gov.tr/konusmalar/353/32233/tusas-uzay-sistemleri-entegrasyon-ve-test-merkezi-acilis-toreninde-yaptiklari-konusma
19.05.2015,19 Mayıs Atatürk’ü Anma Gençik Ve Spor Bayramı Münasebetiyle Gençleri Kabulünde Yaptıkları Konuşma,"The Speech of the Young People on the occasion of the 19 May Commemoration of Atatürk, Youth and Sports Day",PresSpeech974.txt,https://www.tccb.gov.tr/konusmalar/353/32661/19-mayis-ataturku-anma-gencik-ve-spor-bayrami-munasebetiyle-gencleri-kabulunde-yaptiklari-konusma
16.05.2015,8. Uluslararası Öğrenci Buluşması’nda Yaptıkları Konuşma,Speech at the 8th International Student Meeting,PresSpeech975.txt,https://www.tccb.gov.tr/konusmalar/353/32660/8-uluslararasi-ogrenci-bulusmasinda-yaptiklari-konusma
14.05.2015,Van’da Toplu Açılış Töreninde Yaptıkları Konuşma,Speech Delivered at the Collective Opening Ceremony in Van,PresSpeech976.txt,https://www.tccb.gov.tr/konusmalar/353/32662/vanda-toplu-acilis-toreninde-yaptiklari-konusma
11.05.2015,Rize Toplu Açılış Töreni'nde Yaptıkları Konuşma,Speech Delivered at the Rize Mass Opening Ceremony,PresSpeech977.txt,https://www.tccb.gov.tr/konusmalar/353/32132/rize-toplu-acilis-toreninde-yaptiklari-konusma
10.05.2015,Almanya “Karlsruhe Buluşması”nda Yaptıkları Konuşma,"Speech at the ""Karlsruhe Meeting"" in Germany",PresSpeech978.txt,https://www.tccb.gov.tr/konusmalar/353/32131/almanya-karlsruhe-bulusmasinda-yaptiklari-konusma
09.05.2015,İzmir’de Toplu Açılış Töreninde Halka Hitaben Yaptıkları Konuşma,Speech to the Public at the Mass Opening Ceremony in Izmir,PresSpeech979.txt,https://www.tccb.gov.tr/konusmalar/353/32130/izmirde-toplu-acilis-toreninde-halka-hitaben-yaptiklari-konusma
08.05.2015,B-20 Türkiye İş Dünyası Liderleri Forumu Çalıştayı’nda Yaptıkları Konuşma,Speech at the B-20 Turkey Business Leaders Forum Workshop,PresSpeech980.txt,https://www.tccb.gov.tr/konusmalar/353/32129/b-20-turkiye-is-dunyasi-liderleri-forumu-calistayinda-yaptiklari-konusma
08.05.2015,Türkiye Ziraat Odaları Birliği 26. Olağan Genel Kurulunda Yaptıkları Konuşma,Speech at the 26th Ordinary General Assembly of the Union of Chambers of Agriculture of Turkey,PresSpeech981.txt,https://www.tccb.gov.tr/konusmalar/353/32128/turkiye-ziraat-odalari-birligi-26-olagan-genel-kurulunda-yaptiklari-konusma
05.05.2015,Tekirdağ Toplu Açılış Töreni'nde Yaptıkları Konuşma,Speech at the Tekirdağ Collective Opening Ceremony,PresSpeech982.txt,https://www.tccb.gov.tr/konusmalar/353/32127/tekirdag-toplu-acilis-toreninde-yaptiklari-konusma
05.05.2015,12. IDEF Uluslararası Savunma Sanayi Fuarı'nda Yaptıkları Konuşma,Speech at the 12th IDEF International Defense Industry Fair,PresSpeech983.txt,https://www.tccb.gov.tr/konusmalar/353/32126/12-idef-uluslararasi-savunma-sanayi-fuarinda-yaptiklari-konusma
02.05.2015,Diyarbakır Toplu Açılış Töreninde Yaptıkları Konuşma,Speech Delivered at the Diyarbakır Collective Opening Ceremony,PresSpeech984.txt,https://www.tccb.gov.tr/konusmalar/353/32125/diyarbakir-toplu-acilis-toreninde-yaptiklari-konusma
02.05.2015,Batman Toplu Açılış Töreninde Yaptıkları Konuşma,Speech at the Batman Mass Opening Ceremony,PresSpeech985.txt,https://www.tccb.gov.tr/konusmalar/353/32124/batman-toplu-acilis-toreninde-yaptiklari-konusma
29.04.2015,Türkiye Tarım ve Kırsal Kalkınma Hamlesi Proje Uygulamaları Tanıtım Programında Yaptıkları Konuşma,Speech at the Turkey Agriculture and Rural Development Initiative Project Applications Promotion Program,PresSpeech986.txt,https://www.tccb.gov.tr/konusmalar/353/32123/turkiye-tarim-ve-kirsal-kalkinma-hamlesi-proje-uygulamalari-tanitim-programinda-yaptiklari-konusma
25.04.2015,MÜSİAD 23. Genel Kurulu'nda Yaptıkları Konuşma,Speech at the 23rd General Assembly of MUSIAD,PresSpeech987.txt,https://www.tccb.gov.tr/konusmalar/353/32122/musiad-23-genel-kurulunda-yaptiklari-konusma
23.04.2015,Çanakkale 100. Yıl Barış Zirvesi'nde Yaptıkları Konuşma,Speech Delivered at the Çanakkale 100th Anniversary Peace Summit,PresSpeech988.txt,https://www.tccb.gov.tr/konusmalar/353/32664/canakkale-100-yil-baris-zirvesinde-yaptiklari-konusma
23.04.2015,23 Nisan Ulusal Egemenlik ve Çocuk Bayramı Dolayısıyla Çocukları Kabulünde Yaptıkları Konuşma,Their Speech at the Admission of Children for the April 23 National Sovereignty and Children's Day,PresSpeech989.txt,https://www.tccb.gov.tr/konusmalar/353/31972/23-nisan-ulusal-egemenlik-ve-cocuk-bayrami-dolayisiyla-cocuklari-kabulunde-yaptiklari-konusma
22.04.2015,Irak Cumhurbaşkanı Fuad Masum ile Birlikte Ortak Basın Toplantısında Yaptıkları Konuşma,Speech at the Joint Press Conference with Iraqi President Fuad Masum,PresSpeech990.txt,https://www.tccb.gov.tr/konusmalar/353/32663/irak-cumhurbaskani-fuad-masum-ile-birlikte-ortak-basin-toplantisinda-yaptiklari-konusma
21.04.2015,Uluslararası 23 Nisan Çocuk Şenliği’ne Katılan Çocukları Kabulünde Yaptığı Konuşma,Speech at the reception of the children participating in the International April 23 Children's Festival,PresSpeech991.txt,https://www.tccb.gov.tr/konusmalar/353/31971/uluslararasi-23-nisan-cocuk-senligine-katilan-cocuklari-kabulunde-yaptigi-konusma
21.04.2015,Türk Telekom'un 175. Kuruluş Yıl Dönümü Dolayısıyla Düzenlenen Törende Yaptıkları Konuşma,Speech at the Ceremony Held for the 175th Anniversary of Türk Telekom,PresSpeech992.txt,https://www.tccb.gov.tr/konusmalar/353/31970/turk-telekomun-175-kurulus-yil-donumu-dolayisiyla-duzenlenen-torende-yaptiklari-konusma
19.04.2015,Levent-Rumeli Hisarüstü Metro Hattı Açılış Töreninde Yaptıkları Konuşma,Speech at the Levent-Rumeli Hisarüstü Metro Line Opening Ceremony,PresSpeech993.txt,https://www.tccb.gov.tr/konusmalar/353/31831/levent-rumeli-hisarustu-metro-hatti-acilis-toreninde-yaptiklari-konusma
18.04.2015,Siyer-i Nebi Yarışması Ödül Töreni’nde Yaptıkları Konuşma,Speech at the Siyer-i Nebi Contest Award Ceremony,PresSpeech994.txt,https://www.tccb.gov.tr/konusmalar/353/31830/siyer-i-nebi-yarismasi-odul-toreninde-yaptiklari-konusma
18.04.2015,Kocaeli’nde Toplu Açılış Töreninde Yaptıkları Konuşma,Speech Delivered at the Collective Opening Ceremony in Kocaeli,PresSpeech995.txt,https://www.tccb.gov.tr/konusmalar/353/31829/kocaelinde-toplu-acilis-toreninde-yaptiklari-konusma
18.04.2015,51.Cumhurbaşkanlığı Türkiye Bisiklet Turu Tanıtım Etkinliğinde Yaptıkları Konuşma,Speech at the 51st Presidential Cycling Tour of Turkey Promotion Event,PresSpeech996.txt,https://www.tccb.gov.tr/konusmalar/353/31951/51cumhurbaskanligi-turkiye-bisiklet-turu-tanitim-etkinliginde-yaptiklari-konusma
17.04.2015,Hoca Ahmet Yesevi Uluslararası Türk-Kazak Üniversitesi Tarafından  Fahri Profesörlük Tevdii Töreni’nde Yaptıkları Konuşma,Speech by Hoca Ahmet Yesevi International Turkish-Kazakh University at the Honorary Professorship Ceremony,PresSpeech997.txt,https://www.tccb.gov.tr/konusmalar/353/31950/hoca-ahmet-yesevi-uluslararasi-turk-kazak-universitesi-tarafindan-fahri-profesorluk-tevdii-toreninde-yaptiklari-konusma
16.04.2015,Kazakistan Cumhurbaşkanı Nazarbayev ile Ortak Basın Toplantısında Yaptığı Konuşma,Speech at the Joint Press Conference with President of Kazakhstan Nazarbayev,PresSpeech998.txt,https://www.tccb.gov.tr/konusmalar/353/32666/kazakistan-cumhurbaskani-nazarbayev-ile-ortak-basin-toplantisinda-yaptigi-konusma
16.04.2015,Türkiye-Kazakistan İş Forumu’nda Yaptıkları Konuşma,Speech at the Turkey-Kazakhstan Business Forum,PresSpeech999.txt,https://www.tccb.gov.tr/konusmalar/353/32665/turkiye-kazakistan-is-forumunda-yaptiklari-konusma
14.04.2015,Türkiye İhracatçılar Meclisi Üyelerini Kabulde Yaptıkları Konuşma,Speech of the Members of the Turkish Exporters Assembly at the Acceptance,PresSpeech1000.txt,https://www.tccb.gov.tr/konusmalar/353/31828/turkiye-ihracatcilar-meclisi-uyelerini-kabulde-yaptiklari-konusma
12.04.2015,'Hz. Peygamber ve Birlikte Yaşama Ahlakı' Temalı Kutlu Doğum Programı'nda Yaptıkları Konuşma,'Hz. The Speech of the Prophet and the Ethics of Living Together at the 'Happy Birthday Programme',PresSpeech1001.txt,https://www.tccb.gov.tr/konusmalar/353/30144/hz-peygamber-ve-birlikte-yasama-ahlaki-temali-kutlu-dogum-programinda-yaptiklari-konusma
11.04.2015,Sakarya Toplu Açılış Töreni’nde Yaptıkları Konuşma,Speech at the Sakarya Collective Opening Ceremony,PresSpeech1002.txt,https://www.tccb.gov.tr/konusmalar/353/30145/sakarya-toplu-acilis-toreninde-yaptiklari-konusma
10.04.2015,Polis Haftası Münasebetiyle 81 İlde Görev Yapan 400 Polis Memurunu Kabulde Yaptıkları Konuşma,Speech of 400 Police Officers Working in 81 Provinces on the Celebration of Police Week,PresSpeech1003.txt,https://www.tccb.gov.tr/konusmalar/353/30130/polis-haftasi-munasebetiyle-81-ilde-gorev-yapan-400-polis-memurunu-kabulde-yaptiklari-konusma
09.04.2015,4. Türk Patent Ödülleri Töreni’nde Yaptıkları Konuşma,Speech at the 4th Turkish Patent Awards Ceremony,PresSpeech1004.txt,https://www.tccb.gov.tr/konusmalar/353/30101/4-turk-patent-odulleri-toreninde-yaptiklari-konusma
08.04.2015,Altıncı Muhtarlar Toplantısı'nda Yaptıkları Konuşma,Speech Delivered at the Sixth Headmen's Meeting,PresSpeech1005.txt,https://www.tccb.gov.tr/konusmalar/353/30100/altinci-muhtarlar-toplantisinda-yaptiklari-konusma
07.04.2015,İran Cumhurbaşkanı Ruhani ile Ortak Basın Toplantısında Yaptığı Konuşma,Speech at the Joint Press Conference with President Rouhani of Iran,PresSpeech1006.txt,https://www.tccb.gov.tr/konusmalar/353/30099/iran-cumhurbaskani-ruhani-ile-ortak-basin-toplantisinda-yaptigi-konusma
