date,title,translated_title,file,link
05.10.2019,AK Parti 29. İstişare ve Değerlendirme Toplantısı Açılışında Yaptıkları Konuşma,Speech Delivered at the Opening of the AK Party 29th Consultation and Evaluation Meeting,PresSpeech541.txt,https://www.tccb.gov.tr/konusmalar/353/110973/ak-parti-29-istisare-ve-degerlendirme-toplantisi-acilisinda-yaptiklari-konusma
01.10.2019,TBMM 27. Dönem 3. Yasama Yılı Açış Konuşması,Opening Speech for the 27th Term 3rd Legislative Year of the Grand National Assembly of Turkey,PresSpeech542.txt,https://www.tccb.gov.tr/konusmalar/353/110910/tbmm-27-donem-3-yasama-yili-acis-konusmasi
29.09.2019,TCG Kınalıada’nın (F-514) Hizmete Giriş Töreni ve Pakistan MİLGEM Korvet Projesi  1. Gemi Sac Kesme Töreninde Yaptıkları Konuşma,TCG Kınalıada's (F-514) Commissioning Ceremony and Speech at the 1st Ship Sheet Metal Cutting Ceremony of Pakistan MİLGEM Corvette Project,PresSpeech543.txt,https://www.tccb.gov.tr/konusmalar/353/109889/tcg-kinaliada-nin-f-514-hizmete-giris-toreni-ve-pakistan-milgem-korvet-projesi-1-gemi-sac-kesme-toreninde-yaptiklari-konusma
25.09.2019,“Nefret Söylemiyle Mücadele” Temalı Yüksek Düzeyli Etkinlikte Yaptıkları Konuşma,Speech at the High-Level Event Themed “Combating Hate Speech”,PresSpeech544.txt,https://www.tccb.gov.tr/konusmalar/353/109819/-nefret-soylemiyle-mucadele-temali-yuksek-duzeyli-etkinlikte-yaptiklari-konusma
25.09.2019,TAİK Tarafından Düzenlenen 10. Türkiye Yatırım Konferansı’nda Yaptıkları Konuşma,Speech at the 10th Turkey Investment Conference Organized by TAIK,PresSpeech545.txt,https://www.tccb.gov.tr/konusmalar/353/109858/taik-tarafindan-duzenlenen-10-turkiye-yatirim-konferansi-nda-yaptiklari-konusma
24.09.2019,Ara Güler Sergisi’nin Açılış Töreninde Yaptıkları Konuşma,Speech at the Opening Ceremony of the Ara Güler Exhibition,PresSpeech546.txt,https://www.tccb.gov.tr/konusmalar/353/109767/ara-guler-sergisi-nin-acilis-toreninde-yaptiklari-konusma
24.09.2019,“Sürdürülebilir Kalkınma Hedeflerinin Hayata Geçirilmesini Etkileyen Mega Eğilimler” Konulu Oturumunda Yaptıkları Konuşma,Speech at the Session on “Mega-Trends Affecting the Realization of the Sustainable Development Goals”,PresSpeech547.txt,https://www.tccb.gov.tr/konusmalar/353/109815/-surdurulebilir-kalkinma-hedeflerinin-hayata-gecirilmesini-etkileyen-mega-egilimler-konulu-oturumunda-yaptiklari-konusma
24.09.2019,Birleşmiş Milletler 74. Genel Kurulu’nda Yaptıkları Konuşma,Speech at the 74th United Nations General Assembly,PresSpeech548.txt,https://www.tccb.gov.tr/konusmalar/353/109804/birlesmis-milletler-74-genel-kurulu-nda-yaptiklari-konusma
23.09.2019,TÜRKEN Vakfı Geleneksel Yemeğinde Yaptıkları Konuşma,Speech at the TÜRKEN Foundation Traditional Dinner,PresSpeech549.txt,https://www.tccb.gov.tr/konusmalar/353/109736/turken-vakfi-geleneksel-yemeginde-yaptiklari-konusma
23.09.2019,Türk-Amerikan Ulusal Yönlendirme Komitesi (TASC) Tarafından Düzenlenen Etkinlikte Yaptıkları Konuşma,Speech at the Event Organized by the Turkish-American National Steering Committee (TASC),PresSpeech550.txt,https://www.tccb.gov.tr/konusmalar/353/109735/turk-amerikan-ulusal-yonlendirme-komitesi-tasc-tarafindan-duzenlenen-etkinlikte-yaptiklari-konusma
23.09.2019,BM İklim Eylemi Zirvesi’nde Yaptıkları Konuşma,Speech at the UN Climate Action Summit,PresSpeech551.txt,https://www.tccb.gov.tr/konusmalar/353/109763/bm-iklim-eylemi-zirvesi-nde-yaptiklari-konusma
21.09.2019,Teknofest’i Ziyaretlerinde Yaptıkları Konuşma,Speeches During Their Visit to Teknofest,PresSpeech552.txt,https://www.tccb.gov.tr/konusmalar/353/109733/teknofest-i-ziyaretlerinde-yaptiklari-konusma
20.09.2019,2. Uluslararası Sosyal Bilimler Kongresinde Yaptıkları Konuşma,Speech at the 2nd International Congress of Social Sciences,PresSpeech553.txt,https://www.tccb.gov.tr/konusmalar/353/109729/2-uluslararasi-sosyal-bilimler-kongresinde-yaptiklari-konusma
18.09.2019,2019-2020 Yükseköğretim Akademik Yılı Açılış Töreninde Yaptıkları Konuşma,Speech Delivered at the Opening Ceremony of the 2019-2020 Academic Year of Higher Education,PresSpeech554.txt,https://www.tccb.gov.tr/konusmalar/353/109664/2019-2020-yuksekogretim-akademik-yili-acilis-toreninde-yaptiklari-konusma
16.09.2019,Türkiye-Rusya Federasyonu-İran Üçlü Zirvesi’nin Ardından Ortak Basın Toplantısında Yaptıkları Konuşma,Speech at the Joint Press Conference after the Turkey-Russian Federation-Iran Trilateral Summit,PresSpeech555.txt,https://www.tccb.gov.tr/konusmalar/353/109647/turkiye-rusya-federasyonu-iran-uclu-zirvesi-nin-ardindan-ortak-basin-toplantisinda-yaptiklari-konusma
16.09.2019,Türkiye-Rusya Federasyonu-İran Üçlü Zirvesi Öncesi Yaptıkları Açıklama,Statement Before the Trilateral Summit of Turkey-Russian Federation-Iran,PresSpeech556.txt,https://www.tccb.gov.tr/konusmalar/353/109646/turkiye-rusya-federasyonu-iran-uclu-zirvesi-oncesi-yaptiklari-aciklama
11.09.2019,Büyükşehir Belediye Başkanları Toplantısında Yaptıkları Konuşma,Speech at the Metropolitan Mayors Meeting,PresSpeech557.txt,https://www.tccb.gov.tr/konusmalar/353/109601/buyuksehir-belediye-baskanlari-toplantisinda-yaptiklari-konusma
10.09.2019,ABD Ticaret Bakanı Wilbur Ross ve Beraberindeki Heyeti Kabulünde Yaptıkları Konuşma,Speech at the Reception of US Secretary of Commerce Wilbur Ross and his Delegation,PresSpeech558.txt,https://www.tccb.gov.tr/konusmalar/353/109593/abd-ticaret-bakani-wilbur-ross-ve-beraberindeki-heyeti-kabulunde-yaptiklari-konusma
09.09.2019,Önder İmam Hatipliler Buluşmasında Yaptıkları Konuşma,Speech Delivered at the Leader Imam Hatip Meeting,PresSpeech559.txt,https://www.tccb.gov.tr/konusmalar/353/109575/onder-imam-hatipliler-bulusmasinda-yaptiklari-konusma
09.09.2019,Yapımı Tamamlanan Okulların Ortak Açılışı ve 2019-2020 Eğitim Öğretim Yılı Açılış Töreninde Yaptığı Konuşma,Joint Opening of the Completed Schools and his Speech at the Opening Ceremony of the 2019-2020 Academic Year,PresSpeech560.txt,https://www.tccb.gov.tr/konusmalar/353/109580/yapimi-tamamlanan-okullarin-ortak-acilisi-ve-2019-2020-egitim-ogretim-yili-acilis-toreninde-yaptigi-konusma
09.09.2019,"Alternatif Finansta Yeni Ufuklar: Likidite, Yeşil Finans ve Politik Ekonomi Programında Yaptıkları Konuşma","New Horizons in Alternative Finance: Speech on Liquidity, Green Finance and Political Economy Program",PresSpeech561.txt,https://www.tccb.gov.tr/konusmalar/353/109579/alternatif-finansta-yeni-ufuklar-likidite-yesil-finans-ve-politik-ekonomi-programinda-yaptiklari-konusma
08.09.2019,Malatya Toplu Açılış Töreninde Yaptıkları Konuşma,Speech Delivered at the Malatya Mass Opening Ceremony,PresSpeech562.txt,https://www.tccb.gov.tr/konusmalar/353/109576/malatya-toplu-acilis-toreninde-yaptiklari-konusma
07.09.2019,Eskişehir Ak Parti İl Teşkilatı İle Yemek Programında Yaptıkları Konuşma,Speech with Eskişehir Ak Party Provincial Organization at the Meal Program,PresSpeech563.txt,https://www.tccb.gov.tr/konusmalar/353/109568/eskisehir-ak-parti-il-teskilati-ile-yemek-programinda-yaptiklari-konusma
07.09.2019,Eskişehir Odunpazarı Modern Müzesi Açılışında Yaptıkları Konuşma,Speech at the Opening of Eskişehir Odunpazarı Modern Museum,PresSpeech564.txt,https://www.tccb.gov.tr/konusmalar/353/109564/eskisehir-odunpazari-modern-muzesi-acilisinda-yaptiklari-konusma
05.09.2019,Ak Parti Genişletilmiş İl Başkanları Toplantısında Yaptıkları Konuşma,Speech at the AK Party Extended Provincial Presidents Meeting,PresSpeech565.txt,https://www.tccb.gov.tr/konusmalar/353/109531/ak-parti-genisletilmis-il-baskanlari-toplantisinda-yaptiklari-konusma
04.09.2019,Orta Anadolu Ekonomi Forumu’nda Yaptıkları Konuşma,Speech at the Central Anatolian Economic Forum,PresSpeech566.txt,https://www.tccb.gov.tr/konusmalar/353/109521/orta-anadolu-ekonomi-forumu-nda-yaptiklari-konusma
04.09.2019,Ak Parti Sivas İl Teşkilatı’nda Yaptıkları Konuşma,Speech by Ak Party Sivas Provincial Organization,PresSpeech567.txt,https://www.tccb.gov.tr/konusmalar/353/109519/ak-parti-sivas-il-teskilati-nda-yaptiklari-konusma
04.09.2019,Sivas Kongresi’nin 100. Yıl Dönümü Programında Yaptıkları Konuşma,Their Speech at the 100th Anniversary Program of the Sivas Congress,PresSpeech568.txt,https://www.tccb.gov.tr/konusmalar/353/109515/sivas-kongresi-nin-100-yil-donumu-programinda-yaptiklari-konusma
02.09.2019,Adli Yıl Açılış Töreninde Yaptıkları Konuşma,Speech at the Judicial Year Opening Ceremony,PresSpeech569.txt,https://www.tccb.gov.tr/konusmalar/353/109470/adli-yil-acilis-toreninde-yaptiklari-konusma
01.09.2019,Konya’da Toplu Açılış Töreninde Yaptığı Konuşma,Speech at the Mass Opening Ceremony in Konya,PresSpeech570.txt,https://www.tccb.gov.tr/konusmalar/353/109484/konya-da-toplu-acilis-toreninde-yaptigi-konusma
01.09.2019,Ak Parti Konya İl Başkanlığı Tarafından Düzenlenen Programda Yaptıkları Konuşma,Speech in the Program Organized by the AK Party Konya Provincial Presidency,PresSpeech571.txt,https://www.tccb.gov.tr/konusmalar/353/109501/ak-parti-konya-il-baskanligi-tarafindan-duzenlenen-programda-yaptiklari-konusma
31.08.2019,Balık Sezonu Açılışında Yaptığı Konuşma,Speech at the Opening of Fish Season,PresSpeech572.txt,https://www.tccb.gov.tr/konusmalar/353/109485/balik-sezonu-acilisinda-yaptigi-konusma
31.08.2019,Harp Okulları Diploma ve Sancak Devir Teslim Töreninde Yaptıkları Konuşma ,Speech at the Military Academy Diploma and Starboard Handover Ceremony,PresSpeech573.txt,https://www.tccb.gov.tr/konusmalar/353/109483/harp-okullari-diploma-ve-sancak-devir-teslim-toreninde-yaptiklari-konusma-
30.08.2019,30 Ağustos Resepsiyonu’nda Yaptıkları Konuşma,Speech at the 30 August Reception,PresSpeech574.txt,https://www.tccb.gov.tr/konusmalar/353/109465/30-agustos-resepsiyonu-nda-yaptiklari-konusma
29.08.2019,Radyo ve Televizyon Gazetecileri Derneği Ödül Töreninde Yaptıkları Konuşma,Speech at the Radio and Television Journalists Association Award Ceremony,PresSpeech575.txt,https://www.tccb.gov.tr/konusmalar/353/109462/radyo-ve-televizyon-gazetecileri-dernegi-odul-toreninde-yaptiklari-konusma
27.08.2019,Rusya Uluslararası Uzay ve Havacılık Fuarı Açılış Töreninde Yaptıkları Konuşma,Speech at the Opening Ceremony of the Russian International Space and Aviation Fair,PresSpeech576.txt,https://www.tccb.gov.tr/konusmalar/353/109387/rusya-uluslararasi-uzay-ve-havacilik-fuari-acilis-toreninde-yaptiklari-konusma
26.08.2019,Malazgirt Zaferi’nin 948. Yıldönümü Kutlama Programında Yaptıkları Konuşma ,Speech at the Celebration Program of the 948th Anniversary of the Manzikert Victory,PresSpeech577.txt,https://www.tccb.gov.tr/konusmalar/353/109350/malazgirt-zaferi-nin-948-yildonumu-kutlama-programinda-yaptiklari-konusma-
25.08.2019,Trabzon Toplu Açılış Töreninde Yaptıkları Konuşma,Speech at the Trabzon Mass Opening Ceremony,PresSpeech578.txt,https://www.tccb.gov.tr/konusmalar/353/109374/trabzon-toplu-acilis-toreninde-yaptiklari-konusma
24.08.2019,Ak Parti Rize İl Başkanlığında Yaptıkları Konuşma,Speech by AK Party Rize Provincial Presidency,PresSpeech579.txt,https://www.tccb.gov.tr/konusmalar/353/109373/ak-parti-rize-il-baskanliginda-yaptiklari-konusma
24.08.2019,Rize Toplu Açılış Töreninde Yaptıkları Konuşma,Speech Delivered at the Rize Mass Opening Ceremony,PresSpeech580.txt,https://www.tccb.gov.tr/konusmalar/353/109372/rize-toplu-acilis-toreninde-yaptiklari-konusma
24.08.2019,Artvin Yusufeli’nde Halka Hitapları,Public Addresses in Artvin Yusufeli,PresSpeech581.txt,https://www.tccb.gov.tr/konusmalar/353/109371/artvin-yusufeli-nde-halka-hitaplari
23.08.2019,Jandarma ve Sahil Güvenlik Akademisi Başkanlığı Subay ve Astsubay Mezuniyet Töreninde Yaptıkları Konuşma,The Speech of the Gendarmerie and Coast Guard Academy at the Officer and NCO Graduation Ceremony,PresSpeech582.txt,https://www.tccb.gov.tr/konusmalar/353/109346/jandarma-ve-sahil-guvenlik-akademisi-baskanligi-subay-ve-astsubay-mezuniyet-toreninde-yaptiklari-konusma
23.08.2019,Ak Parti’nin 18. Kuruluş Yıl Dönümü Programında Yaptıkları Konuşma,Ak Party's 18th Anniversary Speech,PresSpeech583.txt,https://www.tccb.gov.tr/konusmalar/353/109338/ak-parti-nin-18-kurulus-yil-donumu-programinda-yaptiklari-konusma
06.08.2019,11. Büyükelçiler Konferansında Yaptıkları Konuşma ,Speech at the 11th Ambassadors Conference,PresSpeech584.txt,https://www.tccb.gov.tr/konusmalar/353/107218/11-buyukelciler-konferansinda-yaptiklari-konusma-
04.08.2019,Ak Parti Bursa İl Başkanlığı Teşkilat Yemeğinde Yaptıkları Konuşma ,Speech at the Organization Dinner of the AK Party Bursa Provincial Presidency,PresSpeech585.txt,https://www.tccb.gov.tr/konusmalar/353/107208/ak-parti-bursa-il-baskanligi-teskilat-yemeginde-yaptiklari-konusma-
04.08.2019,Bursa Şehir Hastanesi Ve İstanbul-İzmir Otoyolu Ortak Açılış Töreni Bursa-İzmir Otoyolu Açılış Töreninde Yaptıkları Konuşma,Bursa City Hospital and Istanbul-İzmir Highway Joint Opening Ceremony Speech at the Bursa-İzmir Highway Opening Ceremony,PresSpeech586.txt,https://www.tccb.gov.tr/konusmalar/353/107207/bursa-sehir-hastanesi-ve-istanbul-izmir-otoyolu-ortak-acilis-toreni-bursa-izmir-otoyolu-acilis-toreninde-yaptiklari-konusma
03.08.2019,İstanbul Süryani Kadim Vakfı Mor Efrem Süryani Kadim Ortodoks Kilisesi Temel Atma Töreninde Yaptıkları   Konuşma ,Speech at the Groundbreaking Ceremony of the Istanbul Syriac Foundation Mor Efrem Syriac Ancient Orthodox Church,PresSpeech587.txt,https://www.tccb.gov.tr/konusmalar/353/107206/istanbul-suryani-kadim-vakfi-mor-efrem-suryani-kadim-ortodoks-kilisesi-temel-atma-toreninde-yaptiklari-konusma-
26.07.2019,TİGEM 69. Geleneksel Hasat Bayramı’nda Yaptıkları Konuşma,TİGEM Speech at the 69th Traditional Harvest Festival,PresSpeech588.txt,https://www.tccb.gov.tr/konusmalar/353/107161/tigem-69-geleneksel-hasat-bayrami-nda-yaptiklari-konusma
26.07.2019,Genişletilmiş İl Başkanları Toplantısında Yaptıkları Konuşma,Speech Delivered at the Extended Provincial Presidents Meeting,PresSpeech589.txt,https://www.tccb.gov.tr/konusmalar/353/107147/genisletilmis-il-baskanlari-toplantisinda-yaptiklari-konusma
25.07.2019,Malezya Başbakanı Mahathir Mohamad’a “Cumhuriyet Nişanı” Tevcih Töreninde Yaptıkları Konuşma,"Speech to Malaysian Prime Minister Mahathir Mohamad at the ""Order of the Republic"" Anniversary Ceremony",PresSpeech590.txt,https://www.tccb.gov.tr/konusmalar/353/107145/malezya-basbakani-mahathir-mohamad-a-cumhuriyet-nisani-tevcih-toreninde-yaptiklari-konusma
15.07.2019,Hafıza 15 Temmuz Müzesi Açılış Töreninde Yaptıkları Konuşma,Speech at the Opening Ceremony of the Memory 15 July Museum,PresSpeech591.txt,https://www.tccb.gov.tr/konusmalar/353/107088/hafiza-15-temmuz-muzesi-acilis-toreninde-yaptiklari-konusma
15.07.2019,Atatürk Havalimanı’nda Halka Hitapları,Public Addresses at Atatürk Airport,PresSpeech592.txt,https://www.tccb.gov.tr/konusmalar/353/107087/ataturk-havalimani-nda-halka-hitaplari
15.07.2019,Ankara Emniyet Müdürlüğü Yeni Binasının Açılış Töreninde Yapıkları Konuşma,Speech Delivered at the Opening Ceremony of Ankara Police Department New Building,PresSpeech593.txt,https://www.tccb.gov.tr/konusmalar/353/107085/ankara-emniyet-mudurlugu-yeni-binasinin-acilis-toreninde-yapiklari-konusma
10.07.2019,Hak-İş 14. Olağan Genel Kurulu’nda Yaptıkları Konuşma,Speech at the 14th Ordinary General Assembly of Hak-İş,PresSpeech594.txt,https://www.tccb.gov.tr/konusmalar/353/107032/hak-is-14-olagan-genel-kurulu-nda-yaptiklari-konusma
09.07.2019,Güneydoğu Avrupa İşbirliği Süreci Zirvesi’nde Yaptıkları Konuşma,Speech at the Southeast European Cooperation Process Summit,PresSpeech595.txt,https://www.tccb.gov.tr/konusmalar/353/107023/guneydogu-avrupa-isbirligi-sureci-zirvesi-nde-yaptiklari-konusma
05.07.2019,Milli Savunma Üniversitesi  Mezuniyet Töreninde Yaptıkları Konuşma,Speech at the National Defense University Graduation Ceremony,PresSpeech596.txt,https://www.tccb.gov.tr/konusmalar/353/106965/milli-savunma-universitesi-mezuniyet-toreninde-yaptiklari-konusma
03.07.2019,8. Uluslararası Öğrenciler Mezuniyet Töreninde Yaptıkları Konuşma,8. International Students' Speech at the Graduation Ceremony,PresSpeech597.txt,https://www.tccb.gov.tr/konusmalar/353/106927/8-uluslararasi-ogrenciler-mezuniyet-toreninde-yaptiklari-konusma
01.07.2019,Japon İşadamlarıyla Buluşma Toplantısında Yaptıkları Konuşma,Speech by Japanese Businessmen at the Meeting Meeting,PresSpeech598.txt,https://www.tccb.gov.tr/konusmalar/353/106899/japon-isadamlariyla-bulusma-toplantisinda-yaptiklari-konusma
30.06.2019,Japonya’daki Türk Toplumuyla Buluşma Programında Yaptıkları Konuşma,Their Speech at the Program to Meet with the Turkish Community in Japan,PresSpeech599.txt,https://www.tccb.gov.tr/konusmalar/353/106889/japonya-daki-turk-toplumuyla-bulusma-programinda-yaptiklari-konusma
30.06.2019,Japonya'da Ara Güler Sergisi'nin Açılışında Yaptıkları Konuşma,Speech at the Opening of the Ara Güler Exhibition in Japan,PresSpeech600.txt,https://www.tccb.gov.tr/konusmalar/353/106888/japonya-da-ara-guler-sergisi-nin-acilisinda-yaptiklari-konusma
29.06.2019,G-20 Zirvesi Nedeniyle Bulunduğu Osaka’da Düzenlediği Basın Toplantısında Yaptıkları Konuşma,Speech at the Press Conference Held in Osaka Due to the G-20 Summit,PresSpeech601.txt,https://www.tccb.gov.tr/konusmalar/353/106887/g-20-zirvesi-nedeniyle-bulundugu-osaka-da-duzenledigi-basin-toplantisinda-yaptiklari-konusma
27.06.2019,Mukogawa Kadın Üniversitesi’nde Fahri Doktora Unvanı Tevdi Töreninde Yaptıkları Konuşma,Speech at the Honorary Doctorate Award Ceremony at Mukogawa Women's University,PresSpeech602.txt,https://www.tccb.gov.tr/konusmalar/353/105801/mukogawa-kadin-universitesi-nde-fahri-doktora-unvani-tevdi-toreninde-yaptiklari-konusma
25.06.2019,AK Parti Grup Toplantısı'nda Yaptıkları Konuşma,Speech at the AK Party Group Meeting,PresSpeech603.txt,https://www.tccb.gov.tr/konusmalar/353/105783/ak-parti-grup-toplantisi-nda-yaptiklari-konusma
24.06.2019,İstanbul Biz Birlikte Türkiye’yiz Buluşmasında Yaptıkları Konuşma,Their Speech at the Istanbul We Are Turkey Together Meeting,PresSpeech604.txt,https://www.tccb.gov.tr/konusmalar/353/105776/istanbul-biz-birlikte-turkiye-yiz-bulusmasinda-yaptiklari-konusma
20.06.2019,Bahçelievler Toplu Açılış Töreninde Yaptıkları Konuşma,Speech at the Bahçelievler Mass Opening Ceremony,PresSpeech605.txt,https://www.tccb.gov.tr/konusmalar/353/105758/bahcelievler-toplu-acilis-toreninde-yaptiklari-konusma
20.06.2019,Uluslararası Basın Kuruluşları Temsilcileri Toplantısında Yaptıkları Konuşma,Speech at the Meeting of Representatives of International Press Organizations,PresSpeech606.txt,https://www.tccb.gov.tr/konusmalar/353/105755/uluslararasi-basin-kuruluslari-temsilcileri-toplantisinda-yaptiklari-konusma
19.06.2019,“İstanbul Biz Birlikte Türkiye’yiz” Buluşmasında Yaptıkları Konuşma,"Speech at the ""Istanbul We Are Turkey Together"" Meeting",PresSpeech607.txt,https://www.tccb.gov.tr/konusmalar/353/105740/-istanbul-biz-birlikte-turkiye-yiz-bulusmasinda-yaptiklari-konusma
19.06.2019,Sancaktepe Toplu Açılış Töreninde Yaptıkları Konuşma,Speech at the Sancaktepe Mass Opening Ceremony,PresSpeech608.txt,https://www.tccb.gov.tr/konusmalar/353/105735/sancaktepe-toplu-acilis-toreninde-yaptiklari-konusma
18.06.2019,Trabzon Yaşlıları Koruma Derneği Akşam Yemeğinde Yaptıkları Konuşma,"Trabzon Elderly Protection Association, Speech at the Dinner",PresSpeech609.txt,https://www.tccb.gov.tr/konusmalar/353/105721/trabzon-yaslilari-koruma-dernegi-aksam-yemeginde-yaptiklari-konusma
18.06.2019,Sultangazi Toplu Açılış Töreninde Yaptıkları Konuşma,Speech at the Sultangazi Mass Opening Ceremony,PresSpeech610.txt,https://www.tccb.gov.tr/konusmalar/353/105718/sultangazi-toplu-acilis-toreninde-yaptiklari-konusma
17.06.2019,94 Ruhuyla Cihannüma ve Kadim Dostlar Buluşmasında Yaptıkları Konuşma,The Speech Given at the Meeting of Cihannüma and Ancient Friends with the Spirit of 94,PresSpeech611.txt,https://www.tccb.gov.tr/konusmalar/353/105705/94-ruhuyla-cihannuma-ve-kadim-dostlar-bulusmasinda-yaptiklari-konusma
16.06.2019,İhracatın Şampiyonları Ödül Töreni ve Türkiye İhracatçılar Meclisi Olağan Genel Kurulu’nda Yaptıkları Konuşma,Champions of Export Award Ceremony and Speech at the Ordinary General Assembly of the Turkish Exporters Assembly,PresSpeech612.txt,https://www.tccb.gov.tr/konusmalar/353/105698/ihracatin-sampiyonlari-odul-toreni-ve-turkiye-ihracatcilar-meclisi-olagan-genel-kurulu-nda-yaptiklari-konusma
15.06.2019,Asya’da İşbirliği ve Güven Artırıcı Önlemler Konferansı 5. Zirvesinde Yaptıkları Konuşma,Speech at the 5th Summit of the Conference on Cooperation and Confidence-Building Measures in Asia,PresSpeech613.txt,https://www.tccb.gov.tr/konusmalar/353/105687/asya-da-isbirligi-ve-guven-artirici-onlemler-konferansi-5-zirvesinde-yaptiklari-konusma
12.06.2019,AK Parti Grup Toplantısında Yaptıkları Konuşma,Speech at the AK Party Group Meeting,PresSpeech614.txt,https://www.tccb.gov.tr/konusmalar/353/105639/ak-parti-grup-toplantisinda-yaptiklari-konusma
31.05.2019,Büyük Üsküdar İftarında Yaptıkları Konuşma,Their Speech at the Great Üsküdar Iftar,PresSpeech615.txt,https://www.tccb.gov.tr/konusmalar/353/105626/buyuk-uskudar-iftarinda-yaptiklari-konusma
31.05.2019,Yargı Reformu Stratejisi Programı’nda Yaptıkları Konuşma,Speech at the Judicial Reform Strategy Program,PresSpeech616.txt,https://www.tccb.gov.tr/konusmalar/353/105577/yargi-reformu-stratejisi-programi-nda-yaptiklari-konusma
30.05.2019,Yargı Çalışanları ile İftar Programında Yaptıkları Konuşma,Conversation with Judicial Staff at the Iftar Program,PresSpeech617.txt,https://www.tccb.gov.tr/konusmalar/353/105578/yargi-calisanlari-ile-iftar-programinda-yaptiklari-konusma
29.05.2019,İstanbul’un Fethinin 566. Yılı Kutlamaları ve İftar Programında Yaptıkları Konuşma,Celebrations of the 566th Anniversary of the Conquest of Istanbul and their Speech at the Iftar Program,PresSpeech618.txt,https://www.tccb.gov.tr/konusmalar/353/105561/istanbul-un-fethinin-566-yili-kutlamalari-ve-iftar-programinda-yaptiklari-konusma
26.05.2019,AK Parti İstanbul Mahalle Başkanları ile İftar Programında Yaptıkları Konuşma,Speech with AK Party Istanbul Neighborhood Heads at the Iftar Program,PresSpeech619.txt,https://www.tccb.gov.tr/konusmalar/353/105530/ak-parti-istanbul-mahalle-baskanlari-ile-iftar-programinda-yaptiklari-konusma
25.05.2019,Sanatçı ve Sporcular ile İftar Programında Yaptıkları Konuşma,Conversation with Artists and Athletes at the Iftar Program,PresSpeech620.txt,https://www.tccb.gov.tr/konusmalar/353/105529/sanatci-ve-sporcular-ile-iftar-programinda-yaptiklari-konusma
24.05.2019,İstanbul Esnaf ve Sanatkârları ile İftar Programında Yaptıkları Konuşma,Speech with Istanbul Tradesmen and Craftsmen at the Iftar Program,PresSpeech621.txt,https://www.tccb.gov.tr/konusmalar/353/105527/istanbul-esnaf-ve-sanatk-rlari-ile-iftar-programinda-yaptiklari-konusma
23.05.2019,Çalışma Meclisi’nin 12. Toplantısı’nda Yaptıkları Konuşma,Speech Delivered at the 12th Meeting of the Working Council,PresSpeech622.txt,https://www.tccb.gov.tr/konusmalar/353/105531/calisma-meclisi-nin-12-toplantisi-nda-yaptiklari-konusma
23.05.2019,2019 Prof. Dr. Fuat Sezgin Yılı Toplantısı'nda Yaptıkları Konuşma,2019 Prof. Dr. Speech by Fuat Sezgin at the Annual Meeting,PresSpeech623.txt,https://www.tccb.gov.tr/konusmalar/353/105482/2019-prof-dr-fuat-sezgin-yili-toplantisi-nda-yaptiklari-konusma
23.05.2019,Sağlık Çalışanları İle İftar Programında Yaptıkları Konuşma,Conversation with Healthcare Professionals at the Iftar Program,PresSpeech624.txt,https://www.tccb.gov.tr/konusmalar/353/105501/saglik-calisanlari-ile-iftar-programinda-yaptiklari-konusma
22.05.2019,Adli Yargı Hâkim ve Cumhuriyet Savcısı Kura Töreninde Yaptıkları Konuşma,Speech of the Judicial Judge and the Public Prosecutor at the Drawing Ceremony,PresSpeech625.txt,https://www.tccb.gov.tr/konusmalar/353/105462/adli-yargi-h-kim-ve-cumhuriyet-savcisi-kura-toreninde-yaptiklari-konusma
22.05.2019,Eğitim Çalışanları ile İftar Programında Yaptıkları Konuşma,Conversation with Education Staff at the Iftar Program,PresSpeech626.txt,https://www.tccb.gov.tr/konusmalar/353/105472/egitim-calisanlari-ile-iftar-programinda-yaptiklari-konusma
21.05.2019,Tüm Dönem Milletvekilleri ile İftar Programında Yaptıkları Konuşma,Speech with All Term Deputies at the Iftar Program,PresSpeech627.txt,https://www.tccb.gov.tr/konusmalar/353/105452/tum-donem-milletvekilleri-ile-iftar-programinda-yaptiklari-konusma
20.05.2019,İstanbul Muhtarları İle İftar Programında Yaptıkları Konuşma,Speech with the Heads of Istanbul at the Iftar Program,PresSpeech628.txt,https://www.tccb.gov.tr/konusmalar/353/105427/istanbul-muhtarlari-ile-iftar-programinda-yaptiklari-konusma
19.05.2019,"19 Mayıs Atatürk’ü Anma, Gençlik ve Spor Bayramı 100. Yıl Törenlerinde Yaptıkları Konuşma","Speech at the Centenary Ceremonies of the 19 May Commemoration of Atatürk, Youth and Sports Day",PresSpeech629.txt,https://www.tccb.gov.tr/konusmalar/353/105430/19-mayis-ataturk-u-anma-genclik-ve-spor-bayrami-100-yil-torenlerinde-yaptiklari-konusma
19.05.2019,Gençler ve Sporcularla İftar Programında Yaptıkları Konuşma,Conversation with Youth and Athletes at the Iftar Program,PresSpeech630.txt,https://www.tccb.gov.tr/konusmalar/353/105435/gencler-ve-sporcularla-iftar-programinda-yaptiklari-konusma
