title,url,date
"Cumhurbaşkanı Recep Tayyip Erdoğan'ın eşi Emine Erdoğan, Macaristan'ın başkenti Budapeşte'de Kispest Gökkuşağı Anaokulu'nun açılışına katıldı.",https://www.tccb.gov.tr/assets/video/2019E/2019-11-07-macaristan-03-ee-anaokul.mp4,07.11.2019
"Cumhurbaşkanı Erdoğan, Macaristan’da resmî törenle karşılandı",https://www.tccb.gov.tr/assets/video/2019E/2019-11-07-macaristan-04-resmikarsilama.mp4,07.11.2019
"Cumhurbaşkanı Erdoğan, Macaristan Başbakanı Orban ile düzenlediği ortak basın toplantısında",https://www.tccb.gov.tr/assets/video/2019E/2019-11-07-macaristan-05-bt.mp4,07.11.2019
Ankara Üniversitesi İlahiyat Fakültesi 70. Yıl Kutlama Töreni (Beştepe Millet Kongre ve Kültür Merkezi),https://www.tccb.gov.tr/assets/video/2019E/2019-11-06-ilahiyat.mp4,06.11.2019
AK Parti Grup Toplantısı (TBMM),https://www.tccb.gov.tr/assets/video/2019E/2019-11-05-akparti.mp4,05.11.2019
"Cumhurbaşkanı Erdoğan, İleri Müşterek Harekât Merkezi'ni ziyaret etti",https://www.tccb.gov.tr/assets/video/2019E/2019-11-03-sanliurfa.mp4,03.11.2019
,https://www.tccb.gov.tr/assets/video/2019E/2019-11-01-bm.mp4,01.11.2019
"Emine Erdoğan'ın, 2. Uluslararası Sıfır Atık Zirvesi’nde yaptığı konuşma",https://www.tccb.gov.tr/assets/video/2019E/2019-11-01-ee-sifiratik.mp4,01.11.2019
Ortak Basın Toplantısı (Cumhurbaşkanlığı Külliyesi),https://www.tccb.gov.tr/assets/video/2019E/2019-10-31-gurcistan-bt.mp4,31.10.2019
AK Parti Büyükşehir ve İl Belediye Başkanları ile Toplantı (AK Parti Genel Merkezi),https://www.tccb.gov.tr/assets/video/2019E/2019-10-31-belediyebaskanlari.mp4,31.10.2019
AK Parti Grup Toplantısı (TBMM),https://www.tccb.gov.tr/assets/video/2019E/2019-10-30-akparti.mp4,30.10.2019
Katar Başbakanı Şeyh Abdullah bin Nasır bin Halife el-Sani’yi Kabul (Cumhurbaşkanlığı Külliyesi),https://www.tccb.gov.tr/assets/video/2019E/2019-10-30-katar.mp4,30.10.2019
"Cumhurbaşkanı Erdoğan, Anıtkabir’de düzenlenen törene katıldı",https://www.tccb.gov.tr/assets/video/2019E/2019-10-29-cumhuriyet-01-anitkabir.mp4,29.10.2019
"Cumhurbaşkanı Erdoğan, Cumhurbaşkanlığı Külliyesinde tebrikleri kabul etti",https://www.tccb.gov.tr/assets/video/2019E/2019-10-29-cumhuriyet-02-kulliye.mp4,29.10.2019
29 Ekim Cumhuriyet Bayramı Kabul Töreni,https://www.tccb.gov.tr/assets/video/2019E/2019-10-29-cumhuriyet-03-sergisalonu.mp4,29.10.2019
29 Ekim Cumhuriyet Bayramı Mesajı,https://www.tccb.gov.tr/assets/video/2019E/2019-10-28-29ekimbayrammesaji.mp4,28.10.2019
Ekvator Ginesi Cumhurbaşkanı Teodoro Obiang Nguema Mbasogo ile Görüşme (Vahdettin Köşkü),https://www.tccb.gov.tr/assets/video/2019E/2019-10-26-ekvator.mp4,26.10.2019
"Cumhurbaşkanı Recep Tayyip Erdoğan'ın eşi Emine Erdoğan, ""Şehircilik ve Mutlu Şehir"" temasıyla Kocaeli’nde düzenlenen Kartepe Zirvesi'ne katıldı.",https://www.tccb.gov.tr/assets/video/2019E/2019-10-25-ee-kartepe.mp4,25.10.2019
Gine Cumhurbaşkanı Alpha Condé ile Görüşme (Cumhurbaşkanlığı Dolmabahçe Çalışma Ofisi),https://www.tccb.gov.tr/assets/video/2019E/2019-10-25-gine.mp4,25.10.2019
Avusturya Büyükelçisi Johannes Wimmer’in Güven Mektubunu Takdim Töreni (Cumhurbaşkanlığı Külliyesi),https://www.tccb.gov.tr/assets/video/2019E/2019-10-24-avusturya.mp4,24.10.2019
Şili Büyükelçisi Armin Ernesto Andreya Latorre’nin Güven Mektubunu Takdim Töreni (Cumhurbaşkanlığı Külliyesi),https://www.tccb.gov.tr/assets/video/2019E/2019-10-24-sili.mp4,24.10.2019
105. Dönem Kaymakamlık Kursu Kura Töreni (Cumhurbaşkanlığı Külliyesi),https://www.tccb.gov.tr/assets/video/2019E/2019-10-24-kaymakam.mp4,24.10.2019
Karadağ Büyükelçisi Perisa Kastratoviç’in Güven Mektubunu Takdim Töreni (Cumhurbaşkanlığı Külliyesi),https://www.tccb.gov.tr/assets/video/2019E/2019-10-24-karadag.mp4,24.10.2019
"Cumhurbaşkanı Erdoğan, MHP Genel Başkanı Bahçeli ile bir araya geldi",https://www.tccb.gov.tr/assets/video/2019E/2019-10-23-devletbahceli.mp4,23.10.2019
"“Suriye’nin geleceğinde PKK-YPG gibi terör örgütlerine yer yoktur, olmamalıdır”",https://www.tccb.gov.tr/assets/video/2019E/2019-10-22-bt.mp4,22.10.2019
Cumhurbaşkanı Erdoğan Rusya’da,https://www.tccb.gov.tr/assets/video/2019E/2019-10-22-rusya-01-varis.mp4,22.10.2019
"“Türkiye ve Rusya, Suriye topraklarında ayrılıkçı hiçbir gündeme izin vermeyecektir”",https://www.tccb.gov.tr/assets/video/2019E/2019-10-22-rusya-05-bt.mp4,22.10.2019
TRT World Forum 2019 Küreselleşmenin Krizi: Riskler ve Fırsatlar (İstanbul Kongre Merkezi),https://www.tccb.gov.tr/assets/video/2019E/2019-10-21-forum.mp4,21.10.2019
"Cumhurbaşkanı Recep Tayyip Erdoğan, Samsun Vezirköprü Meşeli köyünden gelen ve 15 Temmuz Şehitler Anıtı'nı ziyaret eden ilkokul öğrencileri ile sohbet etti.",https://www.tccb.gov.tr/assets/video/2019E/2019-10-21-ogrenciler.mp4,21.10.2019
Norveç Büyükelçisi Erling Skjonsberg’in Güven Mektubunu Takdim Töreni (Cumhurbaşkanlığı Külliyesi),https://www.tccb.gov.tr/assets/video/2019E/2019-10-21-norvec.mp4,21.10.2019
İrlanda Büyükelçisi Sonya McGuinness’in Güven Mektubunu Takdim Töreni (Cumhurbaşkanlığı Külliyesi),https://www.tccb.gov.tr/assets/video/2019E/2019-10-21-irlanda.mp4,21.10.2019
Finlandiya Büyükelçisi Ari Maki’nin Güven Mektubunu Takdim Töreni (Cumhurbaşkanlığı Külliyesi),https://www.tccb.gov.tr/assets/video/2019E/2019-10-21-finlandiya.mp4,21.10.2019
"11. Rize Tanıtım Günleri “Bırakalım Sigarayı, İçelim Rize Çayı” (Maltepe Etkinlik Alanı)",https://www.tccb.gov.tr/assets/video/2019E/2019-10-20-rize.mp4,20.10.2019
"Cumhurbaşkanı Erdoğan'ın, Afrika Ülkeleri Müslüman Dini Liderler Zirvesi’nde yaptığı konuşma",https://www.tccb.gov.tr/assets/video/2019E/2019-10-19-afrika.mp4,19.10.2019
Emine Erdoğan'ın Sıfır Atık Forumunda Yaptığı Konuşma,https://www.tccb.gov.tr/assets/video/2019E/2019-10-19-ee-entech.mp4,19.10.2019
"Emine Erdoğan'ın, ""Sıfır Atık Eğitim Projesi"" tanıtım toplantısında yaptığı konuşma",https://www.tccb.gov.tr/assets/video/2019E/2019-10-18-ee-sifiratik.mp4,18.10.2019
"Cumhurbaşkanı Recep Tayyip Erdoğan, yabancı basın mensuplarıyla Cumhurbaşkanlığı Dolmabahçe Ofisi’nde bir araya geldi.",https://www.tccb.gov.tr/assets/video/2019E/2019-10-18-yabancibasin.mp4,18.10.2019
ABD Başkan Yardımcısı Mike Pence’i Kabul (Cumhurbaşkanlığı Külliyesi),https://www.tccb.gov.tr/assets/video/2019E/2019-10-17-abd.mp4,17.10.2019
"Emine Erdoğan, ""Yeşil Ekonomi Yolunda Sıfır Atık"" Projesine Katıldı",https://www.tccb.gov.tr/assets/video/2019E/2019-10-16-ee-sifiratik.mp4,16.10.2019
AK Parti Grup Toplantısı (TBMM),https://www.tccb.gov.tr/assets/video/2019E/2019-10-16-akparti.mp4,16.10.2019
"Cumhurbaşkanı Erdoğan, Özbekistan Cumhurbaşkanı Mirziyoyev ile bir araya geldi",https://www.tccb.gov.tr/assets/video/2019E/2019-10-14-azerbaycan-05-ozbekistan.mp4,14.10.2019
"Cumhurbaşkanı Erdoğan, Kazakistan’ın Kurucu Cumhurbaşkanı Nazarbayev ile görüştü",https://www.tccb.gov.tr/assets/video/2019E/2019-10-14-azerbaycan-06-kazakistan.mp4,14.10.2019
Kırgızistan Cumhurbaşkanı Sooronbay Ceenbekov’la 13.30 görüşme,https://www.tccb.gov.tr/assets/video/2019E/2019-10-15-azerbaycan-kirgizistan.mp4,15.10.2019
"Cumhurbaşkanı Erdoğan, Türkiye-AB Karma İstişare Komitesi üyelerini kabul etti",https://www.tccb.gov.tr/assets/video/2019E/2019-10-15-kabul.mp4,15.10.2019
"Cumhurbaşkanı Erdoğan'ın, Azerbaycan ziyareti öncesi yaptığı açıklama",https://www.tccb.gov.tr/assets/video/2019E/2019-10-14-azerbaycan-01-basinaciklamasi.mp4,14.10.2019
Cumhurbaşkanı Erdoğan Azerbaycan'da,https://www.tccb.gov.tr/assets/video/2019E/2019-10-14-azerbaycan-02-karsilama.mp4,14.10.2019
"Cumhurbaşkanı Recep Tayyip Erdoğan, Azerbaycan’da Dünya Türk İş Konseyi Bakü Buluşması Toplantısı’na katılarak bir konuşma yaptı.",https://www.tccb.gov.tr/assets/video/2019E/2019-10-14-azerbaycan-03-iskonseyi.mp4,14.10.2019
"Cumhurbaşkanı Erdoğan, Macaristan Başbakanı Orban ile görüştü",https://www.tccb.gov.tr/assets/video/2019E/2019-10-14-azerbaycan-04-macaristan.mp4,14.10.2019
"Cumhurbaşkanı Recep Tayyip Erdoğan, Cumhurbaşkanlığı Dolmabahçe Ofisi'nde gazete, televizyon ve ajansların yöneticileriyle bir araya geldi.",https://www.tccb.gov.tr/assets/video/2019E/2019-10-13-gazeteciler.mp4,13.10.2019
NATO Genel Sekreteri Jens Stoltenberg’i Kabul (Cumhurbaşkanlığı Dolmabahçe Ofisi),https://www.tccb.gov.tr/assets/video/2019E/2019-10-11-nato.mp4,11.10.2019
Terörle Mücadele ve Bölgesel Bağlantılılık Konulu 3. Parlamento Başkanları Konferansı Açılış Resepsiyonu (Dolmabahçe Sarayı),https://www.tccb.gov.tr/assets/video/2019E/2019-10-11-resepsiyon.mp4,11.10.2019
Genişletilmiş İl Başkanları Toplantısı (AK Parti Genel Merkezi),https://www.tccb.gov.tr/assets/video/2019E/2019-10-10-ilbaskanlari.mp4,10.10.2019
"“Türk Silahlı Kuvvetleri’miz, Suriye Millî Ordusu’yla birlikte Barış Pınarı Harekâtı’nı başlatmıştır”",https://www.tccb.gov.tr/assets/video/2019E/2019-10-09-baris-pinari-harekati.mp4,09.10.2019
"Cumhurbaşkanı Erdoğan, ""Barış Pınarı Harekâtı” koordinasyon toplantısına başkanlık yaptı",https://www.tccb.gov.tr/assets/video/2019E/2019-10-09-toplanti.mp4,09.10.2019
"Cumhurbaşkanı Erdoğan, Sırbistan’da toplu açılış ve temel atma törenine katıldı",https://www.tccb.gov.tr/assets/video/2019E/2019-10-08-sirbistan-16-acilis.mp4,08.10.2019
"Cumhurbaşkanı Erdoğan, Sırbistan'a Hareketinden Önce Esenboğa Havalimanı'nda Açıklamalarda Bulundu",https://www.tccb.gov.tr/assets/video/2019E/2019-10-07-bt.mp4,07.10.2019
Cumhurbaşkanı Erdoğan Sırbistan’da,https://www.tccb.gov.tr/assets/video/2019E/2019-10-07-sirbistan-01-karsilama.mp4,07.10.2019
Sırbistan Cumhurbaşkanı Aleksandar Vuçiç ile Ortak Basın Toplantısı,https://www.tccb.gov.tr/assets/video/2019E/2019-10-07-sirbistan-09-bt.mp4,07.10.2019
Türkiye-Sırbistan İş Forumu,https://www.tccb.gov.tr/assets/video/2019E/2019-10-07-sirbistan-10-isforumu.mp4,07.10.2019
AK Parti 29. İstişare ve Değerlendirme Toplantısı Kapanış Konuşması (Kızılcahamam),https://www.tccb.gov.tr/assets/video/2019D/2019-10-06-kizilcahamam-kapanis.mp4,06.10.2019
AK Parti 29. İstişare ve Değerlendirme Toplantısı (Kızılcahamam),https://www.tccb.gov.tr/assets/video/2019D/2019-10-05-kizilcahamam.mp4,05.10.2019
Estonya Büyükelçisi Annely Kolk’un Güven Mektubunu Takdim Töreni,https://www.tccb.gov.tr/assets/video/2019D/2019-10-03-estonya.mp4,03.10.2019
Sri Lanka Büyükelçisi Muhammed Rizvi Hassen’in Güven Mektubunu Takdim Töreni,https://www.tccb.gov.tr/assets/video/2019D/2019-10-03-srilanka.mp4,03.10.2019
Slovenya Büyükelçisi Primoz Seligo’nun Güven Mektubunu Takdim Töreni,https://www.tccb.gov.tr/assets/video/2019D/2019-10-03-slovenya.mp4,03.10.2019
Yüksek İstişare Kurulu Toplantısı,https://www.tccb.gov.tr/assets/video/2019D/2019-10-02-yik.mp4,02.10.2019
TBMM 27. Dönem 3. Yasama Yılı Açılış Toplantısı,https://www.tccb.gov.tr/assets/video/2019D/2019-10-01-tbmm-konusma.mp4,01.10.2019
MGK Toplantısı,https://www.tccb.gov.tr/assets/video/2019D/2019-09-30-mgk.mp4,30.09.2019
MİLGEM Projesinin 4’üncü Gemisi Olan “TCG Kınalıada’nın (F-514) Hizmete Giriş Töreni” ve Pakistan MİLGEM Korvet Projesi 1’inci Gemi Sac Kesme Töreni (İstanbul Tersane Komutanlığı / Tuzla),https://www.tccb.gov.tr/assets/video/2019D/2019-09-29-gemi.mp4,29.09.2019
"Cumhurbaşkanı Erdoğan, ABD ziyaretinin ardından basın toplantısı düzenledi",https://www.tccb.gov.tr/assets/video/2019D/2019-09-25-abd-12-donus-bt.mp4,25.09.2019
"“Yükselen İslam karşıtlığı, ırkçılık ve nefret söylemiyle etkin mücadele yönündeki çabalara öncülük edeceğiz”",https://www.tccb.gov.tr/assets/video/2019D/2019-09-25-abd-01-turkiye-pakistan.mp4,25.09.2019
"Cumhurbaşkanı Erdoğan, Yunanistan Başbakanı Miçotakis ile görüştü",https://www.tccb.gov.tr/assets/video/2019D/2019-09-25-abd-02-yunanistan.mp4,25.09.2019
"Cumhurbaşkanı Erdoğan, Hırvatistan Cumhurbaşkanı Kitaroviç ile görüştü",https://www.tccb.gov.tr/assets/video/2019D/2019-09-25-abd-03-hirvatistan.mp4,25.09.2019
"Cumhurbaşkanı Erdoğan, Çekya Başbakanı Babis ile görüştü",https://www.tccb.gov.tr/assets/video/2019D/2019-09-25-abd-04-cekya.mp4,25.09.2019
"Cumhurbaşkanı Erdoğan, Irak Cumhurbaşkanı Salih ile görüştü",https://www.tccb.gov.tr/assets/video/2019D/2019-09-25-abd-05-irak.mp4,25.09.2019
"Emine Erdoğan, New York’ta “Sıfır Atık'la İlgili Ulusal Girişimler Neden Önemli?” etkinliğine katıldı",https://www.tccb.gov.tr/assets/video/2019D/2019-09-25-abd-07-ee-sifiratik.mp4,25.09.2019
"Cumhurbaşkanı Erdoğan, Libya Başkanlık Konseyi Başkanı Sarraj ile bir araya geldi",https://www.tccb.gov.tr/assets/video/2019D/2019-09-25-abd-06-libya.mp4,25.09.2019
"Cumhurbaşkanı Erdoğan, Moldova Cumhurbaşkanı Dodon ile görüştü",https://www.tccb.gov.tr/assets/video/2019D/2019-09-25-abd-08-moldova.mp4,25.09.2019
"Cumhurbaşkanı Erdoğan, Sudan Başbakanı Hamdok ile bir araya geldi",https://www.tccb.gov.tr/assets/video/2019D/2019-09-25-abd-09-sudan.mp4,25.09.2019
TAİK 10. Türkiye Yatırım Konferansı,https://www.tccb.gov.tr/assets/video/2019D/2019-09-25-abd-10-taik.mp4,25.09.2019
Emine Erdoğan: “Çocuk yaşta evlilik insan hakları ihlalidir”,https://www.tccb.gov.tr/assets/video/2019D/2019-09-25-abd-11-ee-panel.mp4,25.09.2019
"Cumhurbaşkanı Erdoğan, Almanya Başbakanı Merkel ile bir araya geldi",https://www.tccb.gov.tr/assets/video/2019D/2019-09-24-abd-06-merkel.mp4,24.09.2019
"Cumhurbaşkanı Recep Tayyip Erdoğan'ın, ABD’nin New York şehrinde Birleşmiş Milletler 74. Genel Kurulu’da yaptığı konuşma",https://www.tccb.gov.tr/assets/video/2019D/2019-09-24-abd-09-bmgenelkurul.mp4,24.09.2019
"Cumhurbaşkanı Erdoğan, BM Genel Sekreteri Guterres ile bir araya geldi",https://www.tccb.gov.tr/assets/video/2019D/2019-09-24-abd-bmgensek.mp4,24.09.2019
"Cumhurbaşkanı Erdoğan, Katar Emiri Al Sani ile görüştü",https://www.tccb.gov.tr/assets/video/2019D/2019-09-24-abd-katar.mp4,24.09.2019
"Cumhurbaşkanı Erdoğan, Birleşik Krallık Başbakanı Johnson ile görüştü",https://www.tccb.gov.tr/assets/video/2019D/2019-09-24-abd-ingiltere.mp4,24.09.2019
"Cumhurbaşkanı Erdoğan, Somali Cumhurbaşkanı Farmajo ile bir araya geldi",https://www.tccb.gov.tr/assets/video/2019D/2019-09-24-abd-somali.mp4,24.09.2019
"Cumhurbaşkanı Erdoğan, İtalya Başbakanı Conte ile görüştü",https://www.tccb.gov.tr/assets/video/2019D/2019-09-24-abd-italya.mp4,24.09.2019
"Cumhurbaşkanı Recep Tayyip Erdoğan, Birleşmiş Milletler 74. Genel Kurulu’nun “Sürdürülebilir Kalkınma Amaçları Zirvesi/Sürdürülebilir Kalkınma Amaçlarının Hayata Geçirilmesini Etkileyen Mega Trendler” başlıklı liderler diyaloğu oturumuna katıldı.",https://www.tccb.gov.tr/assets/video/2019D/2019-09-24-abd-kalkinma.mp4,24.09.2019
"Cumhurbaşkanı Erdoğan, Belçika Başbakanı Michel ile görüştü",https://www.tccb.gov.tr/assets/video/2019D/2019-09-23-abd-01-belcika.mp4,23.09.2019
"Cumhurbaşkanı Erdoğan, Yahudi kuruluş temsilcilerini kabul etti",https://www.tccb.gov.tr/assets/video/2019D/2019-09-23-abd-yahudimusevi.mp4,23.09.2019
"Cumhurbaşkanı Erdoğan, Bosna Hersek Devlet Başkanlığı Konsey Başkanı Komsic ile görüştü",https://www.tccb.gov.tr/assets/video/2019D/2019-09-23-abd-bosna.mp4,23.09.2019
"Cumhurbaşkanı Erdoğan, BM İklim Eylemi Zirvesi’ne katıldı",https://www.tccb.gov.tr/assets/video/2019D/2019-09-23-abd-iklim.mp4,23.09.2019
"Cumhurbaşkanı Erdoğan, Pakistan Başbakanı Han ile görüştü",https://www.tccb.gov.tr/assets/video/2019D/2019-09-23-abd-pakistan.mp4,23.09.2019
"Cumhurbaşkanı Erdoğan'ın, Türk-Amerikan Ulusal Yönlendirme Komitesi (TASC) tarafından düzenlenen etkinlikte yaptığı konuşma",https://www.tccb.gov.tr/assets/video/2019D/2019-09-21-abd-02-tasc.mp4,21.09.2019
"Cumhurbaşkanı Erdoğan'ın, TÜRKEN Vakfı geleneksel yemeğinde yaptığı konuşma",https://www.tccb.gov.tr/assets/video/2019D/2019-09-21-abd-03-turken.mp4,21.09.2019
İstanbul’dan New York’a Hareket (Atatürk Havalimanı),https://www.tccb.gov.tr/assets/video/2019D/2019-09-21-abd-01-aciklama.mp4,21.09.2019
Teknofest’i Ziyaret (Atatürk Havalimanı),https://www.tccb.gov.tr/assets/video/2019D/2019-09-21-teknofest.mp4,21.09.2019
2. Uluslararası Sosyal Bilimler Kongresi (İstanbul Üniversitesi Rektörlük Binası),https://www.tccb.gov.tr/assets/video/2019D/2019-09-20-kongre.mp4,20.09.2019
"Gaziler Günü Münasebetiyle Aile, Çalışma ve Sosyal Hizmetler Bakanı Zehra Zümrüt Selçuk ve Beraberindeki Gazileri Kabul (Cumhurbaşkanlığı Külliyesi)",https://www.tccb.gov.tr/assets/video/2019D/2019-09-19-gazi.mp4,19.09.2019
"Cumhurbaşkanı Erdoğan, Paralimpik Yüzme Şampiyonası'nda dereceye giren Sümeyye Boyacı ile Sevilay Öztürk'ü kabul etti",https://www.tccb.gov.tr/assets/video/2019D/2019-09-17-paralimpik.mp4,17.09.2019
"Cumhurbaşkanı Erdoğan, Türkiye Futbol Federasyonu Yönetim Kurulu Üyelerini kabul etti",https://www.tccb.gov.tr/assets/video/2019D/2019-09-17-tff.mp4,17.09.2019
İran Cumhurbaşkanı Hasan Ruhani ile Görüşme (Cumhurbaşkanlığı Çankaya Köşkü),https://www.tccb.gov.tr/assets/video/2019D/2019-09-16-ucluzirve-01-irankabul.mp4,16.09.2019
Haftanın Özeti (9-15 Eylül 2019),https://www.tccb.gov.tr/assets/resim/genel/haftaninozeti/vg-ozet.mp4,
Türkiye-Rusya-İran Üçlü Zirvesi sonrasında ortak basın toplantısı,https://www.tccb.gov.tr/assets/video/2019D/2019-09-16-ucluzirve-07-bt.mp4,16.09.2019
Suriye konulu Üçlü Zirve'nin ardından ortak bildiri,https://www.tccb.gov.tr/assets/video/2019D/2019-09-16-ucluzirve-06-zirve.mp4,16.09.2019
"Emine Erdoğan, geri dönüşümden elde edilen defterleri öğrencilere dağıttı",https://www.tccb.gov.tr/assets/video/2019D/2019-09-13-ee-geridonusum.mp4,13.09.2019
“Terörle mücadelemizi yılmadan devam ettireceğiz”,https://www.tccb.gov.tr/assets/video/2019D/2019-09-13-cuma.mp4,13.09.2019
Büyükşehir Belediye Başkanları Toplantısı (Cumhurbaşkanlığı Külliyesi),https://www.tccb.gov.tr/assets/video/2019D/2019-09-11-belediyebaskanlari.mp4,11.09.2019
ABD Ticaret Bakanı Wilbur Ross ve Beraberindeki Heyeti Kabul (Cumhurbaşkanlığı Külliyesi),https://www.tccb.gov.tr/assets/video/2019D/2019-09-10-abd.mp4,10.09.2019
Kabine Toplantısı (Cumhurbaşkanlığı Külliyesi),https://www.tccb.gov.tr/assets/video/2019D/2019-09-10-kabine.mp4,10.09.2019
"Alternatif Finansta Yeni Ufuklar: Likidite, Yeşil Finans ve Politik Ekonomi Programı (Marmara Üniversitesi Rektörlük Binası)",https://www.tccb.gov.tr/assets/video/2019D/2019-09-09-finans.mp4,09.09.2019
Haftanın Özeti (02-08 Eylül 2019),https://www.tccb.gov.tr/assets/resim/genel/haftaninozeti/vg-ozet.mp4,
"Yapımı Tamamlanan Okulların Ortak Açılışı ve 2019-2020 Eğitim Öğretim Yılı Açılış Töreni (Atatürk Fen Lisesi, Kadıköy)",https://www.tccb.gov.tr/assets/video/2019D/2019-09-09-egitim.mp4,09.09.2019
Önder İmam Hatipliler Buluşması,https://www.tccb.gov.tr/assets/video/2019D/2019-09-08-malatya-onder.mp4,08.09.2019
Toplu Açılış Töreni (Malatya 15 Temmuz Demokrasi Meydanı),https://www.tccb.gov.tr/assets/video/2019D/2019-09-08-malatya-acilis.mp4,08.09.2019
İstanbul Teknik Üniversitesi (İTÜ) Abdülhakim Sancak Camii Açılışı (Ayazağa),https://www.tccb.gov.tr/assets/video/2019D/2019-09-06-cami.mp4,06.09.2019
AK Parti Genişletilmiş İl Başkanları Toplantısı,https://www.tccb.gov.tr/assets/video/2019D/2019-09-05-ilbaskanlari.mp4,05.09.2019
Orta Anadolu Ekonomi Forumu (Sivas Kültür Merkezi),https://www.tccb.gov.tr/assets/video/2019D/2019-09-04-sivas-02-forum.mp4,04.09.2019
Sivas Kongresi’nin 100. Yıl Dönümü Kutlama Programı (Kongre Binası Bahçesi),https://www.tccb.gov.tr/assets/video/2019D/2019-09-04-sivas-01-program.mp4,04.09.2019
"Emine Erdoğan, Ata Tohumu Projesi tanıtım toplantısına katıldı",https://www.tccb.gov.tr/assets/video/2019D/2019-09-04-ee-atatohumu.mp4,04.09.2019
"Emine Erdoğan, Salda Gölü’nü ziyaret etti",https://www.tccb.gov.tr/assets/video/2019D/2019-09-02-ee-salda.mp4,02.09.2019
Mali Cumhurbaşkanı İbrahim Boubacar Keita ile Görüşme,https://www.tccb.gov.tr/assets/video/2019D/2019-09-01-mali.mp4,01.09.2019
Konya’da Yapımı Tamamlanan Yatırım ve Hizmetlerin Toplu Açılış Töreni,https://www.tccb.gov.tr/assets/video/2019D/2019-09-01-konya-acilis.mp4,01.09.2019
Milli Savunma Üniversitesi Harp Okulları Diploma Alma ve Sancak Devir Teslim Töreni,https://www.tccb.gov.tr/assets/video/2019D/2019-08-31-diploma.mp4,31.08.2019
"30 Ağustos Zafer Bayramı: Cumhurbaşkanı Erdoğan, Anıtkabir’de düzenlenen törene katıldı",https://www.tccb.gov.tr/assets/video/2019D/2019-08-30-zaferbayrami-01-anitkabir.mp4,30.08.2019
"Cumhurbaşkanı Erdoğan, Cumhurbaşkanlığı Külliyesinde tebrikleri kabul etti",https://www.tccb.gov.tr/assets/video/2019D/2019-08-30-zaferbayrami-02-tebrik.mp4,30.08.2019
"Cumhurbaşkanı Erdoğan, gazeteci-yazar Şule Yüksel Şenler'in cenaze törenine katıldı",https://www.tccb.gov.tr/assets/video/2019D/2019-08-29-cenaze.mp4,29.08.2019
Radyo ve Televizyon Gazetecileri Derneği Ödül Töreni,https://www.tccb.gov.tr/assets/video/2019D/2019-08-29-odul.mp4,29.08.2019
Kolombiya Büyükelçisi Julio Anibal Riano Velandia’nın Güven Mektubu Takdimi,https://www.tccb.gov.tr/assets/video/2019D/2019-08-28-kolombiya.mp4,28.08.2019
ABD Büyükelçisi David Michael Satterfield’in Güven Mektubu Takdimi,https://www.tccb.gov.tr/assets/video/2019D/2019-08-28-abd.mp4,28.08.2019
Fas Büyükelçisi Mohammed Ali Lazreq’in Güven Mektubu Takdimi,https://www.tccb.gov.tr/assets/video/2019D/2019-08-28-fas.mp4,28.08.2019
"Cumhurbaşkanı Erdoğan, Rusya Devlet Başkanı Putin ile görüştü",https://www.tccb.gov.tr/assets/video/2019D/2019-08-27-rusya-04-basbasa.mp4,27.08.2019
"Cumhurbaşkanı Erdoğan'ın, Rusya Devlet Başkanı Putin ile düzenlediği ortak basın toplantısı",https://www.tccb.gov.tr/assets/video/2019D/2019-08-27-rusya-bt.mp4,27.08.2019
Malazgirt Zaferinin 948. Yıl Dönümü Kutlama Programı (Malazgirt Milli Park Alanı),https://www.tccb.gov.tr/assets/video/2019D/2019-08-26-mus-kutlama.mp4,26.08.2019
“Biz binlerce yıllık tarihini şanlı zaferlerle ilmek ilmek dokumuş bir devletiz”,https://www.tccb.gov.tr/assets/video/2019D/2019-08-26-bitlis-hitap.mp4,26.08.2019
"Cumhurbaşkanı Erdoğan'ın, Artvin’in Yusufeli ilçesinde vatandaşlara hitaben yaptığı konuşma",https://www.tccb.gov.tr/assets/video/2019D/2019-08-24-artvin-halkahitap.mp4,24.08.2019
"Cumhurbaşkanı Erdoğan, Rize’de toplu açılış töreninde yaptığı konuşma",https://www.tccb.gov.tr/assets/video/2019D/2019-08-24-rize-topluacilis.mp4,24.08.2019
Jandarma ve Sahil Güvenlik Akademisi Başkanlığı Subay ve Astsubay Mezuniyet Töreni (Jandarma ve Sahil Güvenlik Akademisi Başkanlığı/Beytepe),https://www.tccb.gov.tr/assets/video/2019D/2019-08-23-toren.mp4,23.08.2019
Endonezya büyükelçisinden güven mektubu,https://www.tccb.gov.tr/assets/video/2019D/2019-08-22-endonezya.mp4,22.08.2019
Filipinler büyükelçisinden güven mektubu,https://www.tccb.gov.tr/assets/video/2019D/2019-08-22-filipinler.mp4,22.08.2019
Irak büyükelçisinden güven mektubu,https://www.tccb.gov.tr/assets/video/2019D/2019-08-22-irak.mp4,22.08.2019
Mali büyükelçisinden güven mektubu,https://www.tccb.gov.tr/assets/video/2019D/2019-08-22-mali.mp4,22.08.2019
"Cumhurbaşkanı Erdoğan, KKTC Başbakanı Tatar ile bir araya geldi",https://www.tccb.gov.tr/assets/video/2019D/2019-08-22-kktc.mp4,22.08.2019
"Cumhurbaşkanı Erdoğan, siyam ikizleri Ayşe ve Sema Tanrıkulu’yu kabul etti",https://www.tccb.gov.tr/assets/video/2019D/2019-08-22-ikizler.mp4,22.08.2019
Cumhurbaşkanı Erdoğan'ın KKTC Başbakanı Tatar ile düzenlediği ortak basın toplantısı,https://www.tccb.gov.tr/assets/video/2019D/2019-08-22-kktc-bt.mp4,22.08.2019
Cumhurbaşkanı Erdoğan'ın Kurban Bayramı dolayısıyla yayımladığı mesaj,https://www.tccb.gov.tr/assets/video/2019D/2019-08-10-bayrammesaji.mp4,10.08.2019
"Emine Erdoğan, kadın büyükelçilere ve büyükelçi eşlerine öğle yemeği verdi",https://www.tccb.gov.tr/assets/resim/vmini/2019D/2019-08-07-ee-buyukelci.mp4,07.08.2019
11. Büyükelçiler Konferansı (Cumhurbaşkanlığı Külliyesi),https://www.tccb.gov.tr/assets/video/2019D/2019-08-06-buyukelciler.mp4,06.08.2019
Bursa Şehir Hastanesi ve İstanbul-İzmir Otoyolu Ortak Açılış Töreni (Bursa-İzmir Otoyolu “Badırga Mevkii”),https://www.tccb.gov.tr/assets/video/2019D/2019-08-04-acilis.mp4,04.08.2019
İstanbul Mor Efrem Süryani Kadim Ortodoks Kilisesi Temel Atma Töreni,https://www.tccb.gov.tr/assets/video/2019D/2019-08-03-kilise.mp4,03.08.2019
“Fırat'ın doğusundaki terör koridorunu paramparça etmekte kararlıyız”,https://www.tccb.gov.tr/assets/video/2019D/2019-07-26-akparti.mp4,26.07.2019
TİGEM 69. Geleneksel Hasat Bayramı,https://www.tccb.gov.tr/assets/video/2019D/2019-07-26-tarim.mp4,26.07.2019
“Önümüzdeki dönemde Türkiye Malezya arasındaki iş birliğinin her alanda ilerlediğine şahit olacağız”,https://www.tccb.gov.tr/assets/video/2019D/2019-07-25-malezya-03-bt.mp4,25.07.2019
"Cumhurbaşkanlığı Sözcüsü Kalın, ABD’nin Suriye Özel Temsilcisi Jeffrey ile görüştü",https://www.tccb.gov.tr/assets/video/2019D/2019-07-24-ik.mp4,24.07.2019
"Cumhurbaşkanı Erdoğan, 15 Temmuz Şehitler Abidesi'ne çiçek bıraktı",https://www.tccb.gov.tr/assets/video/2019C/2019-07-15-15Temmuz-01-kulliye-anit.mp4,15.07.2019
