video_filename,url,title,length_seconds,publish_date,description,keywords,date,date_src,transcription_filename,folder
video_639.mp4,https://www.youtube.com/watch?v=-mMcVZaJNeQ,Türkiye’nin Önünde Çok Ciddi Sorunlar ve Alınması Gereken Çok Önemli Kararlar Var|03.07.15,1020,2015-07-05 00:00:00,"Türkiye Yeşilay Cemiyeti’nin düzenlediği iftar programında konuşan Cumhurbaşkanı Erdoğan, “Türkiye’nin hükümet meselesiyle uğraşmak zorunda kalmasını asla arzu etmezdim; ama şartlar ülkemizi bu noktaya getirdi. İnşallah bu dönemi de en kısa sürede ve en hayırlı şekilde geride bırakacağız” dedi.","['Cumhurbaşkanı Erdoğan', 'Türkiye Yeşilay Cemiyet', 'Turkey (Country)']",,,,Videos2
video_640.mp4,https://www.youtube.com/watch?v=8N8wLG1ocW8,Cumhurbaşkanlığı Külliyesi İdari Binaları Gezisi,920,2015-07-05 00:00:00,"Cumhurbaşkanlığı Külliyesi’ndeki kuzey ve güney idari binalar, Cumhurbaşkanlığı Basın Başdanışmanlığı tarafından düzenlenen bir tanıtım gezisiyle ilk kez kapılarını basına açtı.","['Cumhurbaşkanlığı Külliyesi', 'Cumhurbaşkanlığı Basın Başdanışmanlığı', 'Külliye (Architectural Style)', 'President Of Turkey (Government Office Or Title)']",,,,Videos2
video_641.mp4,https://www.youtube.com/watch?v=GeDONky1CvQ,"Cumhurbaşkanı Erdoğan, Cumhurbaşkanlığı Personeline İftar Verdi |01.07.15",117,2015-07-01 00:00:00,"Cumhurbaşkanı Recep Tayyip Erdoğan, Cumhurbaşkanlığı personeli ile Cumhurbaşkanlığı Sarayı'da gerçekleşen iftarda bir araya geldi.","['Cumhurbaşkanı Recep Tayyip Erdoğan', 'Cumhurbaşkanlığı Sarayı']",,,,Videos2
video_642.mp4,https://www.youtube.com/watch?v=bK-_4cFpTyY,"Cumhurbaşkanı Erdoğan, Eski Milletvekilleri ile İftar Sofrasında Bir Araya Geldi| 30.06.15",895,2015-07-01 00:00:00,"Cumhurbaşkanı Recep Tayyip Erdoğan, önceki dönemlerde Türkiye Büyük Millet Meclisi (TBMM) çatısı altında halkın temsilcisi olarak görev yapmış, yaklaşık 600 eski milletvekili ile iftar sofrasında bir araya geldi. Cumhurbaşkanlığı Sarayı’nda gerçekleşen iftarın ardından Cumhurbaşkanı Erdoğan, davetlilere hitaben bir konuşma yaptı","['Cumhurbaşkanı Recep Tayyip Erdoğan', 'Türkiye Büyük Millet Meclisi (TBMM', 'Cumhurbaşkanlığı Saray', 'Recep Tayyip Erdoğan']",,,,Videos2
video_643.mp4,https://www.youtube.com/watch?v=6GZupkAlnlU,"Vakıf Geleneği, Kardeşliğimizin En Kuvvetli Bağını Oluşturuyor| 28.06.15",837,2015-06-28 00:00:00,"İstanbul’da Ensar Vakfı’nın iftar programında konuşan Cumhurbaşkanı Erdoğan, “Vakıflarımız ve derneklerimiz, bizim en güçlü sivil toplum örgütlerimiz olarak, ülkemizin her köşesinde, milletimizin her kesimine çok önemli, çok hayırlı hizmetler veriyor” dedi.","['Cumhurbaşkanı Erdoğan', 'Ensar Vakfı', 'İstanbul', 'Cumhurbaşkanı Recep Tayyip Erdoğan', 'Recep Tayyip Erdoğan']",,,,Videos2
video_644.mp4,https://www.youtube.com/watch?v=bFQa3aZE5ws,"DEAŞ Terör Örgütü ile Türkiye’yi Aynı Paranteze Almak, Namertlik ve Alçaklıktır|27.06.15",1327,2015-06-28 00:00:00,"Cumhurbaşkanı Recep Tayyip Erdoğan, Birlik Vakfı Ankara Şubesi’nin düzenlediği iftar programına katıldı.","['Cumhurbaşkanı Recep Tayyip Erdoğan', 'Birlik Vakfı', 'Ankara', 'Recep Tayyip Erdoğan', 'Turkey (Country)']",,,,Videos2
video_645.mp4,https://www.youtube.com/watch?v=q-i7m7Xp5Pg,Kimse Türkiye’yi Terör Örgütleriyle Yan Yana Gösteremez|26.06.15,1197,2015-06-28 00:00:00,"Büyük Kalpler Buluşuyor” adını taşıyan ve Haliç Kongre Merkezi’nde gerçekleşen programda, Türk Kızılayı’nın yurt içi ve yurt dışı insanî yardım operasyonlarında bağışlarıyla ihtiyaç sahiplerinin yüzlerini güldüren 180’in üzerinde hayırsever, altın madalyalarını Cumhurbaşkanı Erdoğan’ın elinden aldı.","['Cumhurbaşkanı Erdoğan', 'Türk Kızılayı', 'Haliç Kongre Merkezi']",,,,Videos2
video_646.mp4,https://www.youtube.com/watch?v=EKeAxo9Jlh4,Türkiye’yi Terörle Aynı Çizgide Göstermek Kimsenin Hakkı ve Haddi Değildir| 25.0615,841,2015-06-28 00:00:00,"Cumhurbaşkanı Recep Tayyip Erdoğan, İstanbul’da Anadolu Aslanları İşadamları Derneği’nin (ASKON) iftar programına katıldı.","['Cumhurbaşkanı Recep Tayyip Erdoğan', 'Recep Tayyip Erdoğan', 'Anadolu Aslanları İşadamları Derneği’', 'ASKON']",,,,Videos2
video_647.mp4,https://www.youtube.com/watch?v=vI9xs_OI9Rg,"Cumhurbaşkanı Erdoğan, Muhtarlarla İftar Sofrasında Buluştu| 24.06.15",1808,2015-06-25 00:00:00,"Cumhurbaşkanı Recep Tayyip Erdoğan, Muhtarlarla Buluşma toplantılarının 7’ncisini, Cumhurbaşkanlığı Sarayı’nda düzenlenen iftarda gerçekleştirdi.","['Cumhurbaşkanı Erdoğan', 'Muhtarlarla Buluşma', 'Cumhurbaşkanlığı Sarayı']",,,,Videos2
video_648.mp4,https://www.youtube.com/watch?v=6AXcWLx3YMk,"Cumhurbaşkanı Erdoğan, Orucunu Çelik Ailesiyle Açtı |23.06.15",100,2015-06-23 00:00:00,"Cumhurbaşkanı Recep Tayyip Erdoğan, eşi Emine Erdoğan ile birlikte, Ankara Doğantepe Mahallesi’nde ikamet eden Çelik ailesinin iftar sofrasına konuk oldu.","['Cumhurbaşkanı Recep Tayyip Erdoğan', 'Emine Erdoğan', 'Ankara', 'Doğantepe Mahallesi’', 'Çelik ailesi', 'Recep Tayyip Erdoğan (Politician)', 'President Of Turkey (Government Office Or Title)']",,,,Videos2
video_649.mp4,https://www.youtube.com/watch?v=JFTvdWPd7bk,"Cumhurbaşkanı Erdoğan, TBMM’de 25. Dönem Milletvekilli Yemin Törenine Katıldı |23.06.15",238,2015-06-23 00:00:00,"Cumhurbaşkanı Recep Tayyip Erdoğan, Türkiye Büyük Millet Meclisi’nde 25. dönem milletvekillerinin yemin törenine katıldı. TBMM’de resmî törenle karşılanan Cumhurbaşkanı Erdoğan, kendisine ayrılan locada açılış konuşmasını ve yemin törenini izledi.","['Cumhurbaşkanı Recep Tayyip Erdoğan', 'ürkiye Büyük Millet Meclisi', 'TBMM', 'President Of Turkey (Government Office Or Title)', 'Grand National Assembly Of Turkey (Organization Founder)']",,,,Videos2
video_650.mp4,https://www.youtube.com/watch?v=2NszwBjvjns,"Cumhurbaşkanı Erdoğan, Diyanet İşleri Başkanı Görmez ve İlim Adamları ile İftar Yaptı| 22.06.15",52,2015-06-22 00:00:00,"Cumhurbaşkanı Recep Tayyip Erdoğan, Diyanet İşleri Başkanı Prof. Dr. Mehmet Görmez ve beraberindeki ilim adamlarını, Cumhurbaşkanlığı Sarayı’ndaki iftar yemeğinde ağırladı.","['Cumhurbaşkanı Recep Tayyip Erdoğan', 'Diyanet İşleri', 'Diyanet İşleri Başkanı Prof. Dr. Mehmet Görmez', 'Cumhurbaşkanlığı Sarayı’', 'Mehmet Görmez (Religious Leader)', 'President Of Turkey (Government Office Or Title)', 'Recep Tayyip Erdoğan (Politician)']",,,,Videos2
video_651.mp4,https://www.youtube.com/watch?v=5kr-PJahUBI,"Cumhurbaşkanı Erdoğan, Türkiye İhracatçılar Meclisi’nin 22. Genel Kurulu’nda konuştu |21.06.15",1394,2015-06-22 00:00:00,"İstanbul Grand Tarabya Otel’de gerçekleşen toplantıda yaptığı konuşmada Cumhurbaşkanı Recep Tayyip Erdoğan, Türkiye İhracatçılar Meclisi 22. Genel Kurulu’nun ülkemiz, milletimiz, ekonomimiz için hayırlara vesile olması temennisini dile getirdi.","['Cumhurbaşkanı Erdoğan', 'İstanbul Grand Tarabya Otel', 'Türkiye İhracatçılar Meclisi’']",,,,Videos2
video_652.mp4,https://www.youtube.com/watch?v=pKvv75o8tlk,Herkes Egosunu  Kenara Koymalı; Bir An Önce Hükümet Kurulmalı|11.06.15,2022,2015-06-11 00:00:00,"Cumhurbaşkanı Recep Tayyip Erdoğan, Yurtdışı Türkler ve Akraba Topluluklar Başkanlığı Uluslararası Öğrenci Mezuniyet Töreni’ne katıldı.","['Cumhurbaşkanı Recep Tayyip Erdoğan', 'Yurtdışı Türkler ve Akraba Topluluklar Başkanlığı Uluslararası Öğrenci Mezuniyet Töreni']",,,,Videos2
video_653.mp4,https://www.youtube.com/watch?v=4oKOCVzg8aY,"Cumhurbaşkanı Erdoğan, ""Diriliş Ertuğrul"" Dizisinin Setini Ziyaret Etti |07.06.15",239,2015-06-08 00:00:00,"Cumhurbaşkanı Recep Tayyip Erdoğan, TRT’de yayınlanan ""Diriliş Ertuğrul"" dizisinin setini ziyaret etti.","['Cumhurbaşkanı Recep Tayyip Erdoğan', 'TRT', 'Diriliş Ertuğrul']",,,,Videos2
video_654.mp4,https://www.youtube.com/watch?v=9oaqhaG5AIY,"Seçimlerin, Ülkemiz ve Milletimiz İçin Hayırlı Olmasını Temenni Ediyorum| 07.06.2015",504,2015-06-08 00:00:00,"Cumhurbaşkanı Recep Tayyip Erdoğan, eşi Emine Erdoğan ile birlikte 25'inci Dönem Milletvekilliği Genel Seçimi için oyunu, İstanbul Küçük Çamlıca Saffet Çebi İlkokulu’nda kullandı.","['Cumhurbaşkanı Recep Tayyip Erdoğan', 'Emine Erdoğan', ""25'inci Dönem Milletvekilliği Genel Seçimi"", 'İstanbul Küçük Çamlıca Saffet Çebi İlkokulu’', 'İstanbu']",07.06.2015,title,,Videos2
video_655.mp4,https://www.youtube.com/watch?v=K7VoE4sJpxs,"Cumhurbaşkanı Erdoğan , |stanbul Ticaret Odası ödül töreninde konuştu 31.05.201",2326,2015-06-01 00:00:00,"İstanbul Ticaret Odası ödül töreninde konuşan Cumhurbaşkanı Erdoğan, 7 Haziran seçimlerine değinerek “Hem seçim sürecini hem de siyasi partilerin vaatlerini yakından takip ediyorum. Bazı siyası partilerin 1970, 1990 model popülist siyaset yöntemleriyle öne çıkmaya çalıştığını üzüntüyle görüyorum. Bu ülke popülizmden çok çekti” dedi.","['Cumhurbaşkanı Erdoğan', 'İstanbul Ticaret Odası', 'İstanbul Ticaret Odası ödül töreni']",,,,Videos2
video_656.mp4,https://www.youtube.com/watch?v=eOsG5GD4Na8,"Cumhurbaşkanı Erdoğan, İstanbul’un fethinin 562. yıl dönümü kutlamalarında konuşma yaptı|30.05.15",3730,2015-06-01 00:00:00,"İstanbul’un fethinin 562. yıl dönümü kutlamalarına katılan Cumhurbaşkanı Erdoğan, “Bu ülkede son ezan susmadan, son bayrak inmeden, tüten son ocak sönmeden amacınıza ulaşamayacaksınız. Boşuna Pensilvanya’daki sizi çok seven kuklanız üzerinden mesaj göndermeyin. Boşuna İstanbul’un fethine gönülden bağlı olmayı kompleks ve zillet diye aşağılamaya kalkmayın. Biz fethe, fetih ruhuna ve şehitlerimizin emanetine sonuna kadar sahip çıkacağız” dedi.","['Cumhurbaşkanı Erdoğan', 'İstanbul’un fethinin 562. yıl dönümü', 'İstanbul', 'İstanbul’un fethi', '562 Yıldır Yanan Fetih Işığı']",,,,Videos2
video_657.mp4,https://www.youtube.com/watch?v=IamfFslCkAY,"Türkiye’deki Huzur, 78 Milyon Vatandaşın Geleceğe İlişkin Umutlarını Artırıyor| 29.05.15",1099,2015-05-31 00:00:00,"Cumhurbaşkanı Recep Tayyip Erdoğan, Ziraat Katılım Bankası’nın İstanbul’da gerçekleştirilen açılış törenine katıldı.","['Cumhurbaşkanı Recep Tayyip Erdoğan', 'Ziraat Katılım Bankası', 'Recep Tayyip Erdoğan']",,,,Videos2
video_658.mp4,https://www.youtube.com/watch?v=Pj8YGSv5Ges,"Cumhurbaşkanı Erdoğan, Türkiye Otobüsçüler Federasyonu 4. Genel Kurulu’na Katıldı |28.05.15",1812,2015-05-28 00:00:00,"Cumhurbaşkanı Recep Tayyip Erdoğan, Ankara'da Türkiye Otobüsçüler Federasyonu 4. Genel Kurulu’na katıldı.","['Cumhurbaşkanı Recep Tayyip Erdoğan', 'Ankara', 'ürkiye Otobüsçüler Federasyonu']",,,,Videos2
video_659.mp4,https://www.youtube.com/watch?v=3t_gm2JRCAQ,Kökü Olmayanlar Esen Her Rüzgârın Önünde Sürüklenip Gitmeye Mahkûmdur| 27.05.15,1151,2015-05-27 00:00:00,"Beştepe’deki Arap Atı Tanıtım ve Hippoterapi Merkezi ile görüntülü bağlantıyla ülkemizin çeşitli yerlerinde bulunan TİGEM İşletmeleri'ndeki tesislerin toplu açılış töreninde konuşan Cumhurbaşkanı Erdoğan, medeniyetlerinden kopuk olanların bu tesisi eleştireceklerine işaret ederek, “Biz köklerimize, tarihimize, kültürümüze sahip çıkacağız. Ne diyoruz? Kökü mazide olan atiyiz. Eğer bu gerçekten hareket edersek güçlü oluruz” dedi.","['Cumhurbaşkanı Erdoğan', 'Arap Atı Tanıtım ve Hippoterapi Merkezi', 'TİGEM']",,,,Videos2
video_660.mp4,https://www.youtube.com/watch?v=-8kuf5ZHy8A,"Türkiye'nin Kalbine Giden Yol, İstanbul'un Gönlünü Fethetmekten Geçer| 26.05.15",2008,2015-05-26 00:00:00,"Üsküdar Belediyesi toplu açılış ve temel atma töreninde konuşan Cumhurbaşkanı Erdoğan, “Türkiye'nin tüm renkleri İstanbul'da toplanmıştır. İstanbul'a meftun olmayan Türkiye'ye yabancılaşır. İstanbul'u tanımayan Üsküp'ten Kerkük'e, Bahçesaray'dan Medine'ye kadar koca bir coğrafyaya bigâne kalır. Söylediklerinin İstanbul'da karşılığı olmayanların Türkiye'ye verecekleri hiçbir şey yoktur” dedi.","['Cumhurbaşkanı Erdoğan', 'Üsküdar Belediyesi toplu açılış ve temel atma töreni', 'Üsküdar Belediyesi']",,,,Videos2
video_661.mp4,https://www.youtube.com/watch?v=9A-W12gYZF4,"Enerji, Bir Rekabet Unsurundan Çok, Bir İş Birliği Unsuru Olmalıdır| 25.05.15",1326,2015-05-26 00:00:00,"6. Dünya Enerji Düzenleme Forumu’nda konuşan Cumhurbaşkanı Erdoğan, “Enerjinin artık çok ciddi bir küresel mesele olduğunu biliyoruz. Yine biliyoruz ki, küresel meseleler ancak ve ancak küresel gayretler sayesinde çözüme kavuşabilir. Sorunların küreselleştiği bir dünyada, dayanışmayı ve iş birliğini de küreselleştiremezsek, başarılı olamayız. Bu ilke, bilhassa enerji konusunda çok daha önemlidir” dedi.","['6. Dünya Enerji Düzenleme Forumu', 'Cumhurbaşkanı Erdoğan']",,,,Videos2
video_662.mp4,https://www.youtube.com/watch?v=MiH0_ncHwUM,Esnaf ile Sanatkârlarımız Bu Ülkenin ve Milletin Omurgasıdır|25.05.15,2073,2015-05-26 00:00:00,"İstanbul’da gerçekleştirilen Türkiye Esnaf Buluşması’nda konuşan Cumhurbaşkanı Erdoğan, “Esnafımızın, komşusunun siftahını düşünme hasletini, sözün senetten kıymetli olduğu anlayışını, hak edilmeyen kazancın insanı bedbaht edeceği kabulünü, yani Ahilik geleneğimizin kadim değerlerini mutlaka yaşatması gerekiyor” dedi.","['Cumhurbaşkanı Erdoğan', 'Türkiye Esnaf Buluşması', 'İstanbul’']",,,,Videos2
video_663.mp4,https://www.youtube.com/watch?v=fVP5-MdOMRw,"Kızılay, Dost-Düşman Herkesin Saygısını ve Hürmetini Kazanmış Bir Kurumumuzdur|23.03.15",1553,2015-05-25 00:00:00,"ATO Kongre Merkezi’nde gerçekleşen toplantıda yaptığı konuşmada Cumhurbaşkanı Erdoğan, Türk Kızılayı’nın Olağanüstü Genel Kurulu’nun başarılı geçmesini dileğini ifade etti.","['Cumhurbaşkanı Erdoğan', 'Türk Kızılayı', 'Kızılay']",,,,Videos2
video_664.mp4,https://www.youtube.com/watch?v=GGPhVD8136U,Kürt Sorunu Yoktur; Kürt Kardeşlerimin Sorunları Vardır | 23.03.15,2806,2015-05-25 00:00:00,"Cumhurbaşkanı Recep Tayyip Erdoğan; Bartın, Giresun, Gümüşhane, Kastamonu, Nevşehir, Kayseri, Ordu, Sinop, Sivas ve Zonguldak’tan gelen 397 muhtar ile bir araya geldi.","['Kürt Sorunu', 'umhurbaşkanı Recep Tayyip Erdoğan', 'Recep Tayyip Erdoğan', 'muhtar']",,,,Videos2
video_665.mp4,https://www.youtube.com/watch?v=oKoyVdZpHMc,"Cumhurbaşkanı Erdoğan, Denizkurdu 2015 Tatbikatı'na Katıldı | 23.05.15",292,2015-05-25 00:00:00,"Cumhurbaşkanı Recep Tayyip Erdoğan’ın, katılımıyla Deniz Kuvvetleri Komutanlığının Denizkurdu 2015 Tatbikatı'nın ""Seçkin gözlemci günü"" Ege Denizi’nin Türk karasularında gerçekleştirildi.","['Cumhurbaşkanı Recep Tayyip Erdoğan’', 'Deniz Kuvvetleri Komutanlığının Denizkurdu 2015 Tatbikatı']",,,,Videos2
video_666.mp4,https://www.youtube.com/watch?v=qUc9F1pBdjs,Fatih Projesi’yle Eğitimde Çok Güçlü ve Kaliteli Bir Altyapı Kuruyoruz | 22.0515,2687,2015-05-22 00:00:00,"Milli Eğitim Bakanlığı Fatih Projesi kapsamında gerçekleştirilen tablet dağıtım töreninde konuşan Cumhurbaşkanı Erdoğan, “Fatih Projesi sadece tablet bilgisayarlardan ibaret değil. Bilgisayarlarla birlikte etkileşimli tahtayı, çok fonksiyonlu yazıcıyı, fiber optik interneti de kapsıyor. Bu altyapıyı tamamlayacak şekilde her derse özgü eğitim içeriği hazırlanıyor. Videolarla, görsellerle dersler daha anlaşılır, daha zevkli hale getiriliyor” dedi.","['Cumhurbaşkanı Erdoğan', 'atih Projesi', 'Milli Eğitim Bakanlığı', 'Milli Eğitim Bakanlığı Fatih Projesi']",,,,Videos2
video_667.mp4,https://www.youtube.com/watch?v=YyyXB31Ri-s,Başkanlık Sistemine Geçildiğinde Çok Başlılık Ortadan Kalkacaktır |25.03.15,1966,2015-05-22 00:00:00,"Cumhurbaşkanı Recep Tayyip Erdoğan, Türkiye Pazarcılar, Meyveciler ve Sebzeciler Federasyonu üyeleri ile pazarcı esnafının sorunlarının ele alındığı toplantıda bir araya geldi.","['Cumhurbaşkanı Recep Tayyip Erdoğan', 'ürkiye Pazarcılar', 'Meyveciler ve Sebzeciler Federasyonu']",,,,Videos2
video_668.mp4,https://www.youtube.com/watch?v=zHwWbnlPPrA,"Cumhurbaşkanı Erdoğan, Yargıtay Başkanı Cirit'i Ziyaret Etti |26.03.15",48,2015-05-22 00:00:00,"Cumhurbaşkanı Recep Tayyip Erdoğan, Yargıtay Büyük Genel Kurulu’nca 10 Şubat’ta birinci başkanlığa seçilen İsmail Rüştü Cirit'i ziyaret etti.","['Cumhurbaşkanı Recep Tayyip Erdoğan', 'Yargıtay Büyük Genel Kurulu', 'İsmail Rüştü Cirit', 'Yargıtay Başkanı Cirit']",,,,Videos2
video_669.mp4,https://www.youtube.com/watch?v=e2KRJvjUg00,"Cumhurbaşkanı Erdoğan, Suriyeli Çocuklar İçin Düzenlenen Yardım Kampanyasına Katıldı|28.03.15",23,2015-05-22 00:00:00,"Cumhurbaşkanı Recep Tayyip Erdoğan, Üsküdar Belediyesi tarafından Suriyeli çocuklar için düzenlenen, ""Onları Mutlu Etmek Çocuk Oyuncağı"" kampanyasına katıldı.","['Cumhurbaşkanı Recep Tayyip Erdoğan', 'Üsküdar Belediyesi', 'Üsküdar', 'Suriyeli Çocuklar']",,,,Videos2
video_670.mp4,https://www.youtube.com/watch?v=DhBYXxF02fI,"Cumhurbaşkanı Erdoğan,Tokatlılar buluşmasında bir konuşma yaptı.|29.03.2015",1746,2015-05-22 00:00:00,"Sinan Erdem Spor Salonu’nda gerçekleştirilen Tokatlılar Buluşması’nda konuşan Cumhurbaşkanı Erdoğan, bölgemizde yaşanan gelişmelerin, tarihi akıştan bağımsız olmadığını ifade ederek, “Bizim son 12 yıldır yaşadıklarımız asla bin  yıllık mücadeleden ayrı değildir. Bugün Suriye’de, Irak’ta, Mısır’da, Filistin’de, Libya’da yaşananlar da bunun bir parçasıdır. Aynı şekilde Çözüm Süreci ile üstesinden gelmeye çalıştığımız mesele de aynı mücadelenin bir parçasıdır” dedi.","['Cumhurbaşkanı Erdoğan', 'Tokatlılar buluşması']",29.03.2015,title,,Videos2
video_671.mp4,https://www.youtube.com/watch?v=QU2Q6TlR4JI,Bu Coğrafyada Bin Yıldır Yaşadığımız Hadiselerden Bağımsız Değildir,31,2015-05-22 00:00:00,"Bugün Yaşadığımız Sıkıntılar, Bu Coğrafyada Bin Yıldır Yaşadığımız Hadiselerden Bağımsız Değildir","['Cumhurbaşkanı Erdoğan', 'Tokatlılar Buluşması']",,,,Videos2
video_672.mp4,https://www.youtube.com/watch?v=-LSoGjRJsfY,Türkiye Uzay Çalışmaları Konusunda İddia Sahibi Ülkeler Arasına Girdi|,1260,2015-05-22 00:00:00,"TUSAŞ Uzay Sistemleri Entegrasyon ve Test Merkezi’nin açılış töreninde konuşan Cumhurbaşkanı Erdoğan, “Bugün artık TUSAŞ, havacılık alanında dünyanın en önemli kuruluşlarından biri durumunda. Devler ligi denen dünyanın en büyük 100 savunma sanayii şirketi listesine giren TUSAŞ, ülkemizin gurur kaynağı haline geldi. Hedefimiz, bu listeye en az 20 şirketle girmektir” dedi.","['Cumhurbaşkanı Erdoğan', 'TUSAŞ Uzay Sistemleri Entegrasyon ve Test Merkezi’']",,,,Videos2
video_673.mp4,https://www.youtube.com/watch?v=9gvc6mh8wdE,Cumhurbaşkanı Erdoğan’dan Şehit Savcı Kiraz’ın Ailesine Taziye Ziyareti|01.04.15,283,2015-05-21 00:00:00,"İstanbul Adliyesi’ndeki terör saldırısı sonucu şehit edilen savcı Mehmet Selim Kiraz’ın ailesine taziye ziyaretinde bulunan Cumhurbaşkanı Erdoğan, “Gün birlik ve beraberlik günüdür. Adeta millî bir duruşun olması gereken gündür. Bu konularda hassas olmamız gerekiyor ve inancımızın bize emrettiği istikamette inşallah bu yürüyüşümüzü devam ettireceğiz” dedi.","['Cumhurbaşkanı Erdoğan', 'Şehit Savcı Kiraz']",,,,Videos2
video_674.mp4,https://www.youtube.com/watch?v=_WUcPF_6GDA,"Cumhurbaşkanı Erdoğan, Anayasa Mahkemesi Başkanı Arslan’ı Ziyaret Etti|02.04.15",60,2015-05-21 00:00:00,"nayasa Mahkemesi’ne gelişinde Cumhurbaşkanı Recep Tayyip Erdoğan’ı, Başkan Zühtü Arslan ve Anayasa Mahkemesi Genel Sekreteri Selim Erdem karşıladı.","['Cumhurbaşkanı Erdoğan', 'Anayasa Mahkemesi Başkanı Arslan']",,,,Videos2
video_675.mp4,https://www.youtube.com/watch?v=7dCvTKA-R_8,"Milletler, Tarihlerinden Aldıkları Güçle Yaşarlar | 19.05.15",2945,2015-05-20 00:00:00,"19 Mayıs Gençlik ve Spor Bayramı nedeniyle 81 ilden ve Kuzey Kıbrıs Türk Cumhuriyeti’nden gelen gençleri kabulünde konuşan Cumhurbaşkanı Erdoğan, tarihin milletler için çok önemli bir yeri olduğuna değinerek, “Tarih hem bir ibret vesikasıdır hem de kudrettir, güçtür. Milletler gelecek tasavvurlarını buna göre şekillendirirler. 'Biz ne idik' sorusunun cevabı aynı zamanda 'biz neyiz' ve 'ne olabiliriz' sorusunun cevabına da ışık tutar” dedi.","['Cumhurbaşkanı Erdoğan', '19 Mayıs Gençlik ve Spor Bayramı', 'cumhurbaşkanlığı sarayı', 'Kuzey Kıbrıs Türk Cumhuriyeti']",,,transcription_675.txt,Videos2
video_676.mp4,https://www.youtube.com/watch?v=qtKznud-4FY,"Cumhurbaşkanı  Erdoğan,  Rekreasyon Alanı’nın açılış törenine katıldı.| 19.05.2015",2983,2015-05-20 00:00:00,"Keçiören’de gerçekleştirilen törende yaptığı konuşmada Cumhurbaşkanı Erdoğan, kendisinin gönlünde müstesna bir yeri olduğunu söylediği Keçiören’de 12 yıl ikamet ettiğini ve burada çok farklı anılarının olduğunu belirterek Keçiören’in tarihinin, bir anlamda Türkiye’nin tarihi olduğunu söyledi.","['Cumhurbaşkanı Erdoğan', 'Keçiören', 'Esertepe Rekreasyon Alan']",19.05.2015,title,,Videos2
video_677.mp4,https://www.youtube.com/watch?v=435pU8V2gks,Avrupa Parlamentosu Başkanı Schulz Cumhurbaşkanlığı Sarayı’nda |08.04.15,37,2015-05-18 00:00:00,"Cumhurbaşkanı Recep Tayyip Erdoğan, Avrupa Parlamentosu Başkanı Martin Schulz'u Cumhurbaşkanlığı Sarayı’nda kabul etti.","['Cumhurbaşkanı Recep Tayyip Erdoğan', 'rupa Parlamentosu Başkanı Martin Schulz']",,,,Videos2
video_678.mp4,https://www.youtube.com/watch?v=g_m60ZUVC10,"Bugün Mursi'ye Verilen İdam Cezası, Sandığa Verilmiş Bir İdam Cezasıdır | 17.15.15",2164,2015-05-18 00:00:00,"160 farklı ülkeden gelen gençlerin yer aldığı, 8. Uluslararası Öğrenci Buluşması’nda konuşan Cumhurbaşkanı Erdoğan, Mısır’daki idam kararlarını eleştirerek, “Darbeyle yıkılan sadece Mısır demokrasisi değil, onunla birlikte umutlarını demokrasiye bağlayan tüm dünyadır” dedi.","['Cumhurbaşkanı Erdoğan', 'Mısır’']",,,,Videos2
video_679.mp4,https://www.youtube.com/watch?v=eHLc0aSmTqw,Gömülmek İstendiğimiz Mezardan Çıktık | 09.04.15,2541,2015-05-15 00:00:00,"Ankara’da düzenlenen ödül töreninde yaptığı konuşmada Cumhurbaşkanı Recep Tayyip Erdoğan, tören vesilesiyle katılımcılarla bir arada bulunmaktan duyduğu memnuniyeti dile getirdi.","['Cumhurbaşkanı Recep Tayyip Erdoğan', 'Recep Tayyip Erdoğan', 'Türk Patent Ödülleri Töreni']",,,,Videos2
video_680.mp4,https://www.youtube.com/watch?v=vYH8hXiUn9k,"Yeni Türkiye Mücadelemiz, Bizim Kızıl Elmamızdır | 10.04.2015",653,2015-05-15 00:00:00,"Cumhurbaşkanı Recep Tayyip Erdoğan, Yeni Türkiye Stratejik Araştırma Merkezi’nin açılış törenine katıldı.","['Cumhurbaşkanı Recep Tayyip Erdoğan', 'eni Türkiye Stratejik Araştırma Merkezi']",10.04.2015,title,,Videos2
video_681.mp4,https://www.youtube.com/watch?v=Bsug3LRys6w,"Tarihçilerin İşini Din Adamları Aldığı Zaman, Oradan Hakikat Değil, Hezeyan Çıkar",2478,2015-05-15 00:00:00,"Cumhurbaşkanlığı Sarayı’nda gerçekleştirilen kabulde yaptığı konuşmada Cumhurbaşkanı Erdoğan, Türkiye İhracatçılar Meclisi’nin tüm üyelerine, bugüne kadar gösterdikleri başarı ve ülkemizin gelişmesine yaptıkları katkılar için teşekkür etti.","['Cumhurbaşkanlığı Sarayı’', 'Cumhurbaşkanı Erdoğan', 'ürkiye İhracatçılar Meclisi’']",,,,Videos2
video_682.mp4,https://www.youtube.com/watch?v=QshXsKC6g2Y,"Bugün Çıkmaza Sürüklenen İnsanlık, Düştüğü Kör Kuyudan Kurtarılmayı Bekliyor | 18.04.2015",590,2015-05-14 00:00:00,"Haliç Kongre Merkezi’nde düzenlenen ‘Siyer-i Nebi Yarışması’ ödül töreninde konuşan Cumhurbaşkanı Erdoğan, “Peygamberimizi anlamak, anlatmak ve bunu kendine dert edinmek, dertlerin en güzelidir. Bizler eğer rehberimizin izinden hakkıyla gidiyor olsaydık, coğrafyamızda bunca zulüm yaşanmaz, kan akmaz, gözyaşı dökülmezdi” dedi.","['Haliç Kongre Merkezi', 'Cumhurbaşkanı Erdoğan']",18.04.2015,title,,Videos2
video_683.mp4,https://www.youtube.com/watch?v=kO67XVKCun4,"Cumhurbaşkanı Erdoğan, TİKA toplu açılış töreni | 07.05.15",2360,2015-05-13 00:00:00,"TİKA tarafından 19 milyon dolarlık yatırımla 6 ülkede yapılan 6 eserin toplu açılış törenine katılan Cumhurbaşkanı Erdoğan, Türkiye’nin yüzünü ağartan bu projeleri hayata geçiren TİKA’yı tebrik ettiğini kaydederek, “Dünyanın en az gelişmiş 49 ülkesine son 6 yılda yaptığımız 1,5 milyar dolarlık yardımı anlayabilmenin yolu, dönüp vicdanınıza bakmaktır. Dünyanın dört bir yanında yardım yaptığımız herkese önce insan nazarıyla bakıyoruz” dedi.","['TİKA', 'Cumhurbaşkanı Erdoğan']",,,,Videos2
