video_filename,url,title,length_seconds,publish_date,description,keywords,date,date_src,transcription_filename,folder
video_330.mp4,https://www.youtube.com/watch?v=QDnGymvl_jA,“15 Temmuz’un En Büyük Kahramanlarından Biri de Gençlerimizdir”,1610,2017-05-29 00:00:00,"Ensar Vakfı’nın 38. Genel Kuruluna katılan Cumhurbaşkanı Erdoğan, burada yaptığı konuşmada, “15 Temmuz’un en büyük kahramanlarından biri de gençlerimizdir. Geçmişteki o acı hatıraları bizzat yaşamadıkları hâlde darbe teşebbüsü anlaşılır anlaşılmaz takdire şayan bir sezgiyle gençlerimiz hemen harekete geçtiler, tankların altından girip üstünden çıkmaktan, darbeci hainlerin üzerlerine gidip işgal ettikleri yerleri kurtarmaya kadar gençlerimiz hep ön saftaydılar” dedi.",[],28.05.2017,tccb_videos,,Videos2
video_331.mp4,https://www.youtube.com/watch?v=_Z33gcvJ7sM,"“İmam Hatiplere Olan İlgi Zorlamanın Değil, Gönül Bağının Eseridir”",1881,2017-05-28 00:00:00,"ÖNDER İmam Hatip Gençlik Buluşması’nda konuşan Cumhurbaşkanı Erdoğan, “Mesleki eğitim sistemimizi felç etme pahasına İmam Hatiplere uygulanan ayrımcılık ayıbını unutmadık, unutmayacağız. 28 Şubat döneminin ürünü olan bu ayıbı biz ortadan kaldırdık. Böylece, öğrenci sayıları 600 binden 60 binlere kadar düşürülmüş okullarımızın kapılarına vurulan zincirleri, millet olarak hep birlikte parçaladık. Bir asırdır yeşeren umutları yeniden canlandırdık. Milletimizin evlatlarını değerleriyle, tarihiyle, kültürüyle yeniden buluşturduk” dedi.",[],26.05.2017,tccb_videos,,Videos2
video_332.mp4,https://www.youtube.com/watch?v=MKdmfZqsoVg,Uluslararası Kur’an-ı Kerim Güzel Okuma Yarışması Finalistlerinden Kur’an-ı Kerim Tilaveti,1698,2017-05-25 00:00:00,Uluslararası Kur’an-ı Kerim Güzel Okuma Yarışması finalistleri  Beştepe Millet Kültür ve Kongre Merkezi’nde Kuran-ı Kerim tilavetinde bulundu.,[],,,,Videos2
video_333.mp4,https://www.youtube.com/watch?v=PCQ-wgOC5TY,"""NATO Müttefiklerinin Dayanışma ve İş Birliği İçinde Olması Zorunludur""",995,2017-05-25 00:00:00,"NATO Devlet ve Hükümet Başkanları Toplantısı’na katılmak üzere Belçika’nın başkenti Brüksel’e hareketi öncesi basın toplantısında konuşan Cumhurbaşkanı Erdoğan, küresel terör sorununa değinerek, ""Son aylarda St. Petersburg, Stockholm, Paris ve Manchester’da yaşanan terör saldırıları, terörün bölgesel bir mesele olmadığını bize göstermektedir. Terörün panzehri ise kesinlikle dayanışmadır "" dedi.",[],,,,Videos2
video_334.mp4,https://www.youtube.com/watch?v=Ntc5_xStaWo,“Kuran’ı Anlamak Hayatımızı Daha da Zenginleştirecektir”,1036,2017-05-25 00:00:00,"Uluslararası Kur’an-ı Kerim Güzel Okuma Yarışması Finali’ne katılan Cumhurbaşkanı Erdoğan, yaptığı konuşmada “Bize düşen, bitmez tükenmez bir ilim, hikmet ve saadet kaynağı olan Kuran’la rabıtamızı her daim güçlü tutmaktır. Bir Müslüman olarak vazifemiz, günlük hayatın içinde her an yıpranan, kararan, örselenen ruhlarımızı Kur’an-ı Kerim tilaveti ile tedavi etmektir” dedi.",[],,,,Videos2
video_335.mp4,https://www.youtube.com/watch?v=h9afvvBF4uA,"“İş Dünyamızın Lokomotifliği Olmadan, Hedeflerimize Ulaşmamız Mümkün Değildir”",1662,2017-05-25 00:00:00,"TOBB 73. Genel Kurulu’na katılarak bir konuşma yapan Cumhurbaşkanı Erdoğan, “Ülkemizde bizim kadar iş dünyasıyla, esnaf ve sanatkârlarımızla, toplumumuzun her kesimiyle yakın ilişki içinde olan bir başka siyasi hareketin olduğunu sanmıyorum. Her sabah ekmek teknesini besmele ile açıp, akşama kadar nafakasını çıkarmak için ter döken, esnaf ve sanatkârımızın daima yanında yer aldık” dedi.",[],24.05.2017,tccb_videos,,Videos2
video_336.mp4,https://www.youtube.com/watch?v=nAAJy5zsJoA,"“Dil, Kültür ve Medeniyetin Köşe Taşıdır”",1678,2017-05-24 00:00:00,"8. Uluslararası Türk Dili Kurultayı’nda konuşan Cumhurbaşkanı Erdoğan, “Dilini kaybeden bir toplumun, diğer değerlerini koruması çok zordur, hatta mümkün değildir. Kültürlere ve medeniyetlere saldırılar önce dilden başlıyor. Dilini aldığı anda o milleti çökertiyor. Goethe, ‘Bir millete, o milletin diliyle oynamaktan daha büyük suikast olamaz’ diyor. Biz işte böyle bir suikasta maruz kalmış bir milletiz. Bu saldırı, dilimizle birlikte onun mütemmim cüzü olan şahsiyetimizi, millî karakterimizi de hedef almıştır” dedi.",[],23.05.2017,tccb_videos,,Videos2
video_337.mp4,https://www.youtube.com/watch?v=beM4aWgtMWo,“İngiltere Devletinin ve İngiliz Halkının Acısını Paylaşıyoruz”,1309,2017-05-23 00:00:00,"İstanbul Üniversitesi Tıp Fakültesi’nin mezuniyet töreninde konuşan Cumhurbaşkanı Erdoğan, İngiltere’de gerçekleşen terör saldırısına değinerek, “İngiltere’de meydana gelen terör saldırısını şiddetle kınıyorum. Terör örgütleriyle mücadelesinde, tüm ülkeler gibi İngiltere’nin de yanındayız” dedi.",[],,,,Videos2
video_338.mp4,https://www.youtube.com/watch?v=2Nc4vvnmf14,"“KEİ’yi Dünya Çapında Bir Kuruluş Hâline Getirmiş Olmamız, Üye Ülkelerin Başarısıdır”",399,2017-05-23 00:00:00,"Türkiye’nin ev sahipliğinde gerçekleşen Karadeniz Ekonomik İşbirliği Örgütünün (KEİ) 25. kuruluş yıl dönümü zirvesi oturumunun ardından basın toplantısı düzenleyen Cumhurbaşkanı Erdoğan, burada yaptığı konuşmada, “Türkiye, Karadeniz bölgesinin huzuru ve refahını sağlamak için yapılacak çalışmaları desteklemeye devam edecek” dedi.",[],22.05.2017,tccb_videos,,Videos2
video_339.mp4,https://www.youtube.com/watch?v=woGkLJWHDqM,"“Karadeniz’in Barış, İstikrar ve Refah İçinde Kalkınması Hepimizin Ortak Amacı Olmalıdır”",702,2017-05-23 00:00:00,"KEİ 25. Kuruluş Yıldönümü Zirvesi’nin açılışında konuşan Cumhurbaşkanı Erdoğan, “Bölge ülkeleri arasında elbette birtakım siyasi, hatta askerî sorunlar olabilir. Biz, Karadeniz Ekonomik İşbirliği Örgütü'nü bu sorunlardan ne kadar uzakta tutabilirsek, o denli verimli çalışmasını sağlayabiliriz. Daha da ileri gidip örgütü bu sorunların çözümünde etkin bir araç hâline getirmemiz gerektiğini düşünüyorum” dedi.",[],,,,Videos2
video_340.mp4,https://www.youtube.com/watch?v=SZ_HJgVLZ9A,"Cumhurbaşkanı Erdoğan, AK Parti Genel Başkanlığına Seçildi",900,2017-05-23 00:00:00,"AK Parti 3. Olağanüstü Büyük Kongresinde Genel Başkanlığa seçilen Cumhurbaşkanı Erdoğan, yaptığı teşekkür konuşmasında “Yeni dönemde her bakımdan çok daha büyük işler başarmanın mücadelesini vereceğiz. Önümüzdeki aylar Türkiye’nin terörle mücadeleden ekonomiye, hak ve özgürlüklerin genişletilmesinden yatırımlara kadar her alanda adeta bir sıçrama dönemi olacaktır. Bunun için kaybedecek bir anımız bile yoktur” dedi.",[],,,,Videos2
video_341.mp4,https://www.youtube.com/watch?v=eOMWudifiiE,"""Bir Kez Daha Fatihamızı Okuyor, Daha Büyük Hedefler İçin Yeni Bir Başlangıç Yapıyoruz”",6609,2017-05-23 00:00:00,"AK Parti 3. Olağanüstü Büyük Kongresinde konuşan Cumhurbaşkanı Erdoğan, “Gönül kazanmayı oy kazanmak kadar önemli gördüğümüz için, içeride ve dışarıda maruz kaldığımız onca saldırıya rağmen dimdik ayakta durabildik. ‘İnsani yaşat ki devlet yaşasın’ anlayışına sıkı sıkıya sarıldığımız için tüm zor zamanlarımızda milletimizi yanımızda bulduk. Bu ülkede güvenlik kaygılarıyla demokrasi taleplerinin aynı anda karşılanabileceğini gösterebildiğimiz için 81 vilayetimizin tamamında karşılık bulan tek parti olabildik” dedi.",[],,,,Videos2
video_342.mp4,https://www.youtube.com/watch?v=NMFGkYCX7JQ,"Cumhurbaşkanı Erdoğan, AK Parti 3. Olağanüstü Büyük Kongresine Katıldı",238,2017-05-23 00:00:00,"Ankara Arena Spor Salonunda gerçekleşen kongreye eşi Emine Erdoğan ile birlikte gelen Cumhurbaşkanı Recep Tayyip Erdoğan, girişte yaptığı selamlama konuşmada “Sevgili yol arkadaşlarım; sizleri 998 gün sonra en kalbi duygularla selamlıyorum. Fiili bir ayrılığımız vardı, ama bugün yine sizlerle beraberiz” dedi.",[],,,,Videos2
video_343.mp4,https://www.youtube.com/watch?v=VWCundekJ3k,“Medeniyet Birikimiyle İrtibatını Koparan Bir Ülke Fikrî Kuraklığa Maruz Kalır”,1858,2017-05-23 00:00:00,"İbn Haldun Üniversitesi resmî açılış töreni ve 4. Uluslararası İbn Haldun Sempozyumu’nda konuşan Cumhurbaşkanı Erdoğan, “Nasıl kökleriyle bağı kopan bir çınar kurursa, medeniyet birikimiyle irtibatını koparan bir ülke de fikrî kuraklığa maruz kalır. Yüzyıllara sarih ilim deryasından istifade etmeden özgün eserler verilemez. Geçmişi yok sayarak geleceğe yürünemez. Bu ülke ne çektiyse, aşağılık kompleksinden çekmiştir. Bu millete en büyük zulmü, bağrından çıktığı toplumun değerlerine düşman, yasakçı, baskıcı jakobenler yapmıştır” dedi.",[],20.05.2017,tccb_videos,,Videos2
video_344.mp4,https://www.youtube.com/watch?v=GfL6LKEcR1E,"“19 Mayıs, Türk Tarihindeki Sayısız Yeniden Başlangıçlardan Biridir”",3049,2017-05-20 00:00:00,"19 Mayıs nedeniyle gençlerle bir araya gelen Cumhurbaşkanı Erdoğan, yaptığı konuşmada “19 Mayıs, Türk tarihindeki sayısız yeni başlangıçlardan biridir, rastgele değildir. Bu başlangıç, önce bizi İstiklal Harbimizi zaferle sonuçlandırmaya, ardından yeni devletimiz olan Cumhuriyetimizi kurmaya götürmüştür. Özgürlük mücadelemiz, farklı görünümler altında Cumhuriyet tarihimiz boyunca da kesintisiz sürmüştür. Terör örgütleri önceleri nöbetleşe son dönemde ise topyekûn bir şekilde ülkemizi hiç boş bırakmamışlardır” dedi.",[],19.05.2017,tccb_videos,,Videos2
video_345.mp4,https://www.youtube.com/watch?v=u307UMpzOoY,“2053 ve 2071 Vizyonlarımızı Emanet Ettiğimiz Gençliğimize İnanıyorum”,1644,2017-05-08 00:00:00,"Uluslararası Münazara Turnuvası ödül töreninde konuşan Cumhurbaşkanı Erdoğan, “Bize sorgusuz, sualsiz biat eden, cahil bir gençlik değil; neye inandığını, neyi savunduğunu, neyin mücadelesini verdiğini bilen, bunun için gereken her türlü donanıma sahip bir gençlik lazımdır. 15 Temmuz gecesi gördük ki işte bu vasıflara sahip gençlik, gerektiğinde ülkesi ve milleti için, istiklali ve istikbali için gözünü kırpmadan canını dahi ortaya koyabilmektedir” dedi.",[],07.05.2017,tccb_videos,,Videos2
video_346.mp4,https://www.youtube.com/watch?v=K00t6MJaqL4,"“Mukaddes Emanetlere Ev Sahipliği Yapmamız, En Büyük İftihar Kaynaklarımızdan Biridir”",975,2017-05-08 00:00:00,"Mukaddes Emanetler Işığında Sergi ve Konferansı’nda konuşan Cumhurbaşkanı Erdoğan, “Mukaddes emanetlere kıyamete kadar, canımız pahasına sahip çıkmakta kararlıyız"" dedi.",[],06.05.2017,tccb_videos,,Videos2
video_347.mp4,https://www.youtube.com/watch?v=SAFfh1wcq8Y,“Gençlerimiz 15 Temmuz'da Ecdatlarına Layık Olduklarını İspatladı”,1516,2017-05-08 00:00:00,"İstanbul Gençlik Festivali’ne katılarak, gençlere hitap eden Cumhurbaşkanı Erdoğan, “Gençlerimiz 15 Temmuz'da Ulubatlı Hasan'dan gelen selamı alarak, tankların, silahların, uçakların, helikopterlerin karşısına aslanlar gibi dikildiklerinde, ecdatlarına layık olduklarını ispatlamışlardır. Hem erkeğiyle hem bayanıyla... Tankların altına girdiler mi? Girdiler. Yıldılar mı? Yılmadılar. ‘Ben Nene Hatun'un torunuyum. Ben Fatih'in torunuyum.’ dediler” şeklinde konuştu.",[],04.05.2017,tccb_videos,,Videos2
video_348.mp4,https://www.youtube.com/watch?v=biJ-7XSWGAM,"“Suriye Vekalet Savaşlarına Sahne Olduğu Sürece, Terör Örgütleri Zemin Kazanmaya Devam Edecektir”",1647,2017-05-04 00:00:00,"Rusya Federasyonu Devlet Başkanı Putin ile ortak basın toplantısı düzenleyen Cumhurbaşkanı Erdoğan, Suriye’de yaşananlara değinerek, “Bizim için temel öncelik, akan kanın durdurulması, Suriye’nin toprak bütünlüğünün ve siyasi birliğinin korunmasıdır” dedi.",[],03.05.2017,tccb_videos,,Videos2
video_349.mp4,https://www.youtube.com/watch?v=Wk4nudJjcog,“Türkiye-Rusya İlişkilerinin Eski Seviyesinin Üstüne Çıkması İçin Yoğun Çaba Harcıyoruz”,1030,2017-05-04 00:00:00,"Rusya’ya hareketinden önce Esenboğa Havalimanında basın mensuplarına açıklamalarda bulunan Cumhurbaşkanı Erdoğan, “Ekonomik ve ticari ilişkilerimizi dengeli bir şekilde geliştirmenin gayreti içerisindeyiz. Bunun önündeki en büyük engel, Türkiye’ye uygulanan ekonomik ve ticari kısıtlamalardır. Bu konuda başbakan yardımcılarımız seviyesindeki görüşmeler sürüyor. Görüşmeler sonucunda tüm ekonomik ve ticari sıkıntıların ivedilikle çözüme kavuşturulması gayretlerimiz arasındadır” dedi.",[],,,,Videos2
video_350.mp4,https://www.youtube.com/watch?v=TY7IWWZUuR0,"“Kurucusu Olduğum AK Parti’ye, Sevdama Bugün Yeniden Dönüyorum”",3309,2017-05-03 00:00:00,"16 Nisan halk oylaması ile kabul edilen Anayasa değişikliği sonrası Adalet ve Kalkınma Partisi’ne (AK Parti) tekrar üye olan Cumhurbaşkanı Erdoğan, yaptığı konuşmada “27 Ağustos 2014 tarihinde, milletimiz tarafından Cumhurbaşkanlığı görevine seçilmem sebebiyle, Anayasa gereği ayrılmak zorunda kaldığım; kurucusu olduğum partime, yuvama, sevdama, aşkıma bugün yeniden dönüyorum. Tam 979 gün sonra bu hasret, hamdolsun sona eriyor. Bugün burada bir kez daha ‘selamünaleyküm’ diyerek heyetinizin içine tekrar dâhil oluyorum” dedi.",[],02.05.2017,tccb_videos,,Videos2
video_351.mp4,https://www.youtube.com/watch?v=YBItT5Cp64I,“Kuzey Suriye'de Bir Devlet Kuruluşuna Asla Müsaade Etmeyiz”,3266,2017-04-29 00:00:00,"Atlantik Konseyi Zirvesi’nde konuşan Cumhurbaşkanı Erdoğan, “Güney sınırımız boyunca bir terör koridorunun oluşmasına asla izin vermeyeceğiz. Hele hele Kuzey Suriye'de bir devlet kurma teşebbüsü içerisine giren malum bazı cahiller var, 'Cahil cesur olur.' diyorlar ya o da o havalarda, kendine göre bakanlar kurulu oluşturuyor vesaire... Biz bunları karşılıksız bırakmayız ve Kuzey Suriye'de böyle bir devlet kuruluşuna da asla müsaade etmeyiz. Çünkü Suriye'nin bölünmesine karşıyız. Suriye'nin toprak bütünlüğünün korunmasından yanayız” dedi.",[],28.04.2017,tccb_videos,,Videos2
video_352.mp4,https://www.youtube.com/watch?v=DAzQ9ZEi0pw,"“Türkiye, Demokrasi ve Hukuk Devleti Konusundaki Kararlılığını 15 Temmuz’da İbra Etmiştir”",616,2017-04-29 00:00:00,"Anayasa Mahkemesi'nin kuruluş yıl dönümü gala yemeğine katılan Cumhurbaşkanı Erdoğan, AKPM’nin siyasi denetim kararına ilişkin “Fransa olağanüstü hâl şartlarında seçime gidince ses çıkarmayanların, üstelik de bir darbe girişiminin ardından Türkiye aynı yöntemi uyguladı diye bizi yeniden denetim sürecine almaları, en hafif ifadesiyle ayıptır. Tarih en büyük hakemdir, bugünler gelip geçecek; ama herkesin doğruları ve yanlışları bir ibret vesikası olarak ortada kalacaktır. Biz Türkiye olarak, doğru bildiğimiz yolda kararlılıkla ilerlemeyi sürdüreceğiz” dedi.",[],27.04.2017,tccb_videos,,Videos2
video_353.mp4,https://www.youtube.com/watch?v=lUV_P1MRxQ8,“Büyüklerin Yol Açtığı Savaşların Faturası Çocuklara Kesilmesin”,863,2017-04-21 00:00:00,"23 Nisan Uluslararası Çocuk Şenliği’ne katılan dünya çocukları ile bir araya gelen Cumhurbaşkanı Erdoğan, “Suriye ve Irak'ta savaşın, Somali başta olmak üzere Afrika'nın çeşitli yerlerinde açlığın pençesinde kıvranan tüm çocuklara buradan şahsım, sizler ve ülkemin çocukları adına selamlarımızı gönderiyorum. Kalplerimiz ve dualarımız onlarladır. Büyüklerin yol açtığı savaşların faturası çocuklara kesilmesin. Büyüklerin vurdumduymazlığının bedelini, minik bedenler ödemesin” dedi.",[],20.04.2017,tccb_videos,,Videos2
video_354.mp4,https://www.youtube.com/watch?v=8mo6oilyWso,"“Yeni Sistemin Kazananı, Milletimiz ve Ülkemiz Olmuştur”",1827,2017-04-18 00:00:00,"Cumhurbaşkanlığı Külliyesinde vatandaşlara hitap eden Cumhurbaşkanı Erdoğan, “25 milyon 200 bine yakın vatandaşımızın tercihiyle anayasa değişikliği kabul edilmiştir. Dolayısıyla artık bu konuyla ilgili tüm tartışmalar bitmiştir. Türkiye tarihinin en büyük oy sayısıyla kabul edilen anayasa değişikliğiyle gelen yenilikler artık tüm milletimizin hizmetindedir. Bundan sonra yönümüzü hep birlikte geleceğe çevirme zamanıdır” dedi.",[],17.04.2017,tccb_videos,,Videos2
video_355.mp4,https://www.youtube.com/watch?v=qyvyR3TRcHY,“Yedi Düvele Karşı Mücadele Verdik”,451,2017-04-18 00:00:00,"Ankara Esenboğa Havalimanı'nda vatandaşlara hitap eden Cumhurbaşkanı Erdoğan, halk oylaması sürecinde verilen mücadeleyi yedi düveye karşı verilen bir mücadele olarak değerlendirerek, “Batıda Haçlı zihniyeti bize saldırdı, içeride de uşakları saldırdı. Fakat yılmadık, usanmadık, milletçe dimdik durduk. Çünkü biz sadece Mevlamızın huzurunda rükûda ve secdede eğiliriz. Önümüzde atacağımız, çok önemli adımlar var” dedi.",[],,,,Videos2
video_356.mp4,https://www.youtube.com/watch?v=-5yIFRZr9iU,"Cumhurbaşkanı Erdoğan, Başbakan Adnan Menderes'in Kabrini Ziyaret Etti",163,2017-04-17 00:00:00,"Merhum Adnan Menderes, Fatin Rüştü Zorlu ve Hasan Polatkan'ın naaşlarının bulunduğu anıt mezara giden Cumhurbaşkanı Recep Tayyip Erdoğan, burada  tilavet edilen Kur’an-ı Kerim dinleyerek yapılan duaya katıldı.",[],,,,Videos2
video_357.mp4,https://www.youtube.com/watch?v=yhGukA44WJs,"Cumhurbaşkanı Erdoğan, Başbakan Necmettin Erbakan'ın Kabrini Ziyaret Etti",67,2017-04-17 00:00:00,"23. Başbakan merhum Necmettin Erbakan'ın Merkezefendi'deki kabrine giden Cumhurbaşkanı Recep Tayyip Erdoğan, ziyaret vesilesiyle düzenlenen anmaya iştirak etti.",[],,,,Videos2
video_358.mp4,https://www.youtube.com/watch?v=YQvkN6567aI,"Cumhurbaşkanı Erdoğan,  Cumhurbaşkanı Turgut Özal’ı Anma Törenine Katıldı",888,2017-04-17 00:00:00,"Cumhurbaşkanı Recep Tayyip Erdoğan,  8. Cumhurbaşkanı Turgut Özal’ın vefatının 24. yılında düzenlenen anma törenine katıldı.Merhum Özal’ın metfun olduğu, İstanbul Topkapı’da yer alan Anıt Mezarda düzenlenen törende; Türkiye Büyük Millet Meclisi (TBMM) Başkanı İsmail Kahraman, Enerji ve Tabii Kaynaklar Bakanı Berat Albayrak, İstanbul Valisi Vasip Şahin, İstanbul Büyükşehir Belediye Başkanı Kadir Topbaş ve merhum Özal’ın aile üyeleri de hazır bulundu.",[],,,,Videos2
video_359.mp4,https://www.youtube.com/watch?v=5E7uPcmrfZo,“Terör Örgütlerini Ülkemizden Kazımak İçin Her Alanda Büyük Bir Mücadele Başlattık”,2887,2017-04-14 00:00:00,"‘Ordu Buluşması’ programında konuşan Cumhurbaşkanı Erdoğan, “Sadece terör örgütleriyle değil, son yıllarda ekonomide de içeriden ve dışarıdan ayağımıza pek çok çelme takıldı. Bu çok yönlü saldırılar karşısında, ‘en iyi savunma hücumdur’ anlayışıyla, kabuğumuza çekilmek yerine sahaya girmeye karar verdik. Terör örgütlerini ülkemizden kazımak için kamudan özel sektöre, sivil toplum örgütlerinden eğitime kadar her alanda büyük bir mücadele başlattık” dedi.",[],13.04.2017,tccb_videos,,Videos2
video_360.mp4,https://www.youtube.com/watch?v=XTOQC_ba1zY,“Avrupa’nın Yüzündeki Makyaj Dökülüyor”,2784,2017-04-14 00:00:00,"‘Giresun Buluşması’ programında konuşan Cumhurbaşkanı Erdoğan, bazı Avrupa ülkelerinin 16 Nisan halk oylaması süreciyle ilgili takındıkları tavra dikkat çekerek, “Bizim bakanlarımıza kapanan kapılar, dikkat edin Avrupa’da teröristlere sonuna kadar açıldı. Bizim bakanlarımızı polis zoruyla sınır dışına çıkartanlar, teröristlere polis korumasında gösteri yaptırdılar. Ne yaparlarsa yapsınlar, Avrupa’nın yüzündeki makyaj dökülüyor, altındaki o faşist, ırkçı, yabancı karşıtı İslam düşmanı bir yüz kendini göstermeye başlıyor” dedi.",[],13.04.2017,tccb_videos,,Videos2
video_361.mp4,https://www.youtube.com/watch?v=lsBNfr0MKVg,“Ülkenin Birliğini Bozanlara Tarihî Bir Ders Veriyoruz”,3708,2017-04-13 00:00:00,"‘Erzurum Buluşması’ programında konuşan Cumhurbaşkanı Erdoğan, “16 Nisan, inşallah bu ülkede terörün kilidinin kırıldığı bir gün olacaktır. Şu anda Tendürek'te, Gabar'da, Cudi'de, Bestler Dereler'de inlerine girdik. 20 ayda, 10 bini aşkın teröristi etkisiz hâle getirdik. Bu ülkenin huzurunu kaçıranlara, bu ülkenin birliğini, beraberliğini bozanlara, bu ümmeti parçalamaya çalışanlara tarihî bir ders veriyoruz, vermeye devam edeceğiz” dedi.",[],,,,Videos2
video_362.mp4,https://www.youtube.com/watch?v=y73L0QrOr6c,“Terör Örgütlerinin Sınırlarımızın Dibinde Bayrak Sallamasına İzin Vermeyiz”,3333,2017-04-13 00:00:00,"“Şanlıurfa Buluşması” programında konuşan Cumhurbaşkanı Erdoğan, “Biz bu ülkeyi öyle masa başında, pazarlıkla kendimize vatan kılmış bir millet değiliz. Bu ülkenin her karış toprağında kanımız var, alın terimiz var. Sınırımızın ötesindeki kardeşlerimizin can güvenliği, huzuru, geleceği bizim için en az kendimizinki kadar önemlidir. Çünkü bizim oralarda da dökülmüş kanımız, akıtılmış alın terimiz vardır” dedi.",[],11.04.2017,tccb_videos,,Videos2
video_363.mp4,https://www.youtube.com/watch?v=J7RmRSYuYZ0,“Ana Muhalefet Partisi FETÖ’nün Safsatalarına Borazanlık Yapıyor”,3986,2017-04-13 00:00:00,"‘Çorum Buluşması’ programında konuşan Cumhurbaşkanı Erdoğan, ana muhalefet liderinin kontrollü darbe iddialarına karşı “Ana muhalefet partisinin görevi, FETÖ’nün safsatalarına borazanlık yapmak mıdır? CHP’nin misyonu, 15 Temmuz gecesi suçüstü yakalanan FETÖ’nün katillerini aklamak mıdır? Bunlar tıpkı freni patlamış kamyon gibi nereye gittiklerini, ne yöne savrulduklarını bilmiyorlar” dedi.",[],,,,Videos2
video_364.mp4,https://www.youtube.com/watch?v=IJ-jorF9OgQ,"“Avrupa, Türkiye’yi Kendinden Görmüyor”",4366,2017-04-10 00:00:00,"Cumhurbaşkanı Erdoğan, ‘İzmir Buluşması’ programında yaptığı konuşmada “Biz kendimizi asla Avrupa’nın dışında görmedik. Ama 54 yıl bunlar bizi Avrupa Birliği’ne almadılar. Ha şimdi o zaman yeni bir dönem başlayacak. İşte 16 Nisan bu kararı gözden geçirmenin günüdür. Türkiye hem fiziken, hem fiilen bir Avrupa ülkesi. Sorun, Avrupa’nın bizi kendinden görmek istememesidir” dedi.",[],09.04.2017,tccb_videos,,Videos2
video_365.mp4,https://www.youtube.com/watch?v=is-OYQ-Kcuc,“Yeni Yönetim Sistemi Tarihten ve Kültürden Süzülüp Gelen Bir Birikimin İfadesi”,3976,2017-04-09 00:00:00,"‘İstanbul Buluşması’ programında konuşan Cumhurbaşkanı Erdoğan, milletin güven ve inancıyla 14 yıldır Türkiye'ye hizmet için gece gündüz çalışıp mücadele ettiklerini belirterek, “Bu süreçte her seçimimiz ayrı bir mücadeleyle geçti. 2007 yılında Anayasayı ve teamülleri çiğneme pahasına bizi Cumhurbaşkanı seçtirmemek istediler. CHP her dönemde olduğu gibi o gün de Türkiye'nin önünü tıkadı. Biz de 'madem öyle, işte böyle' dedik. Bundan sonra 'Bu ülkenin Cumhurbaşkanını millet seçecek' dedik, restimizi çektik” dedi.",[],,,,Videos2
video_366.mp4,https://www.youtube.com/watch?v=0teqbcUPP_M,“Avrupa’nın Artık Ne Dünyaya Ne de Bize Söyleyecek Sözü Kalmadı”,3235,2017-04-07 00:00:00,"Cumhurbaşkanı Erdoğan, Balıkesir’deki toplu açılış töreninde yaptığı konuşmada, “Bugün milyarlarca insanın gözünde Avrupa, demokrasi, insan hakları ve özgürlüklerin değil, baskının, şiddetin, Nazizmin merkezidir, bunu böyle biliniz. Irkçı partiler, Avrupalı liderleri, yönetimleri âdeta parmaklarında oynatıyor. Avrupa’nın artık ne dünyaya ne de bize söyleyecek sözü kalmıştır. Karşımızda her bakımdan çürüyen bir kıta var” dedi.",[],06.04.2017,tccb_videos,,Videos2
video_367.mp4,https://www.youtube.com/watch?v=SBoGnRmncH4,"“Bugünün Hasta Adamı, Artık Avrupa Birliği’dir”",3362,2017-04-06 00:00:00,"Cumhurbaşkanı Erdoğan, Bursa’daki toplu açılış töreninde yaptığı konuşmada, bazı Avrupa ülkelerindeki Türkiye karşıtı gelişmelere ilişkin “Biz demokrasiyi, insan haklarını, özgürlükleri onlar istediği için değil, kendi vatandaşlarımız bunlara layık olduğu için benimsiyor ve hayata geçiriyoruz ve bunu da onlardan çok daha iyi yapıyoruz. Türkiye her yolu ve yöntemi kullanarak saldıran bu insanlara gereken cevabı inşallah verecek. Fakat bakıyorum ki biz yıkılmayıp ayakta kaldıkça onların gücü, nefesi tükeniyor” dedi.",[],05.04.2017,tccb_videos,,Videos2
video_368.mp4,https://www.youtube.com/watch?v=fsc2RRO4p_Y,“Türkiye Böyle Bir Muhalefet Anlayışıyla Yoluna Devam Edemez”,4296,2017-04-05 00:00:00,"37. Muhtarlar Toplantısı’nda konuşan Cumhurbaşkanı Erdoğan, CHP’ye gönül vermiş vatandaşların böyle bir yönetimi hak etmediklerini düşündüğünü dile getirerek, “Halkından bu derece uzak, hakikatlere bu derece yabancı, kendi kurduğu sahte dünyaya hapsolmuş bir siyaset anlayışının akıbeti tıpkı 1990’lardaki parti kadroları gibi olacaktır. Milletimiz onları nasıl sandığa gömdüyse, bu anlayışın sonu da aynı olacaktır” dedi.",[],05.04.2017,tccb_videos,,Videos2
